[UI WORKER] Starting main.py backtesting cycle
[UI WORKER] config=C:\Users\sm598\Desktop\Applications\Development\Algo Trading\backtesting\ui_jobs\20260227_213713_aba5e8\config.json
{
  "strategies": [
    "Mabrouk2021"
  ],
  "pairs": [
    "EUR/USD",
    "USD/JPY",
    "GBP/USD",
    "USD/CHF",
    "AUD/USD",
    "USD/CAD",
    "NZD/USD",
    "USD/SGD",
    "EUR/GBP",
    "EUR/JPY",
    "EUR/CHF",
    "EUR/AUD",
    "EUR/CAD",
    "EUR/NZD",
    "GBP/JPY",
    "GBP/CHF",
    "GBP/AUD",
    "GBP/CAD",
    "GBP/NZD",
    "AUD/JPY",
    "AUD/CHF",
    "AUD/CAD",
    "AUD/NZD",
    "CAD/JPY",
    "CAD/CHF",
    "NZD/JPY",
    "NZD/CHF",
    "CHF/JPY",
    "EUR/SGD",
    "USD/SGD",
    "GBP/SGD",
    "AUD/SGD",
    "SGD/JPY",
    "NZD/SGD",
    "CAD/SGD",
    "CHF/SGD"
  ],
  "phase12_timeframes": [
    "2_hour",
    "4_hour",
    "1_day"
  ],
  "phase3_timeframes": [],
  "seeds": [
    42,
    1337,
    314,
    777,
    444
  ],
  "trials_by_timeframe": {
    "1_day": 500,
    "4_hour": 300,
    "2_hour": 300,
    "1_hour": 200,
    "30_minute": 200,
    "15_minute": 200,
    "5_minute": 200
  },
  "n_processes": 1,
  "phase2_top_percent": 10.0,
  "phase3_top_n": 30,
  "enable_phase1": true,
  "enable_phase2": true,
  "enable_phase3": true,
  "created_at": "2026-02-27T21:37:13"
}
[UI WORKER] Optuna logging set to WARNING for UI mode
[UI WORKER] strategies=['Mabrouk2021']
[UI WORKER] n_processes=1
[UI WORKER] pairs=36
[UI WORKER] phases=['phase1', 'phase2', 'phase3']
[UI WORKER] Running phase1...
[UI WORKER] phase1 jobs=540
[02/27/2026 21:37:18] [START STUDY] EUR/USD @ 2_hour
[I 2026-02-27 21:37:19,336] Using an existing study with name 'phase1_EURUSD_2_hour_Mabrouk2021_2024-11-06to2025-05-07_space-default_seed-42' instead of creating a new one.
[02/27/2026 21:37:19] [phase1_EURUSD_2_hour_Mabrouk2021_2024-11-06to2025-05-07_space-default_seed-42]: finished=78 to_run=222
[I 2026-02-27 21:37:21,683] Trial 82 finished with value: 64.7081 and parameters: {'model_key': 'linearsvm', 'svm.C': 0.4578588330184509, 'svm.max_iter': 1000, 'th.mode': 'asymmetric', 'th.long_enter': 0.30000000000000004, 'th.short_enter_abs': 0.0, 'th.hysteresis': 0.06, 'risk.tp_mode': 'none', 'risk.risk_pct': 0.01, 'risk.atr_mult': 1.0, 'features.target_count': 5, 'slot.trend.count': 1, 'slot.mom.count': 2, 'slot.vol.count': 1, 'slot.wild.count': 0, 'pool.broad.slot.trend.0.name': 'Ehlers Early Onset Trend', 'pool.broad.slot.mom.0.name': 'MACDFIX', 'pool.broad.slot.mom.1.name': 'METROFixed', 'pool.broad.slot.vol.0.name': 'William Vix-Fix', 'pool.broad.slot.wild.0.name': 'ADOSC', 'feat.trend.Ehlers Early Onset Trend.period': 30, 'feat.momentum.MACDFIX.signalperiod': 6, 'feat.momentum.METROFixed.period_rsi': 28, 'feat.momentum.METROFixed.step_size_fast': 3.0, 'feat.momentum.METROFixed.step_size_slow': 30.0, 'feat.volatility.William Vix-Fix.period': 30, 'feat.volume.ADOSC.fastperiod': 7, 'feat.volume.ADOSC.slowperiod': 16}. Best is trial 56 with value: 65.7867.
[I 2026-02-27 21:37:23,486] Trial 83 finished with value: 10.0055 and parameters: {'model_key': 'linearsvm', 'svm.C': 0.47039323408870287, 'svm.max_iter': 1400, 'th.mode': 'asymmetric', 'th.long_enter': 0.30000000000000004, 'th.short_enter_abs': 0.05, 'th.hysteresis': 0.06, 'risk.tp_mode': 'none', 'risk.risk_pct': 0.01, 'risk.atr_mult': 1.0, 'features.target_count': 5, 'slot.trend.count': 1, 'slot.mom.count': 2, 'slot.vol.count': 1, 'slot.wild.count': 0, 'pool.broad.slot.trend.0.name': 'Ehlers Early Onset Trend', 'pool.broad.slot.mom.0.name': 'MACDFIX', 'pool.broad.slot.mom.1.name': 'METROFixed', 'pool.broad.slot.vol.0.name': 'William Vix-Fix', 'pool.broad.slot.wild.0.name': 'Momentum Candles Modified w ATR', 'feat.trend.Ehlers Early Onset Trend.period': 30, 'feat.momentum.MACDFIX.signalperiod': 6, 'feat.momentum.METROFixed.period_rsi': 28, 'feat.momentum.METROFixed.step_size_fast': 10.0, 'feat.momentum.METROFixed.step_size_slow': 30.0, 'feat.volatility.William Vix-Fix.period': 30, 'feat.trend.Momentum Candles Modified w ATR.atr_period': 70, 'feat.trend.Momentum Candles Modified w ATR.atr_multiplier': 3.0}. Best is trial 56 with value: 65.7867.
[I 2026-02-27 21:37:25,535] Trial 84 finished with value: 64.571 and parameters: {'model_key': 'linearsvm', 'svm.C': 0.833217756330493, 'svm.max_iter': 1000, 'th.mode': 'asymmetric', 'th.long_enter': 0.30000000000000004, 'th.short_enter_abs': 0.1, 'th.hysteresis': 0.05, 'risk.tp_mode': 'none', 'risk.risk_pct': 0.01, 'risk.atr_mult': 1.0, 'features.target_count': 5, 'slot.trend.count': 1, 'slot.mom.count': 2, 'slot.vol.count': 1, 'slot.wild.count': 0, 'pool.broad.slot.trend.0.name': 'KalmanFilter', 'pool.broad.slot.mom.0.name': 'MACDFIX', 'pool.broad.slot.mom.1.name': 'METROFixed', 'pool.broad.slot.vol.0.name': 'William Vix-Fix', 'pool.broad.slot.wild.0.name': 'ADOSC', 'feat.trend.KalmanFilter.k': 2, 'feat.trend.KalmanFilter.sharpness': 50, 'feat.momentum.MACDFIX.signalperiod': 6, 'feat.momentum.METROFixed.period_rsi': 28, 'feat.momentum.METROFixed.step_size_fast': 3.0, 'feat.momentum.METROFixed.step_size_slow': 30.0, 'feat.volatility.William Vix-Fix.period': 30, 'feat.volume.ADOSC.fastperiod': 7, 'feat.volume.ADOSC.slowperiod': 16}. Best is trial 56 with value: 65.7867.
[I 2026-02-27 21:37:26,956] Trial 85 finished with value: 64.571 and parameters: {'model_key': 'linearsvm', 'svm.C': 0.8804137282837623, 'svm.max_iter': 1000, 'th.mode': 'asymmetric', 'th.long_enter': 0.30000000000000004, 'th.short_enter_abs': 0.1, 'th.hysteresis': 0.05, 'risk.tp_mode': 'none', 'risk.risk_pct': 0.01, 'risk.atr_mult': 1.0, 'features.target_count': 5, 'slot.trend.count': 1, 'slot.mom.count': 2, 'slot.vol.count': 1, 'slot.wild.count': 0, 'pool.broad.slot.trend.0.name': 'KalmanFilter', 'pool.broad.slot.mom.0.name': 'MACDFIX', 'pool.broad.slot.mom.1.name': 'METROFixed', 'pool.broad.slot.vol.0.name': 'William Vix-Fix', 'pool.broad.slot.wild.0.name': 'ADOSC', 'feat.trend.KalmanFilter.k': 2, 'feat.trend.KalmanFilter.sharpness': 50, 'feat.momentum.MACDFIX.signalperiod': 6, 'feat.momentum.METROFixed.period_rsi': 28, 'feat.momentum.METROFixed.step_size_fast': 3.0, 'feat.momentum.METROFixed.step_size_slow': 30.0, 'feat.volatility.William Vix-Fix.period': 30, 'feat.volume.ADOSC.fastperiod': 7, 'feat.volume.ADOSC.slowperiod': 16}. Best is trial 56 with value: 65.7867.
[I 2026-02-27 21:37:28,332] Trial 86 finished with value: 64.571 and parameters: {'model_key': 'linearsvm', 'svm.C': 1.0772655854516597, 'svm.max_iter': 1000, 'th.mode': 'asymmetric', 'th.long_enter': 0.30000000000000004, 'th.short_enter_abs': 0.1, 'th.hysteresis': 0.05, 'risk.tp_mode': 'none', 'risk.risk_pct': 0.01, 'risk.atr_mult': 1.0, 'features.target_count': 5, 'slot.trend.count': 1, 'slot.mom.count': 2, 'slot.vol.count': 1, 'slot.wild.count': 0, 'pool.broad.slot.trend.0.name': 'KalmanFilter', 'pool.broad.slot.mom.0.name': 'MACDFIX', 'pool.broad.slot.mom.1.name': 'METROFixed', 'pool.broad.slot.vol.0.name': 'William Vix-Fix', 'pool.broad.slot.wild.0.name': 'ADOSC', 'feat.trend.KalmanFilter.k': 2, 'feat.trend.KalmanFilter.sharpness': 50, 'feat.momentum.MACDFIX.signalperiod': 6, 'feat.momentum.METROFixed.period_rsi': 28, 'feat.momentum.METROFixed.step_size_fast': 3.0, 'feat.momentum.METROFixed.step_size_slow': 30.0, 'feat.volatility.William Vix-Fix.period': 30, 'feat.volume.ADOSC.fastperiod': 7, 'feat.volume.ADOSC.slowperiod': 16}. Best is trial 56 with value: 65.7867.
[I 2026-02-27 21:37:29,923] Trial 87 finished with value: 64.4692 and parameters: {'model_key': 'linearsvm', 'svm.C': 1.104040780719983, 'svm.max_iter': 1200, 'th.mode': 'asymmetric', 'th.long_enter': 0.25, 'th.short_enter_abs': 0.1, 'th.hysteresis': 0.05, 'risk.tp_mode': 'none', 'risk.risk_pct': 0.01, 'risk.atr_mult': 1.0, 'features.target_count': 5, 'slot.trend.count': 1, 'slot.mom.count': 2, 'slot.vol.count': 1, 'slot.wild.count': 0, 'pool.broad.slot.trend.0.name': 'ASO', 'pool.broad.slot.mom.0.name': 'MACDFIX', 'pool.broad.slot.mom.1.name': 'METROFixed', 'pool.broad.slot.vol.0.name': 'William Vix-Fix', 'pool.broad.slot.wild.0.name': 'ADOSC', 'feat.trend.ASO.period': 6, 'feat.momentum.MACDFIX.signalperiod': 6, 'feat.momentum.METROFixed.period_rsi': 28, 'feat.momentum.METROFixed.step_size_fast': 3.0, 'feat.momentum.METROFixed.step_size_slow': 30.0, 'feat.volatility.William Vix-Fix.period': 30, 'feat.volume.ADOSC.fastperiod': 7, 'feat.volume.ADOSC.slowperiod': 16}. Best is trial 56 with value: 65.7867.
[I 2026-02-27 21:37:31,251] Trial 88 finished with value: 64.5854 and parameters: {'model_key': 'linearsvm', 'svm.C': 1.0513165050726574, 'svm.max_iter': 1200, 'th.mode': 'asymmetric', 'th.long_enter': 0.25, 'th.short_enter_abs': 0.1, 'th.hysteresis': 0.05, 'risk.tp_mode': 'none', 'risk.risk_pct': 0.01, 'risk.atr_mult': 1.0, 'features.target_count': 5, 'slot.trend.count': 1, 'slot.mom.count': 2, 'slot.vol.count': 1, 'slot.wild.count': 0, 'pool.broad.slot.trend.0.name': 'KalmanFilter', 'pool.broad.slot.mom.0.name': 'MACDFIX', 'pool.broad.slot.mom.1.name': 'METROFixed', 'pool.broad.slot.vol.0.name': 'William Vix-Fix', 'pool.broad.slot.wild.0.name': 'ADOSC', 'feat.trend.KalmanFilter.k': 2, 'feat.trend.KalmanFilter.sharpness': 50, 'feat.momentum.MACDFIX.signalperiod': 6, 'feat.momentum.METROFixed.period_rsi': 28, 'feat.momentum.METROFixed.step_size_fast': 3.0, 'feat.momentum.METROFixed.step_size_slow': 30.0, 'feat.volatility.William Vix-Fix.period': 30, 'feat.volume.ADOSC.fastperiod': 7, 'feat.volume.ADOSC.slowperiod': 16}. Best is trial 56 with value: 65.7867.
[I 2026-02-27 21:37:32,670] Trial 89 finished with value: 64.571 and parameters: {'model_key': 'linearsvm', 'svm.C': 1.8668054576878035, 'svm.max_iter': 1400, 'th.mode': 'asymmetric', 'th.long_enter': 0.30000000000000004, 'th.short_enter_abs': 0.1, 'th.hysteresis': 0.05, 'risk.tp_mode': 'none', 'risk.risk_pct': 0.01, 'risk.atr_mult': 1.0, 'features.target_count': 5, 'slot.trend.count': 1, 'slot.mom.count': 2, 'slot.vol.count': 1, 'slot.wild.count': 0, 'pool.broad.slot.trend.0.name': 'KalmanFilter', 'pool.broad.slot.mom.0.name': 'MACDFIX', 'pool.broad.slot.mom.1.name': 'METROFixed', 'pool.broad.slot.vol.0.name': 'William Vix-Fix', 'pool.broad.slot.wild.0.name': 'ADOSC', 'feat.trend.KalmanFilter.k': 2, 'feat.trend.KalmanFilter.sharpness': 50, 'feat.momentum.MACDFIX.signalperiod': 6, 'feat.momentum.METROFixed.period_rsi': 28, 'feat.momentum.METROFixed.step_size_fast': 3.0, 'feat.momentum.METROFixed.step_size_slow': 30.0, 'feat.volatility.William Vix-Fix.period': 30, 'feat.volume.ADOSC.fastperiod': 7, 'feat.volume.ADOSC.slowperiod': 16}. Best is trial 56 with value: 65.7867.
[I 2026-02-27 21:37:33,867] Trial 90 finished with value: 64.028 and parameters: {'model_key': 'lr', 'lr.C': 0.012824420981127125, 'lr.max_iter': 1000, 'th.mode': 'asymmetric', 'th.long_enter': 0.25, 'th.short_enter_abs': 0.1, 'th.hysteresis': 0.05, 'risk.tp_mode': 'none', 'risk.risk_pct': 0.01, 'risk.atr_mult': 1.0, 'features.target_count': 5, 'slot.trend.count': 1, 'slot.mom.count': 2, 'slot.vol.count': 1, 'slot.wild.count': 0, 'pool.broad.slot.trend.0.name': 'KalmanFilter', 'pool.broad.slot.mom.0.name': 'MACDFIX', 'pool.broad.slot.mom.1.name': 'METROFixed', 'pool.broad.slot.vol.0.name': 'William Vix-Fix', 'pool.broad.slot.wild.0.name': 'ADOSC', 'feat.trend.KalmanFilter.k': 2, 'feat.trend.KalmanFilter.sharpness': 50, 'feat.momentum.MACDFIX.signalperiod': 6, 'feat.momentum.METROFixed.period_rsi': 28, 'feat.momentum.METROFixed.step_size_fast': 3.0, 'feat.momentum.METROFixed.step_size_slow': 30.0, 'feat.volatility.William Vix-Fix.period': 30, 'feat.volume.ADOSC.fastperiod': 7, 'feat.volume.ADOSC.slowperiod': 16}. Best is trial 56 with value: 65.7867.
[I 2026-02-27 21:37:35,273] Trial 91 finished with value: 0.0405 and parameters: {'model_key': 'linearsvm', 'svm.C': 0.8596252992908955, 'svm.max_iter': 1000, 'th.mode': 'asymmetric', 'th.long_enter': 0.2, 'th.short_enter_abs': 0.1, 'th.hysteresis': 0.04, 'risk.tp_mode': 'none', 'risk.risk_pct': 0.0125, 'risk.atr_mult': 1.0, 'features.target_count': 5, 'slot.trend.count': 1, 'slot.mom.count': 2, 'slot.vol.count': 1, 'slot.wild.count': 0, 'pool.broad.slot.trend.0.name': 'KalmanFilter', 'pool.broad.slot.mom.0.name': 'MACDFIX', 'pool.broad.slot.mom.1.name': 'CCI', 'pool.broad.slot.vol.0.name': 'William Vix-Fix', 'pool.broad.slot.wild.0.name': 'ADOSC', 'feat.trend.KalmanFilter.k': 2, 'feat.trend.KalmanFilter.sharpness': 50, 'feat.momentum.MACDFIX.signalperiod': 6, 'feat.momentum.CCI.timeperiod': 17, 'feat.volatility.William Vix-Fix.period': 30, 'feat.volume.ADOSC.fastperiod': 7, 'feat.volume.ADOSC.slowperiod': 16}. Best is trial 56 with value: 65.7867.
[I 2026-02-27 21:37:36,309] Trial 92 pruned. Insufficient activity: Trades_Per_Day=0.03 < prune_threshold=0.04.
[I 2026-02-27 21:37:37,532] Trial 93 finished with value: 2.5737 and parameters: {'model_key': 'linearsvm', 'svm.C': 1.5254585667920657, 'svm.max_iter': 1000, 'th.mode': 'asymmetric', 'th.long_enter': 0.30000000000000004, 'th.short_enter_abs': 0.15000000000000002, 'th.hysteresis': 0.04, 'risk.tp_mode': 'none', 'risk.risk_pct': 0.0125, 'risk.atr_mult': 1.0, 'features.target_count': 5, 'slot.trend.count': 1, 'slot.mom.count': 2, 'slot.vol.count': 1, 'slot.wild.count': 0, 'pool.broad.slot.trend.0.name': 'WMA', 'pool.broad.slot.mom.0.name': 'MACDFIX', 'pool.broad.slot.mom.1.name': 'SchaffTrendCycle', 'pool.broad.slot.vol.0.name': 'William Vix-Fix', 'pool.broad.slot.wild.0.name': 'BollingerBands', 'feat.baseline.WMA.period': 16, 'feat.momentum.MACDFIX.signalperiod': 10, 'feat.momentum.SchaffTrendCycle.period': 35, 'feat.momentum.SchaffTrendCycle.fast_ma_period': 7, 'feat.momentum.SchaffTrendCycle.slow_ma_period': 38, 'feat.momentum.SchaffTrendCycle.signal_period': 7, 'feat.volatility.William Vix-Fix.period': 14, 'feat.volatility.BollingerBands.nbdevup': 7, 'feat.volatility.BollingerBands.nbdevdn': 3, 'feat.volatility.BollingerBands.matype': 4}. Best is trial 56 with value: 65.7867.
[I 2026-02-27 21:37:39,036] Trial 94 finished with value: 4.179 and parameters: {'model_key': 'linearsvm', 'svm.C': 2.9921229869855677, 'svm.max_iter': 1200, 'th.mode': 'asymmetric', 'th.long_enter': 0.25, 'th.short_enter_abs': 0.1, 'th.hysteresis': 0.06, 'risk.tp_mode': 'none', 'risk.risk_pct': 0.01, 'risk.atr_mult': 1.0, 'features.target_count': 5, 'slot.trend.count': 1, 'slot.mom.count': 2, 'slot.vol.count': 1, 'slot.wild.count': 0, 'pool.broad.slot.trend.0.name': 'KalmanFilter', 'pool.broad.slot.mom.0.name': 'MAMA', 'pool.broad.slot.mom.1.name': 'BullsBearsImpulse', 'pool.broad.slot.vol.0.name': 'William Vix-Fix', 'pool.broad.slot.wild.0.name': 'GeominMA', 'feat.trend.KalmanFilter.k': 2, 'feat.trend.KalmanFilter.sharpness': 50, 'feat.momentum.MAMA.fastlimit': 0.4, 'feat.momentum.MAMA.slowlimit': 0.1, 'feat.momentum.BullsBearsImpulse.ma_period': 25, 'feat.volatility.William Vix-Fix.period': 22, 'feat.trend.GeominMA.length': 14, 'feat.trend.GeominMA.price': 3}. Best is trial 56 with value: 65.7867.
[I 2026-02-27 21:37:40,222] Trial 95 pruned. Insufficient activity: Trades_Per_Day=0.02 < prune_threshold=0.04.
[I 2026-02-27 21:37:41,517] Trial 96 finished with value: 64.6113 and parameters: {'model_key': 'linearsvm', 'svm.C': 2.2137349997947147, 'svm.max_iter': 1600, 'th.mode': 'asymmetric', 'th.long_enter': 0.30000000000000004, 'th.short_enter_abs': 0.1, 'th.hysteresis': 0.05, 'risk.tp_mode': 'none', 'risk.risk_pct': 0.01, 'risk.atr_mult': 1.0, 'features.target_count': 5, 'slot.trend.count': 1, 'slot.mom.count': 2, 'slot.vol.count': 1, 'slot.wild.count': 0, 'pool.broad.slot.trend.0.name': '2nd Order Gaussian High Pass Filter MTF Zones', 'pool.broad.slot.mom.0.name': 'MACDFIX', 'pool.broad.slot.mom.1.name': 'METROFixed', 'pool.broad.slot.vol.0.name': 'William Vix-Fix', 'pool.broad.slot.wild.0.name': 'ADOSC', 'feat.trend.2nd Order Gaussian High Pass Filter MTF Zones.alpha': 0.3, 'feat.momentum.MACDFIX.signalperiod': 6, 'feat.momentum.METROFixed.period_rsi': 28, 'feat.momentum.METROFixed.step_size_fast': 3.0, 'feat.momentum.METROFixed.step_size_slow': 30.0, 'feat.volatility.William Vix-Fix.period': 30, 'feat.volume.ADOSC.fastperiod': 7, 'feat.volume.ADOSC.slowperiod': 16}. Best is trial 56 with value: 65.7867.
[I 2026-02-27 21:37:45,316] Trial 97 finished with value: 65.2738 and parameters: {'model_key': 'linearsvm', 'svm.C': 2.694326715139018, 'svm.max_iter': 1000, 'th.mode': 'asymmetric', 'th.long_enter': 0.2, 'th.short_enter_abs': 0.1, 'th.hysteresis': 0.05, 'risk.tp_mode': 'none', 'risk.risk_pct': 0.01, 'risk.atr_mult': 1.0, 'features.target_count': 5, 'slot.trend.count': 1, 'slot.mom.count': 2, 'slot.vol.count': 1, 'slot.wild.count': 0, 'pool.broad.slot.trend.0.name': 'TopTrend', 'pool.broad.slot.mom.0.name': 'MACDFIX', 'pool.broad.slot.mom.1.name': 'METROFixed', 'pool.broad.slot.vol.0.name': 'William Vix-Fix', 'pool.broad.slot.wild.0.name': 'ADOSC', 'feat.trend.TopTrend.period': 50, 'feat.momentum.MACDFIX.signalperiod': 12, 'feat.momentum.METROFixed.period_rsi': 28, 'feat.momentum.METROFixed.step_size_fast': 3.0, 'feat.momentum.METROFixed.step_size_slow': 30.0, 'feat.volatility.William Vix-Fix.period': 30, 'feat.volume.ADOSC.fastperiod': 7, 'feat.volume.ADOSC.slowperiod': 16}. Best is trial 56 with value: 65.7867.
[I 2026-02-27 21:37:46,356] Trial 98 finished with value: 62.0463 and parameters: {'model_key': 'linearsvm', 'svm.C': 2.9254298004583235, 'svm.max_iter': 1200, 'th.mode': 'asymmetric', 'th.long_enter': 0.2, 'th.short_enter_abs': 0.15000000000000002, 'th.hysteresis': 0.05, 'risk.tp_mode': 'none', 'risk.risk_pct': 0.0125, 'risk.atr_mult': 1.0, 'features.target_count': 5, 'slot.trend.count': 1, 'slot.mom.count': 2, 'slot.vol.count': 1, 'slot.wild.count': 0, 'pool.broad.slot.trend.0.name': '2nd Order Gaussian High Pass Filter MTF Zones', 'pool.broad.slot.mom.0.name': 'Price Momentum Oscillator', 'pool.broad.slot.mom.1.name': 'IS Calculation', 'pool.broad.slot.vol.0.name': 'William Vix-Fix', 'pool.broad.slot.wild.0.name': 'CVI_Multi', 'feat.trend.2nd Order Gaussian High Pass Filter MTF Zones.alpha': 0.3, 'feat.momentum.Price Momentum Oscillator.one': 25, 'feat.momentum.Price Momentum Oscillator.two': 10, 'feat.momentum.Price Momentum Oscillator.period': 5, 'feat.momentum.IS Calculation.period': 20, 'feat.momentum.IS Calculation.nbchandelier': 20, 'feat.momentum.IS Calculation.lag': 5, 'feat.volatility.William Vix-Fix.period': 20, 'feat.volatility.CVI_Multi.length': 21, 'feat.volatility.CVI_Multi.method': 3, 'feat.volatility.CVI_Multi.use_modified': False}. Best is trial 56 with value: 65.7867.
[I 2026-02-27 21:37:48,046] Trial 99 finished with value: 65.4011 and parameters: {'model_key': 'linearsvm', 'svm.C': 8.04552215643245, 'svm.max_iter': 2000, 'th.mode': 'asymmetric', 'th.long_enter': 0.25, 'th.short_enter_abs': 0.25, 'th.hysteresis': 0.04, 'risk.tp_mode': 'none', 'risk.risk_pct': 0.01, 'risk.atr_mult': 1.0, 'features.target_count': 5, 'slot.trend.count': 1, 'slot.mom.count': 2, 'slot.vol.count': 1, 'slot.wild.count': 0, 'pool.broad.slot.trend.0.name': 'trend-lord-nrp-indicator', 'pool.broad.slot.mom.0.name': 'MACDFIX', 'pool.broad.slot.mom.1.name': 'METROFixed', 'pool.broad.slot.vol.0.name': 'William Vix-Fix', 'pool.broad.slot.wild.0.name': 'IS Calculation', 'feat.trend.trend-lord-nrp-indicator.length': 16, 'feat.trend.trend-lord-nrp-indicator.mode': 'smma', 'feat.trend.trend-lord-nrp-indicator.price': 'weighted', 'feat.trend.trend-lord-nrp-indicator.show_high_low': False, 'feat.momentum.MACDFIX.signalperiod': 12, 'feat.momentum.METROFixed.period_rsi': 28, 'feat.momentum.METROFixed.step_size_fast': 3.0, 'feat.momentum.METROFixed.step_size_slow': 30.0, 'feat.volatility.William Vix-Fix.period': 30, 'feat.momentum.IS Calculation.period': 14, 'feat.momentum.IS Calculation.nbchandelier': 5, 'feat.momentum.IS Calculation.lag': 3}. Best is trial 56 with value: 65.7867.
[I 2026-02-27 21:37:51,166] Trial 100 pruned. Insufficient activity: Trades_Per_Day=0.0 < prune_threshold=0.04.
[I 2026-02-27 21:37:53,139] Trial 101 finished with value: 65.1728 and parameters: {'model_key': 'linearsvm', 'svm.C': 5.301205024489562, 'svm.max_iter': 1600, 'th.mode': 'asymmetric', 'th.long_enter': 0.2, 'th.short_enter_abs': 0.25, 'th.hysteresis': 0.06, 'risk.tp_mode': 'none', 'risk.risk_pct': 0.0125, 'risk.atr_mult': 1.0, 'features.target_count': 5, 'slot.trend.count': 1, 'slot.mom.count': 2, 'slot.vol.count': 1, 'slot.wild.count': 0, 'pool.broad.slot.trend.0.name': 'GChannel', 'pool.broad.slot.mom.0.name': 'TTF', 'pool.broad.slot.mom.1.name': 'METROFixed', 'pool.broad.slot.vol.0.name': 'William Vix-Fix', 'pool.broad.slot.wild.0.name': 'TrendAkkam', 'feat.baseline.GChannel.length': 100, 'feat.baseline.GChannel.price': 'median', 'feat.momentum.TTF.ttf_bars': 12, 'feat.momentum.TTF.top_line': 70.0, 'feat.momentum.TTF.bottom_line': -70.0, 'feat.momentum.TTF.t3_period': 2, 'feat.momentum.METROFixed.period_rsi': 28, 'feat.momentum.METROFixed.step_size_fast': 3.0, 'feat.momentum.METROFixed.step_size_slow': 30.0, 'feat.volatility.William Vix-Fix.period': 30, 'feat.trend.TrendAkkam.akk_range': 200, 'feat.trend.TrendAkkam.ima_range': 10, 'feat.trend.TrendAkkam.akk_factor': 4.0, 'feat.trend.TrendAkkam.mode': 1, 'feat.trend.TrendAkkam.delta_price': 30.0, 'feat.trend.TrendAkkam.point': 0.1}. Best is trial 56 with value: 65.7867.
[I 2026-02-27 21:37:54,322] Trial 102 pruned. Insufficient activity: Trades_Per_Day=0.0 < prune_threshold=0.04.
[I 2026-02-27 21:37:55,410] Trial 103 pruned. Insufficient activity: Trades_Per_Day=0.02 < prune_threshold=0.04.
[I 2026-02-27 21:37:58,805] Trial 104 pruned. Insufficient activity: Trades_Per_Day=0.02 < prune_threshold=0.04.
[I 2026-02-27 21:38:02,296] Trial 105 pruned. Insufficient activity: Trades_Per_Day=0.0 < prune_threshold=0.04.
