[I 2026-02-27 21:38:04,156] Trial 106 finished with value: 64.7167 and parameters: {'model_key': 'linearsvm', 'svm.C': 4.3667505074949515, 'svm.max_iter': 1800, 'th.mode': 'asymmetric', 'th.long_enter': 0.2, 'th.short_enter_abs': 0.2, 'th.hysteresis': 0.04, 'risk.tp_mode': 'none', 'risk.risk_pct': 0.01, 'risk.atr_mult': 1.0, 'features.target_count': 5, 'slot.trend.count': 1, 'slot.mom.count': 2, 'slot.vol.count': 1, 'slot.wild.count': 0, 'pool.broad.slot.trend.0.name': 'ChandelierExit', 'pool.broad.slot.mom.0.name': 'MACDFIX', 'pool.broad.slot.mom.1.name': 'METROFixed', 'pool.broad.slot.vol.0.name': 'William Vix-Fix', 'pool.broad.slot.wild.0.name': 'MACDFIX', 'feat.trend.ChandelierExit.lookback': 7, 'feat.trend.ChandelierExit.atr_period': 21, 'feat.trend.ChandelierExit.atr_mult': 2.0, 'feat.momentum.MACDFIX.signalperiod': 12, 'feat.momentum.METROFixed.period_rsi': 28, 'feat.momentum.METROFixed.step_size_fast': 3.0, 'feat.momentum.METROFixed.step_size_slow': 30.0, 'feat.volatility.William Vix-Fix.period': 30, 'feat.trend.AROON.timeperiod': 10}. Best is trial 56 with value: 65.7867.
[I 2026-02-27 21:38:09,201] Trial 107 finished with value: 65.6425 and parameters: {'model_key': 'linearsvm', 'svm.C': 4.15926680964696, 'svm.max_iter': 1800, 'th.mode': 'asymmetric', 'th.long_enter': 0.15000000000000002, 'th.short_enter_abs': 0.2, 'th.hysteresis': 0.04, 'risk.tp_mode': 'none', 'risk.risk_pct': 0.01, 'risk.atr_mult': 1.0, 'features.target_count': 5, 'slot.trend.count': 1, 'slot.mom.count': 2, 'slot.vol.count': 1, 'slot.wild.count': 0, 'pool.broad.slot.trend.0.name': 'ChandelierExit', 'pool.broad.slot.mom.0.name': 'BullsBearsImpulse', 'pool.broad.slot.mom.1.name': 'METROFixed', 'pool.broad.slot.vol.0.name': 'William Vix-Fix', 'pool.broad.slot.wild.0.name': 'FantailVMA', 'feat.trend.ChandelierExit.lookback': 7, 'feat.trend.ChandelierExit.atr_period': 21, 'feat.trend.ChandelierExit.atr_mult': 2.0, 'feat.momentum.BullsBearsImpulse.ma_period': 20, 'feat.momentum.METROFixed.period_rsi': 28, 'feat.momentum.METROFixed.step_size_fast': 3.0, 'feat.momentum.METROFixed.step_size_slow': 30.0, 'feat.volatility.William Vix-Fix.period': 30, 'feat.volume.FantailVMA.adx_length': 8, 'feat.volume.FantailVMA.weighting': 1.5, 'feat.volume.FantailVMA.ma_length': 7}. Best is trial 56 with value: 65.7867.
[I 2026-02-27 21:38:14,422] Trial 108 finished with value: 39.8151 and parameters: {'model_key': 'linearsvm', 'svm.C': 4.274263123151151, 'svm.max_iter': 1800, 'th.mode': 'asymmetric', 'th.long_enter': 0.1, 'th.short_enter_abs': 0.2, 'th.hysteresis': 0.03, 'risk.tp_mode': 'none', 'risk.risk_pct': 0.01, 'risk.atr_mult': 1.0, 'features.target_count': 5, 'slot.trend.count': 1, 'slot.mom.count': 2, 'slot.vol.count': 1, 'slot.wild.count': 0, 'pool.broad.slot.trend.0.name': 'DetrendedSyntheticPriceGoscillators', 'pool.broad.slot.mom.0.name': 'BullsBearsImpulse', 'pool.broad.slot.mom.1.name': 'TSF', 'pool.broad.slot.vol.0.name': 'William Vix-Fix', 'pool.broad.slot.wild.0.name': 'FantailVMA', 'feat.trend.DetrendedSyntheticPriceGoscillators.dsp_period': 30, 'feat.trend.DetrendedSyntheticPriceGoscillators.price_mode': 'halow', 'feat.trend.DetrendedSyntheticPriceGoscillators.signal_period': 13, 'feat.momentum.BullsBearsImpulse.ma_period': 20, 'feat.momentum.TSF.timeperiod': 17, 'feat.volatility.William Vix-Fix.period': 30, 'feat.volume.FantailVMA.adx_length': 8, 'feat.volume.FantailVMA.weighting': 1.5, 'feat.volume.FantailVMA.ma_length': 7}. Best is trial 56 with value: 65.7867.
[I 2026-02-27 21:38:16,195] Trial 109 finished with value: 65.3576 and parameters: {'model_key': 'linearsvm', 'svm.C': 3.7614198472220046, 'svm.max_iter': 2000, 'th.mode': 'asymmetric', 'th.long_enter': 0.15000000000000002, 'th.short_enter_abs': 0.2, 'th.hysteresis': 0.04, 'risk.tp_mode': 'none', 'risk.risk_pct': 0.01, 'risk.atr_mult': 1.0, 'features.target_count': 5, 'slot.trend.count': 1, 'slot.mom.count': 2, 'slot.vol.count': 1, 'slot.wild.count': 0, 'pool.broad.slot.trend.0.name': 'ChandelierExit', 'pool.broad.slot.mom.0.name': 'BullsBearsImpulse', 'pool.broad.slot.mom.1.name': 'METROFixed', 'pool.broad.slot.vol.0.name': 'Volatility Ratio', 'pool.broad.slot.wild.0.name': 'trend-lord-nrp-indicator', 'feat.trend.ChandelierExit.lookback': 7, 'feat.trend.ChandelierExit.atr_period': 21, 'feat.trend.ChandelierExit.atr_mult': 2.0, 'feat.momentum.BullsBearsImpulse.ma_period': 35, 'feat.momentum.METROFixed.period_rsi': 28, 'feat.momentum.METROFixed.step_size_fast': 3.0, 'feat.momentum.METROFixed.step_size_slow': 30.0, 'feat.volatility.Volatility Ratio.period': 30, 'feat.volatility.Volatility Ratio.price': 'HL2', 'feat.trend.trend-lord-nrp-indicator.length': 12, 'feat.trend.trend-lord-nrp-indicator.mode': 'smma', 'feat.trend.trend-lord-nrp-indicator.price': 'typical', 'feat.trend.trend-lord-nrp-indicator.show_high_low': True}. Best is trial 56 with value: 65.7867.
[I 2026-02-27 21:38:17,084] Trial 110 pruned. Insufficient activity: Trades_Per_Day=0.03 < prune_threshold=0.04.
