[UI WORKER] Starting main.py backtesting cycle
[UI WORKER] config=C:\Users\sm598\Desktop\Applications\Development\Algo Trading\backtesting\ui_jobs\20260227_175653_b82610\config.json
{
  "strategies": [
    "NNFX"
  ],
  "pairs": [
    "EUR/USD",
    "USD/JPY",
    "GBP/USD",
    "USD/CHF",
    "AUD/USD",
    "USD/CAD",
    "NZD/USD",
    "USD/SGD",
    "EUR/GBP",
    "EUR/JPY",
    "EUR/CHF",
    "EUR/AUD",
    "EUR/CAD",
    "EUR/NZD",
    "GBP/JPY",
    "GBP/CHF",
    "GBP/AUD",
    "GBP/CAD",
    "GBP/NZD",
    "AUD/JPY",
    "AUD/CHF",
    "AUD/CAD",
    "AUD/NZD",
    "CAD/JPY",
    "CAD/CHF",
    "NZD/JPY",
    "NZD/CHF",
    "CHF/JPY",
    "EUR/SGD",
    "USD/SGD",
    "GBP/SGD",
    "AUD/SGD",
    "SGD/JPY",
    "NZD/SGD",
    "CAD/SGD",
    "CHF/SGD"
  ],
  "phase12_timeframes": [
    "2_hour",
    "4_hour",
    "1_day"
  ],
  "phase3_timeframes": [],
  "seeds": [
    42,
    1337,
    314,
    777,
    444
  ],
  "trials_by_timeframe": {
    "1_day": 500,
    "4_hour": 300,
    "2_hour": 300,
    "1_hour": 200,
    "30_minute": 200,
    "15_minute": 200,
    "5_minute": 200
  },
  "n_processes": 1,
  "phase2_top_percent": 10.0,
  "phase3_top_n": 30,
  "enable_phase1": true,
  "enable_phase2": true,
  "enable_phase3": true,
  "created_at": "2026-02-27T17:56:53"
}
[UI WORKER] strategies=['NNFX']
[UI WORKER] n_processes=1
[UI WORKER] pairs=36
[UI WORKER] phases=['phase1', 'phase2', 'phase3']
[UI WORKER] Running phase1...
[UI WORKER] phase1 jobs=540
[02/27/2026 17:56:58] [START STUDY] EUR/USD @ 2_hour
[I 2026-02-27 17:56:58,815] Using an existing study with name 'phase1_EURUSD_2_hour_NNFX_2024-11-06to2025-05-07_space-default_seed-42' instead of creating a new one.
[02/27/2026 17:56:58] [phase1_EURUSD_2_hour_NNFX_2024-11-06to2025-05-07_space-default_seed-42]: finished=51 to_run=249
[I 2026-02-27 17:57:05,866] Trial 56 finished with value: 6.4458 and parameters: {'ATR': 'FilteredATR', 'Baseline': 'T3MA', 'C1': 'AcceleratorLSMA', 'C2': 'AROONOSC', 'Volume': 'ADXR', 'Exit': 'hacolt_2.02_lines'}. Best is trial 56 with value: 6.4458.
[I 2026-02-27 17:57:13,038] Trial 57 finished with value: 8.7759 and parameters: {'ATR': 'FilteredATR', 'Baseline': 'T3MA', 'C1': 'AcceleratorLSMA', 'C2': 'AROONOSC', 'Volume': 'ADXR', 'Exit': 'TrendAkkam'}. Best is trial 57 with value: 8.7759.
[I 2026-02-27 17:57:23,730] Trial 58 finished with value: 2.4051 and parameters: {'ATR': 'FilteredATR', 'Baseline': 'T3MA', 'C1': 'Ehlers Early Onset Trend', 'C2': 'AcceleratorLSMA', 'Volume': 'ADX', 'Exit': 'MACD'}. Best is trial 57 with value: 8.7759.
[I 2026-02-27 17:57:37,326] Trial 59 finished with value: 0.6003 and parameters: {'ATR': 'FilteredATR', 'Baseline': 'SineWMA', 'C1': 'trend-lord-nrp-indicator', 'C2': 'Decycler Oscillator', 'Volume': 'ADXR', 'Exit': 'TrendAkkam'}. Best is trial 57 with value: 8.7759.
[I 2026-02-27 17:57:42,101] Trial 60 pruned. Insufficient activity: Trades_Per_Day=0.0 < prune_threshold=0.04.
[I 2026-02-27 17:58:00,364] Trial 61 pruned. Insufficient activity: Trades_Per_Day=0.01 < prune_threshold=0.04.
[I 2026-02-27 17:58:05,735] Trial 62 finished with value: 4.7495 and parameters: {'ATR': 'FilteredATR', 'Baseline': 'GChannel', 'C1': 'AcceleratorLSMA', 'C2': 'Vortex_Indicator', 'Volume': 'ADX', 'Exit': 'TopTrend'}. Best is trial 57 with value: 8.7759.

[UI] Resume attempt 2 started at 2026-02-27T17:58:05
[UI WORKER] Starting main.py backtesting cycle
[UI WORKER] config=C:\Users\sm598\Desktop\Applications\Development\Algo Trading\backtesting\ui_jobs\20260227_175653_b82610\config.json
{
  "strategies": [
    "NNFX"
  ],
  "pairs": [
    "EUR/USD",
    "USD/JPY",
    "GBP/USD",
    "USD/CHF",
    "AUD/USD",
    "USD/CAD",
    "NZD/USD",
    "USD/SGD",
    "EUR/GBP",
    "EUR/JPY",
    "EUR/CHF",
    "EUR/AUD",
    "EUR/CAD",
    "EUR/NZD",
    "GBP/JPY",
    "GBP/CHF",
    "GBP/AUD",
    "GBP/CAD",
    "GBP/NZD",
    "AUD/JPY",
    "AUD/CHF",
    "AUD/CAD",
    "AUD/NZD",
    "CAD/JPY",
    "CAD/CHF",
    "NZD/JPY",
    "NZD/CHF",
    "CHF/JPY",
    "EUR/SGD",
    "USD/SGD",
    "GBP/SGD",
    "AUD/SGD",
    "SGD/JPY",
    "NZD/SGD",
    "CAD/SGD",
    "CHF/SGD"
  ],
  "phase12_timeframes": [
    "2_hour",
    "4_hour",
    "1_day"
  ],
  "phase3_timeframes": [],
  "seeds": [
    42,
    1337,
    314,
    777,
    444
  ],
  "trials_by_timeframe": {
    "1_day": 500,
    "4_hour": 300,
    "2_hour": 300,
    "1_hour": 200,
    "30_minute": 200,
    "15_minute": 200,
    "5_minute": 200
  },
  "n_processes": 1,
  "phase2_top_percent": 10.0,
  "phase3_top_n": 30,
  "enable_phase1": true,
  "enable_phase2": true,
  "enable_phase3": true,
  "created_at": "2026-02-27T17:56:53"
}
[UI WORKER] strategies=['NNFX']
[UI WORKER] n_processes=1
[UI WORKER] pairs=36
[UI WORKER] phases=['phase1', 'phase2', 'phase3']
[UI WORKER] Running phase1...
[UI WORKER] phase1 jobs=540
[02/27/2026 17:58:11] [START STUDY] EUR/USD @ 2_hour
[I 2026-02-27 17:58:11,389] Using an existing study with name 'phase1_EURUSD_2_hour_NNFX_2024-11-06to2025-05-07_space-default_seed-42' instead of creating a new one.
[02/27/2026 17:58:11] [phase1_EURUSD_2_hour_NNFX_2024-11-06to2025-05-07_space-default_seed-42]: finished=58 to_run=242
[I 2026-02-27 17:58:13,029] Trial 63 finished with value: 5.9666 and parameters: {'ATR': 'FilteredATR', 'Baseline': 'GChannel', 'C1': 'AcceleratorLSMA', 'C2': 'CCI', 'Volume': 'ADX', 'Exit': 'TopTrend'}. Best is trial 57 with value: 8.7759.
[I 2026-02-27 17:58:19,804] Trial 65 finished with value: 4.7495 and parameters: {'ATR': 'FilteredATR', 'Baseline': 'GChannel', 'C1': 'AcceleratorLSMA', 'C2': 'Vortex_Indicator', 'Volume': 'ADX', 'Exit': 'TSF'}. Best is trial 57 with value: 8.7759.
[I 2026-02-27 17:58:19,934] Trial 66 pruned. Duplicate configuration already scored in DB (run_id=122, score=5.9666).
[I 2026-02-27 17:58:24,132] Trial 64 finished with value: 3.7558 and parameters: {'ATR': 'FilteredATR', 'Baseline': 'GChannel', 'C1': 'AcceleratorLSMA', 'C2': 'TTF', 'Volume': 'ADX', 'Exit': 'TTF'}. Best is trial 57 with value: 8.7759.
[I 2026-02-27 17:58:27,691] Trial 67 finished with value: 4.8599 and parameters: {'ATR': 'FilteredATR', 'Baseline': 'GChannel', 'C1': 'AcceleratorLSMA', 'C2': 'Vortex_Indicator', 'Volume': 'ADX', 'Exit': 'TTF'}. Best is trial 57 with value: 8.7759.
[I 2026-02-27 17:58:28,581] Trial 68 pruned. Insufficient activity: Trades_Per_Day=0.0 < prune_threshold=0.04.
[I 2026-02-27 17:58:38,434] Trial 69 finished with value: 4.3411 and parameters: {'ATR': 'FilteredATR', 'Baseline': 'GChannel', 'C1': 'AcceleratorLSMA', 'C2': 'CMO', 'Volume': 'ADX', 'Exit': 'TSF'}. Best is trial 57 with value: 8.7759.
[I 2026-02-27 17:58:45,304] Trial 70 finished with value: 0.5019 and parameters: {'ATR': 'FilteredATR', 'Baseline': 'WMA', 'C1': 'AcceleratorLSMA', 'C2': 'Vortex_Indicator', 'Volume': 'ADX', 'Exit': 'TopTrend'}. Best is trial 57 with value: 8.7759.
[I 2026-02-27 17:58:58,516] Trial 72 finished with value: 0.6631 and parameters: {'ATR': 'FilteredATR', 'Baseline': 'LSMA', 'C1': 'ROC', 'C2': 'Vortex_Indicator', 'Volume': 'ADX', 'Exit': 'dorsey-inertia'}. Best is trial 57 with value: 8.7759.
[I 2026-02-27 17:59:09,391] Trial 71 finished with value: 0.1695 and parameters: {'ATR': 'FilteredATR', 'Baseline': 'Trimagen', 'C1': 'ChandelierExit', 'C2': 'AdaptiveSmootherTriggerlinesMtfAlertsNmc', 'Volume': 'ADX', 'Exit': 'frama-indicator'}. Best is trial 57 with value: 8.7759.
[I 2026-02-27 17:59:13,636] Trial 73 finished with value: 0.9838 and parameters: {'ATR': 'FilteredATR', 'Baseline': 'Trimagen', 'C1': 'KijunSen', 'C2': 'Vortex_Indicator', 'Volume': 'ADX', 'Exit': 'HalfTrend'}. Best is trial 57 with value: 8.7759.
[I 2026-02-27 17:59:21,996] Trial 74 finished with value: 0.1602 and parameters: {'ATR': 'FilteredATR', 'Baseline': 'EMA', 'C1': 'GruchaIndex', 'C2': 'AROON', 'Volume': 'ADXR', 'Exit': 'forecast'}. Best is trial 57 with value: 8.7759.
[I 2026-02-27 17:59:26,312] Trial 75 finished with value: 0.5262 and parameters: {'ATR': 'FilteredATR', 'Baseline': 'EMA', 'C1': 'HLCTrend', 'C2': 'TDFI', 'Volume': 'ADXR', 'Exit': 'TII'}. Best is trial 57 with value: 8.7759.
[I 2026-02-27 17:59:31,144] Trial 76 finished with value: 0.8712 and parameters: {'ATR': 'FilteredATR', 'Baseline': 'HMA', 'C1': 'Metro-Advanced', 'C2': 'BullsBearsImpulse', 'Volume': 'ADX', 'Exit': '2nd Order Gaussian High Pass Filter MTF Zones'}. Best is trial 57 with value: 8.7759.
[I 2026-02-27 17:59:34,094] Trial 77 finished with value: 0.8351 and parameters: {'ATR': 'FilteredATR', 'Baseline': 'RecursiveMA', 'C1': 'ROCP', 'C2': 'ChandelierExit', 'Volume': 'ADX', 'Exit': '2nd Order Gaussian High Pass Filter MTF Zones'}. Best is trial 57 with value: 8.7759.
[I 2026-02-27 17:59:37,005] Trial 78 pruned. Insufficient activity: Trades_Per_Day=0.0 < prune_threshold=0.04.
[I 2026-02-27 17:59:39,471] Trial 79 pruned. Insufficient activity: Trades_Per_Day=0.0 < prune_threshold=0.04.
[I 2026-02-27 17:59:47,825] Trial 81 finished with value: 4.8105 and parameters: {'ATR': 'FilteredATR', 'Baseline': 'GChannel', 'C1': 'ASO', 'C2': 'forecast', 'Volume': 'ADX', 'Exit': 'Coral'}. Best is trial 57 with value: 8.7759.
[I 2026-02-27 17:59:53,592] Trial 82 finished with value: 3.4285 and parameters: {'ATR': 'FilteredATR', 'Baseline': 'GChannel', 'C1': 'EhlersRoofingFilterA', 'C2': 'ROC', 'Volume': 'ADX', 'Exit': 'STOCHRSI'}. Best is trial 57 with value: 8.7759.
[I 2026-02-27 18:00:04,788] Trial 86 finished with value: 6.6472 and parameters: {'ATR': 'FilteredATR', 'Baseline': 'GChannel', 'C1': 'Momentum Candles w ATR', 'C2': 'Metro-Advanced', 'Volume': 'NormalizedVolume', 'Exit': 'TDFI'}. Best is trial 57 with value: 8.7759.
[I 2026-02-27 18:00:04,940] Trial 89 pruned. Duplicate configuration already scored in DB (run_id=145, score=6.9115).
[I 2026-02-27 18:00:05,946] Trial 84 finished with value: 0.6066 and parameters: {'ATR': 'NATR', 'Baseline': 'GChannel', 'C1': 'ASO', 'C2': 'precision-trend-histogram', 'Volume': 'NormalizedVolume', 'Exit': 'MAMA'}. Best is trial 57 with value: 8.7759.
[I 2026-02-27 18:00:14,506] Trial 90 finished with value: 4.3311 and parameters: {'ATR': 'FilteredATR', 'Baseline': 'GChannel', 'C1': 'Momentum Candles w ATR', 'C2': 'ROCR100', 'Volume': 'NormalizedVolume', 'Exit': 'ROCR100'}. Best is trial 57 with value: 8.7759.
[I 2026-02-27 18:00:18,107] Trial 92 finished with value: 9.0846 and parameters: {'ATR': 'FilteredATR', 'Baseline': 'GChannel', 'C1': 'Momentum Candles w ATR', 'C2': 'Metro-Advanced', 'Volume': 'NormalizedVolume', 'Exit': 'XmaColouredUpdatedForNnfx'}. Best is trial 92 with value: 9.0846.
[I 2026-02-27 18:00:22,488] Trial 97 pruned. Insufficient activity: Trades_Per_Day=0.0 < prune_threshold=0.04.
[I 2026-02-27 18:00:29,943] Trial 94 finished with value: 4.6508 and parameters: {'ATR': 'FilteredATR', 'Baseline': 'GChannel', 'C1': 'Coral', 'C2': 'Metro-Advanced', 'Volume': 'NormalizedVolume', 'Exit': 'MACDZeroLag'}. Best is trial 92 with value: 9.0846.
[W 2026-02-27 18:00:30,119] Trial 101 failed with parameters: {'ATR': 'FilteredATR', 'Baseline': 'Gd', 'C1': 'SherifHilo', 'C2': 'SmoothedMomentum', 'Volume': 'TwiggsMF', 'Exit': 'MACDFIX'} because of the following error: ArrowMemoryError('malloc of size 256 failed').
Traceback (most recent call last):
  File "C:\Users\sm598\AppData\Local\Programs\Python\Python310\lib\site-packages\optuna\study\_optimize.py", line 197, in _run_trial
    value_or_values = func(trial)
  File "C:\Users\sm598\Desktop\Applications\Development\Algo Trading\main.py", line 465, in wrapped_objective
    return objective(
  File "C:\Users\sm598\Desktop\Applications\Development\Algo Trading\scripts\trial_adapters\base_adapter.py", line 372, in objective
    return adapter.objective(trial, forex_pair, timeframe, db_queue, ack_dict, context)
  File "C:\Users\sm598\Desktop\Applications\Development\Algo Trading\scripts\trial_adapters\nnxf_adapter.py", line 97, in objective
    return run_objective_common(
  File "C:\Users\sm598\Desktop\Applications\Development\Algo Trading\scripts\trial_adapters\base_adapter.py", line 224, in run_objective_common
    strategy.prepare_data(data)
  File "C:\Users\sm598\Desktop\Applications\Development\Algo Trading\scripts\strategies\nnfx_strategy.py", line 97, in prepare_data
    self.data_with_indicators = self._calculate_or_retrieve_indicators(
  File "C:\Users\sm598\Desktop\Applications\Development\Algo Trading\scripts\strategies\nnfx_strategy.py", line 164, in _calculate_or_retrieve_indicators
    dict_to_insert = cache.store_in_feather(
  File "C:\Users\sm598\Desktop\Applications\Development\Algo Trading\scripts\data\sql.py", line 326, in store_in_feather
    df.reset_index(drop=True).to_feather(filepath)
  File "C:\Users\sm598\AppData\Local\Programs\Python\Python310\lib\site-packages\pandas\core\frame.py", line 2943, in to_feather
    to_feather(self, path, **kwargs)
  File "C:\Users\sm598\AppData\Local\Programs\Python\Python310\lib\site-packages\pandas\io\feather_format.py", line 65, in to_feather
    feather.write_feather(df, handles.handle, **kwargs)
  File "C:\Users\sm598\AppData\Local\Programs\Python\Python310\lib\site-packages\pyarrow\feather.py", line 156, in write_feather
    table = Table.from_pandas(df, preserve_index=preserve_index)
  File "pyarrow\\table.pxi", line 4793, in pyarrow.lib.Table.from_pandas
  File "C:\Users\sm598\AppData\Local\Programs\Python\Python310\lib\site-packages\pyarrow\pandas_compat.py", line 652, in dataframe_to_arrays
    arrays[i] = maybe_fut.result()
  File "C:\Users\sm598\AppData\Local\Programs\Python\Python310\lib\concurrent\futures\_base.py", line 451, in result
    return self.__get_result()
  File "C:\Users\sm598\AppData\Local\Programs\Python\Python310\lib\concurrent\futures\_base.py", line 403, in __get_result
    raise self._exception
  File "C:\Users\sm598\AppData\Local\Programs\Python\Python310\lib\concurrent\futures\thread.py", line 58, in run
    result = self.fn(*self.args, **self.kwargs)
  File "C:\Users\sm598\AppData\Local\Programs\Python\Python310\lib\site-packages\pyarrow\pandas_compat.py", line 620, in convert_column
    result = pa.array(col, type=type_, from_pandas=True, safe=safe)
  File "pyarrow\\array.pxi", line 365, in pyarrow.lib.array
  File "pyarrow\\array.pxi", line 90, in pyarrow.lib._ndarray_to_array
  File "pyarrow\\error.pxi", line 92, in pyarrow.lib.check_status
pyarrow.lib.ArrowMemoryError: malloc of size 256 failed
[W 2026-02-27 18:00:30,360] Trial 101 failed with value None.
[I 2026-02-27 18:00:33,303] Trial 98 finished with value: 0.7759 and parameters: {'ATR': 'FilteredATR', 'Baseline': 'SMA', 'C1': 'Momentum Candles w ATR', 'C2': 'VIDYA', 'Volume': 'TwiggsMF', 'Exit': 'XmaColouredUpdatedForNnfx'}. Best is trial 92 with value: 9.0846.
[I 2026-02-27 18:00:38,849] Trial 102 pruned. Insufficient activity: Trades_Per_Day=0.0 < prune_threshold=0.04.
[I 2026-02-27 18:00:44,680] Trial 103 pruned. Insufficient activity: Trades_Per_Day=0.0 < prune_threshold=0.04.
[I 2026-02-27 18:01:25,138] Trial 104 pruned. Insufficient activity: Trades_Per_Day=0.03 < prune_threshold=0.04.
[I 2026-02-27 18:01:34,430] Trial 105 finished with value: 0.6832 and parameters: {'ATR': 'FilteredATR', 'Baseline': 'SineWMA', 'C1': 'MACDEXT', 'C2': 'HLCTrend', 'Volume': 'ADOSC', 'Exit': 'Zerolag_MACD.mq4'}. Best is trial 92 with value: 9.0846.
[I 2026-02-27 18:01:37,480] Trial 106 pruned. Insufficient activity: Trades_Per_Day=0.0 < prune_threshold=0.04.
[I 2026-02-27 18:01:43,219] Trial 107 finished with value: 1.0048 and parameters: {'ATR': 'FilteredATR', 'Baseline': 'HMA', 'C1': 'cyber-cycle', 'C2': 'MAMA', 'Volume': 'NormalizedVolume', 'Exit': 'TTF'}. Best is trial 92 with value: 9.0846.
[I 2026-02-27 18:01:57,753] Trial 108 finished with value: 4.216 and parameters: {'ATR': 'FilteredATR', 'Baseline': 'LSMA', 'C1': 'precision-trend-histogram', 'C2': '2nd Order Gaussian High Pass Filter MTF Zones', 'Volume': 'FantailVMA', 'Exit': 'SmoothedMomentum'}. Best is trial 92 with value: 9.0846.
[I 2026-02-27 18:01:57,885] Trial 109 pruned. Duplicate configuration already scored in DB (run_id=164, score=4.6508).
