[UI WORKER] Starting main.py backtesting cycle
[UI WORKER] config=C:\Users\sm598\Desktop\Applications\Development\Algo Trading\backtesting\ui_jobs\20260227_175929_fbfdb3\config.json
{
  "strategies": [
    "NNFX"
  ],
  "pairs": [
    "EUR/USD",
    "USD/JPY",
    "GBP/USD",
    "USD/CHF",
    "AUD/USD",
    "USD/CAD",
    "NZD/USD",
    "USD/SGD",
    "EUR/GBP",
    "EUR/JPY",
    "EUR/CHF",
    "EUR/AUD",
    "EUR/CAD",
    "EUR/NZD",
    "GBP/JPY",
    "GBP/CHF",
    "GBP/AUD",
    "GBP/CAD",
    "GBP/NZD",
    "AUD/JPY",
    "AUD/CHF",
    "AUD/CAD",
    "AUD/NZD",
    "CAD/JPY",
    "CAD/CHF",
    "NZD/JPY",
    "NZD/CHF",
    "CHF/JPY",
    "EUR/SGD",
    "USD/SGD",
    "GBP/SGD",
    "AUD/SGD",
    "SGD/JPY",
    "NZD/SGD",
    "CAD/SGD",
    "CHF/SGD"
  ],
  "phase12_timeframes": [
    "2_hour",
    "4_hour",
    "1_day"
  ],
  "phase3_timeframes": [],
  "seeds": [
    42,
    1337,
    314,
    777,
    444
  ],
  "trials_by_timeframe": {
    "1_day": 500,
    "4_hour": 300,
    "2_hour": 300,
    "1_hour": 200,
    "30_minute": 200,
    "15_minute": 200,
    "5_minute": 200
  },
  "n_processes": 2,
  "phase2_top_percent": 10.0,
  "phase3_top_n": 30,
  "enable_phase1": true,
  "enable_phase2": true,
  "enable_phase3": true,
  "created_at": "2026-02-27T17:59:29"
}
[02/27/2026 17:59:30] Removed stale error log file: error_log.jsonl
[UI WORKER] strategies=['NNFX']
[UI WORKER] n_processes=2
[UI WORKER] pairs=36
[UI WORKER] phases=['phase1', 'phase2', 'phase3']
[UI WORKER] Running phase1...
[UI WORKER] phase1 jobs=540
[02/27/2026 17:59:34] [START STUDY] EUR/USD @ 2_hour
[02/27/2026 17:59:34] [START STUDY] EUR/USD @ 2_hour
[I 2026-02-27 17:59:34,949] Using an existing study with name 'phase1_EURUSD_2_hour_NNFX_2024-11-06to2025-05-07_space-default_seed-42' instead of creating a new one.
[02/27/2026 17:59:34] [phase1_EURUSD_2_hour_NNFX_2024-11-06to2025-05-07_space-default_seed-42]: finished=73 to_run=227
[I 2026-02-27 17:59:35,090] A new study created in RDB with name: phase1_EURUSD_2_hour_NNFX_2024-11-06to2025-05-07_space-default_seed-1337
[02/27/2026 17:59:35] [phase1_EURUSD_2_hour_NNFX_2024-11-06to2025-05-07_space-default_seed-1337]: finished=0 to_run=300
[I 2026-02-27 17:59:40,603] Trial 0 pruned. Insufficient activity: Trades_Per_Day=0.0 < prune_threshold=0.04.
[I 2026-02-27 17:59:44,277] Trial 80 finished with value: 3.6732 and parameters: {'ATR': 'FilteredATR', 'Baseline': 'T3MA', 'C1': 'frama-indicator', 'C2': 'TrendContinuation2', 'Volume': 'ADX', 'Exit': 'TTF'}. Best is trial 57 with value: 8.7759.
[I 2026-02-27 17:59:46,207] Trial 1 pruned. Insufficient activity: Trades_Per_Day=0.0 < prune_threshold=0.04.
[I 2026-02-27 17:59:49,444] Trial 83 pruned. Insufficient activity: Trades_Per_Day=0.0 < prune_threshold=0.04.
[I 2026-02-27 17:59:56,386] Trial 2 finished with value: 0.6723 and parameters: {'ATR': 'ATR', 'Baseline': 'VIDYA', 'C1': 'KijunSen', 'C2': 'MACDFIX', 'Volume': 'ADOSC', 'Exit': 'TopTrend'}. Best is trial 2 with value: 0.6723.
[I 2026-02-27 17:59:58,980] Trial 85 finished with value: 6.9115 and parameters: {'ATR': 'FilteredATR', 'Baseline': 'GChannel', 'C1': 'MACD', 'C2': 'forecast', 'Volume': 'NormalizedVolume', 'Exit': 'Coral'}. Best is trial 57 with value: 8.7759.
[I 2026-02-27 18:00:04,914] Trial 87 pruned. Insufficient activity: Trades_Per_Day=0.0 < prune_threshold=0.04.
[I 2026-02-27 18:00:17,204] Trial 91 finished with value: 1.243 and parameters: {'ATR': 'FilteredATR', 'Baseline': 'GChannel', 'C1': 'Doda-Stochastic-Modified', 'C2': '3rdgenma', 'Volume': 'NormalizedVolume', 'Exit': 'GlitchIndexFixed'}. Best is trial 57 with value: 8.7759.
[I 2026-02-27 18:00:23,000] Trial 3 finished with value: 1.5276 and parameters: {'ATR': 'NATR', 'Baseline': 'TetherLine', 'C1': 'SuperTrend', 'C2': 'TrendLord', 'Volume': 'OBV', 'Exit': 'TrendLord'}. Best is trial 3 with value: 1.5276.
[I 2026-02-27 18:00:25,707] Trial 96 finished with value: 0.8521 and parameters: {'ATR': 'FilteredATR', 'Baseline': 'T3MA', 'C1': 'TDFI', 'C2': 'Metro-Advanced', 'Volume': 'ADXR', 'Exit': 'CenterOfGravity'}. Best is trial 92 with value: 9.0846.
[W 2026-02-27 18:00:25,897] Trial 99 failed with parameters: {'ATR': 'FilteredATR', 'Baseline': 'SMA', 'C1': 'Momentum Candles w ATR', 'C2': 'Metro-Advanced', 'Volume': 'TwiggsMF', 'Exit': 'APO'} because of the following error: ArrowMemoryError('malloc of size 12352 failed').
Traceback (most recent call last):
  File "C:\Users\sm598\AppData\Local\Programs\Python\Python310\lib\site-packages\optuna\study\_optimize.py", line 197, in _run_trial
    value_or_values = func(trial)
  File "C:\Users\sm598\Desktop\Applications\Development\Algo Trading\main.py", line 465, in wrapped_objective
    return objective(
  File "C:\Users\sm598\Desktop\Applications\Development\Algo Trading\scripts\trial_adapters\base_adapter.py", line 372, in objective
    return adapter.objective(trial, forex_pair, timeframe, db_queue, ack_dict, context)
  File "C:\Users\sm598\Desktop\Applications\Development\Algo Trading\scripts\trial_adapters\nnxf_adapter.py", line 97, in objective
    return run_objective_common(
  File "C:\Users\sm598\Desktop\Applications\Development\Algo Trading\scripts\trial_adapters\base_adapter.py", line 224, in run_objective_common
    strategy.prepare_data(data)
  File "C:\Users\sm598\Desktop\Applications\Development\Algo Trading\scripts\strategies\nnfx_strategy.py", line 97, in prepare_data
    self.data_with_indicators = self._calculate_or_retrieve_indicators(
  File "C:\Users\sm598\Desktop\Applications\Development\Algo Trading\scripts\strategies\nnfx_strategy.py", line 145, in _calculate_or_retrieve_indicators
    output_df_or_series, calculated = retrieve_or_calculate(config)
  File "C:\Users\sm598\Desktop\Applications\Development\Algo Trading\scripts\strategies\nnfx_strategy.py", line 122, in retrieve_or_calculate
    cached_df = cache.fetch(
  File "C:\Users\sm598\Desktop\Applications\Development\Algo Trading\scripts\data\sql.py", line 302, in fetch
    return pd.read_feather(result[0])
  File "C:\Users\sm598\AppData\Local\Programs\Python\Python310\lib\site-packages\pandas\io\feather_format.py", line 123, in read_feather
    return feather.read_feather(
  File "C:\Users\sm598\AppData\Local\Programs\Python\Python310\lib\site-packages\pyarrow\feather.py", line 226, in read_feather
    return (read_table(
  File "C:\Users\sm598\AppData\Local\Programs\Python\Python310\lib\site-packages\pyarrow\feather.py", line 256, in read_table
    return reader.read()
  File "pyarrow\\_feather.pyx", line 88, in pyarrow._feather.FeatherReader.read
  File "pyarrow\\error.pxi", line 92, in pyarrow.lib.check_status
pyarrow.lib.ArrowMemoryError: malloc of size 12352 failed
[W 2026-02-27 18:00:25,936] Trial 99 failed with value None.
[I 2026-02-27 18:01:08,080] Trial 8 finished with value: 3.2199 and parameters: {'ATR': 'FilteredATR', 'Baseline': 'Gd', 'C1': 'AROON', 'C2': 'EhlersRoofingFilterA', 'Volume': 'LWPI', 'Exit': 'SSL'}. Best is trial 8 with value: 3.2199.
[I 2026-02-27 18:01:50,330] Trial 10 finished with value: 0.2861 and parameters: {'ATR': 'ATR', 'Baseline': 'TetherLine', 'C1': 'AROON', 'C2': 'hacolt_2.02_lines', 'Volume': 'ADOSC', 'Exit': 'APO'}. Best is trial 8 with value: 3.2199.
[I 2026-02-27 18:01:55,493] Trial 12 pruned. Insufficient activity: Trades_Per_Day=0.0 < prune_threshold=0.04.
