[UI WORKER] Starting main.py backtesting cycle
[UI WORKER] config=C:\Users\sm598\Desktop\Applications\Development\Algo Trading\backtesting\ui_jobs\20260227_175955_0bf68c\config.json
{
  "strategies": [
    "NNFX"
  ],
  "pairs": [
    "EUR/USD",
    "USD/JPY",
    "GBP/USD",
    "USD/CHF",
    "AUD/USD",
    "USD/CAD",
    "NZD/USD",
    "USD/SGD",
    "EUR/GBP",
    "EUR/JPY",
    "EUR/CHF",
    "EUR/AUD",
    "EUR/CAD",
    "EUR/NZD",
    "GBP/JPY",
    "GBP/CHF",
    "GBP/AUD",
    "GBP/CAD",
    "GBP/NZD",
    "AUD/JPY",
    "AUD/CHF",
    "AUD/CAD",
    "AUD/NZD",
    "CAD/JPY",
    "CAD/CHF",
    "NZD/JPY",
    "NZD/CHF",
    "CHF/JPY",
    "EUR/SGD",
    "USD/SGD",
    "GBP/SGD",
    "AUD/SGD",
    "SGD/JPY",
    "NZD/SGD",
    "CAD/SGD",
    "CHF/SGD"
  ],
  "phase12_timeframes": [
    "2_hour",
    "4_hour",
    "1_day"
  ],
  "phase3_timeframes": [],
  "seeds": [
    42,
    1337,
    314,
    777,
    444
  ],
  "trials_by_timeframe": {
    "1_day": 500,
    "4_hour": 300,
    "2_hour": 300,
    "1_hour": 200,
    "30_minute": 200,
    "15_minute": 200,
    "5_minute": 200
  },
  "n_processes": 5,
  "phase2_top_percent": 10.0,
  "phase3_top_n": 30,
  "enable_phase1": true,
  "enable_phase2": true,
  "enable_phase3": true,
  "created_at": "2026-02-27T17:59:55"
}
[UI WORKER] strategies=['NNFX']
[UI WORKER] n_processes=5
[UI WORKER] pairs=36
[UI WORKER] phases=['phase1', 'phase2', 'phase3']
[UI WORKER] Running phase1...
[UI WORKER] phase1 jobs=540
[02/27/2026 18:00:01] [START STUDY] EUR/USD @ 2_hour
[02/27/2026 18:00:01] [START STUDY] EUR/USD @ 2_hour
[02/27/2026 18:00:01] [START STUDY] EUR/USD @ 2_hour
[02/27/2026 18:00:02] [START STUDY] EUR/USD @ 2_hour
[02/27/2026 18:00:02] [START STUDY] EUR/USD @ 2_hour
[I 2026-02-27 18:00:02,428] Using an existing study with name 'phase1_EURUSD_2_hour_NNFX_2024-11-06to2025-05-07_space-default_seed-42' instead of creating a new one.
[I 2026-02-27 18:00:02,431] Using an existing study with name 'phase1_EURUSD_2_hour_NNFX_2024-11-06to2025-05-07_space-default_seed-1337' instead of creating a new one.
[02/27/2026 18:00:02] [phase1_EURUSD_2_hour_NNFX_2024-11-06to2025-05-07_space-default_seed-1337]: finished=3 to_run=297
[02/27/2026 18:00:02] [phase1_EURUSD_2_hour_NNFX_2024-11-06to2025-05-07_space-default_seed-42]: finished=80 to_run=220
[I 2026-02-27 18:00:02,616] Trial 4 pruned. Insufficient activity: Trades_Per_Day=0.0 < prune_threshold=0.04.
[I 2026-02-27 18:00:02,684] A new study created in RDB with name: phase1_EURUSD_2_hour_NNFX_2024-11-06to2025-05-07_space-default_seed-314
[02/27/2026 18:00:02] [phase1_EURUSD_2_hour_NNFX_2024-11-06to2025-05-07_space-default_seed-314]: finished=0 to_run=300
[I 2026-02-27 18:00:02,749] Trial 5 pruned. Insufficient activity: Trades_Per_Day=0.0 < prune_threshold=0.04.
[I 2026-02-27 18:00:02,751] A new study created in RDB with name: phase1_EURUSD_2_hour_NNFX_2024-11-06to2025-05-07_space-default_seed-777
[I 2026-02-27 18:00:02,759] A new study created in RDB with name: phase1_EURUSD_2_hour_NNFX_2024-11-06to2025-05-07_space-default_seed-444
[02/27/2026 18:00:02] [phase1_EURUSD_2_hour_NNFX_2024-11-06to2025-05-07_space-default_seed-777]: finished=0 to_run=300
[02/27/2026 18:00:02] [phase1_EURUSD_2_hour_NNFX_2024-11-06to2025-05-07_space-default_seed-444]: finished=0 to_run=300
[I 2026-02-27 18:00:02,907] Trial 6 pruned. Duplicate configuration already scored in DB (run_id=144, score=0.6723).
[I 2026-02-27 18:00:08,406] Trial 0 pruned. Insufficient activity: Trades_Per_Day=0.0 < prune_threshold=0.04.
[I 2026-02-27 18:00:08,807] Trial 88 pruned. Insufficient activity: Trades_Per_Day=0.0 < prune_threshold=0.04.
[I 2026-02-27 18:00:10,895] Trial 0 finished with value: 0.6511 and parameters: {'ATR': 'ATR', 'Baseline': 'Trimagen', 'C1': 'TDFI', 'C2': 'QQEWithAlerts', 'Volume': 'LWPI', 'Exit': 'STOCHRSI'}. Best is trial 0 with value: 0.6511.
[I 2026-02-27 18:00:12,496] Trial 0 finished with value: 1.3064 and parameters: {'ATR': 'ATR', 'Baseline': 'EMA', 'C1': 'trend-lord-nrp-indicator', 'C2': 'GruchaIndex', 'Volume': 'OBV', 'Exit': 'Price Momentum Oscillator'}. Best is trial 0 with value: 1.3064.
[I 2026-02-27 18:00:15,412] Trial 93 finished with value: 4.5616 and parameters: {'ATR': 'FilteredATR', 'Baseline': 'GChannel', 'C1': 'GeominMA', 'C2': 'Momentum Candles Modified w ATR', 'Volume': 'NormalizedVolume', 'Exit': 'TDFI'}. Best is trial 57 with value: 8.7759.
[I 2026-02-27 18:00:20,161] Trial 1 finished with value: 0.7544 and parameters: {'ATR': 'NATR', 'Baseline': 'ALMA', 'C1': 'TTF', 'C2': 'METROFixed', 'Volume': 'ADX', 'Exit': 'SherifHilo'}. Best is trial 1 with value: 0.7544.
[I 2026-02-27 18:00:24,075] Trial 1 finished with value: 0.3931 and parameters: {'ATR': 'FilteredATR', 'Baseline': 'SMA', 'C1': 'Price Momentum Oscillator', 'C2': 'SSL', 'Volume': 'ADX', 'Exit': 'Coral'}. Best is trial 0 with value: 1.3064.
[I 2026-02-27 18:00:27,995] Trial 95 finished with value: 3.7405 and parameters: {'ATR': 'FilteredATR', 'Baseline': 'T3MA', 'C1': 'AdaptiveSmootherTriggerlinesMtfAlertsNmc', 'C2': 'Ehlers Early Onset Trend', 'Volume': 'ADXR', 'Exit': 'CCI'}. Best is trial 92 with value: 9.0846.
[W 2026-02-27 18:00:28,163] Trial 100 failed with parameters: {'ATR': 'FilteredATR', 'Baseline': 'SMA', 'C1': 'QQEWithAlerts', 'C2': 'DetrendedSyntheticPriceGoscillators', 'Volume': 'TwiggsMF', 'Exit': 'UF2018'} because of the following error: ArrowMemoryError('malloc of size 256 failed').
Traceback (most recent call last):
  File "C:\Users\sm598\AppData\Local\Programs\Python\Python310\lib\site-packages\optuna\study\_optimize.py", line 197, in _run_trial
    value_or_values = func(trial)
  File "C:\Users\sm598\Desktop\Applications\Development\Algo Trading\main.py", line 465, in wrapped_objective
    return objective(
  File "C:\Users\sm598\Desktop\Applications\Development\Algo Trading\scripts\trial_adapters\base_adapter.py", line 372, in objective
    return adapter.objective(trial, forex_pair, timeframe, db_queue, ack_dict, context)
  File "C:\Users\sm598\Desktop\Applications\Development\Algo Trading\scripts\trial_adapters\nnxf_adapter.py", line 97, in objective
    return run_objective_common(
  File "C:\Users\sm598\Desktop\Applications\Development\Algo Trading\scripts\trial_adapters\base_adapter.py", line 224, in run_objective_common
    strategy.prepare_data(data)
  File "C:\Users\sm598\Desktop\Applications\Development\Algo Trading\scripts\strategies\nnfx_strategy.py", line 97, in prepare_data
    self.data_with_indicators = self._calculate_or_retrieve_indicators(
  File "C:\Users\sm598\Desktop\Applications\Development\Algo Trading\scripts\strategies\nnfx_strategy.py", line 145, in _calculate_or_retrieve_indicators
    output_df_or_series, calculated = retrieve_or_calculate(config)
  File "C:\Users\sm598\Desktop\Applications\Development\Algo Trading\scripts\strategies\nnfx_strategy.py", line 122, in retrieve_or_calculate
    cached_df = cache.fetch(
  File "C:\Users\sm598\Desktop\Applications\Development\Algo Trading\scripts\data\sql.py", line 302, in fetch
    return pd.read_feather(result[0])
  File "C:\Users\sm598\AppData\Local\Programs\Python\Python310\lib\site-packages\pandas\io\feather_format.py", line 123, in read_feather
    return feather.read_feather(
  File "C:\Users\sm598\AppData\Local\Programs\Python\Python310\lib\site-packages\pyarrow\feather.py", line 226, in read_feather
    return (read_table(
  File "C:\Users\sm598\AppData\Local\Programs\Python\Python310\lib\site-packages\pyarrow\feather.py", line 256, in read_table
    return reader.read()
  File "pyarrow\\_feather.pyx", line 88, in pyarrow._feather.FeatherReader.read
  File "pyarrow\\error.pxi", line 92, in pyarrow.lib.check_status
pyarrow.lib.ArrowMemoryError: malloc of size 256 failed
[W 2026-02-27 18:00:28,166] Trial 100 failed with value None.
[I 2026-02-27 18:00:28,293] Trial 2 pruned. Insufficient activity: Trades_Per_Day=0.0 < prune_threshold=0.04.
[I 2026-02-27 18:00:29,589] Trial 7 finished with value: 1.5276 and parameters: {'ATR': 'NATR', 'Baseline': 'TetherLine', 'C1': 'SuperTrend', 'C2': 'TrendLord', 'Volume': 'OBV', 'Exit': 'TrendLord'}. Best is trial 3 with value: 1.5276.
[I 2026-02-27 18:00:36,640] Trial 2 finished with value: 1.4797 and parameters: {'ATR': 'NATR', 'Baseline': 'TrendLord', 'C1': 'TTF', 'C2': 'GeominMA', 'Volume': 'AD', 'Exit': 'Laguerre'}. Best is trial 2 with value: 1.4797.
[I 2026-02-27 18:00:38,426] Trial 1 finished with value: 2.6941 and parameters: {'ATR': 'ATR', 'Baseline': 'TrendLord', 'C1': 'Metro-Advanced', 'C2': 'cyber-cycle', 'Volume': 'OBV', 'Exit': 'TSF'}. Best is trial 1 with value: 2.6941.
[W 2026-02-27 18:00:38,570] Trial 2 failed with parameters: {'ATR': 'NATR', 'Baseline': 'ALMA', 'C1': 'TDFI', 'C2': 'TII', 'Volume': 'FantailVMA', 'Exit': 'KASE'} because of the following error: ArrowMemoryError('malloc of size 12352 failed').
Traceback (most recent call last):
  File "C:\Users\sm598\AppData\Local\Programs\Python\Python310\lib\site-packages\optuna\study\_optimize.py", line 197, in _run_trial
    value_or_values = func(trial)
  File "C:\Users\sm598\Desktop\Applications\Development\Algo Trading\main.py", line 465, in wrapped_objective
    return objective(
  File "C:\Users\sm598\Desktop\Applications\Development\Algo Trading\scripts\trial_adapters\base_adapter.py", line 372, in objective
    return adapter.objective(trial, forex_pair, timeframe, db_queue, ack_dict, context)
  File "C:\Users\sm598\Desktop\Applications\Development\Algo Trading\scripts\trial_adapters\nnxf_adapter.py", line 97, in objective
    return run_objective_common(
  File "C:\Users\sm598\Desktop\Applications\Development\Algo Trading\scripts\trial_adapters\base_adapter.py", line 224, in run_objective_common
    strategy.prepare_data(data)
  File "C:\Users\sm598\Desktop\Applications\Development\Algo Trading\scripts\strategies\nnfx_strategy.py", line 97, in prepare_data
    self.data_with_indicators = self._calculate_or_retrieve_indicators(
  File "C:\Users\sm598\Desktop\Applications\Development\Algo Trading\scripts\strategies\nnfx_strategy.py", line 145, in _calculate_or_retrieve_indicators
    output_df_or_series, calculated = retrieve_or_calculate(config)
  File "C:\Users\sm598\Desktop\Applications\Development\Algo Trading\scripts\strategies\nnfx_strategy.py", line 122, in retrieve_or_calculate
    cached_df = cache.fetch(
  File "C:\Users\sm598\Desktop\Applications\Development\Algo Trading\scripts\data\sql.py", line 302, in fetch
    return pd.read_feather(result[0])
  File "C:\Users\sm598\AppData\Local\Programs\Python\Python310\lib\site-packages\pandas\io\feather_format.py", line 123, in read_feather
    return feather.read_feather(
  File "C:\Users\sm598\AppData\Local\Programs\Python\Python310\lib\site-packages\pyarrow\feather.py", line 226, in read_feather
    return (read_table(
  File "pyarrow\\array.pxi", line 987, in pyarrow.lib._PandasConvertible.to_pandas
  File "pyarrow\\table.pxi", line 5174, in pyarrow.lib.Table._to_pandas
  File "C:\Users\sm598\AppData\Local\Programs\Python\Python310\lib\site-packages\pyarrow\pandas_compat.py", line 808, in table_to_dataframe
    result = pa.lib.table_to_blocks(options, table, categories,
  File "pyarrow\\table.pxi", line 4103, in pyarrow.lib.table_to_blocks
  File "pyarrow\\error.pxi", line 92, in pyarrow.lib.check_status
pyarrow.lib.ArrowMemoryError: malloc of size 12352 failed
[W 2026-02-27 18:00:38,573] Trial 2 failed with value None.
[I 2026-02-27 18:00:40,549] Trial 3 pruned. Insufficient activity: Trades_Per_Day=0.0 < prune_threshold=0.04.
[I 2026-02-27 18:00:44,844] Trial 4 pruned. Insufficient activity: Trades_Per_Day=0.0 < prune_threshold=0.04.
[I 2026-02-27 18:00:50,876] Trial 5 finished with value: 1.6089 and parameters: {'ATR': 'NATR', 'Baseline': 'RecursiveMA', 'C1': 'SuperTrend', 'C2': 'EhlersRoofingFilterA', 'Volume': 'ADOSC', 'Exit': 'KalmanFilter'}. Best is trial 5 with value: 1.6089.
[I 2026-02-27 18:00:53,218] Trial 3 finished with value: 1.0886 and parameters: {'ATR': 'ATR', 'Baseline': 'Gen3MA', 'C1': 'HLCTrend', 'C2': 'RWI BTF', 'Volume': 'OBV', 'Exit': 'CMO'}. Best is trial 0 with value: 1.3064.
[I 2026-02-27 18:00:58,135] Trial 4 finished with value: 0.8449 and parameters: {'ATR': 'FilteredATR', 'Baseline': 'RecursiveMA', 'C1': 'ROCP', 'C2': 'MACDFIX', 'Volume': 'TwiggsMF', 'Exit': 'TSF'}. Best is trial 0 with value: 1.3064.
[I 2026-02-27 18:01:12,064] Trial 9 finished with value: 3.2199 and parameters: {'ATR': 'FilteredATR', 'Baseline': 'Gd', 'C1': 'AROON', 'C2': 'EhlersRoofingFilterA', 'Volume': 'LWPI', 'Exit': 'SSL'}. Best is trial 8 with value: 3.2199.
[I 2026-02-27 18:01:18,215] Trial 5 finished with value: 4.0352 and parameters: {'ATR': 'ATR', 'Baseline': 'WMA', 'C1': 'ROC', 'C2': 'TrendDirectionForceIndexSmoothed4', 'Volume': 'LWPI', 'Exit': '2nd Order Gaussian High Pass Filter MTF Zones'}. Best is trial 5 with value: 4.0352.
[I 2026-02-27 18:01:29,009] Trial 6 finished with value: 2.7258 and parameters: {'ATR': 'ATR', 'Baseline': 'TetherLine', 'C1': '2nd Order Gaussian High Pass Filter MTF Zones', 'C2': 'TTF', 'Volume': 'ADOSC', 'Exit': 'MACD'}. Best is trial 5 with value: 4.0352.
[I 2026-02-27 18:01:32,232] Trial 7 pruned. Insufficient activity: Trades_Per_Day=0.0 < prune_threshold=0.04.
[I 2026-02-27 18:01:33,653] Trial 6 pruned. Insufficient activity: Trades_Per_Day=0.02 < prune_threshold=0.04.
[I 2026-02-27 18:01:37,778] Trial 7 pruned. Insufficient activity: Trades_Per_Day=0.0 < prune_threshold=0.04.
[I 2026-02-27 18:01:45,861] Trial 8 finished with value: 3.2516 and parameters: {'ATR': 'FilteredATR', 'Baseline': 'T3MA', 'C1': 'Vortex_Indicator', 'C2': 'Doda-Stochastic-Modified', 'Volume': 'FantailVMA', 'Exit': 'HalfTrend'}. Best is trial 8 with value: 3.2516.
[I 2026-02-27 18:01:47,427] Trial 8 pruned. Insufficient activity: Trades_Per_Day=0.03 < prune_threshold=0.04.
[I 2026-02-27 18:01:49,545] Trial 9 pruned. Insufficient activity: Trades_Per_Day=0.0 < prune_threshold=0.04.
[I 2026-02-27 18:01:54,231] Trial 11 finished with value: 0.2861 and parameters: {'ATR': 'ATR', 'Baseline': 'TetherLine', 'C1': 'AROON', 'C2': 'hacolt_2.02_lines', 'Volume': 'ADOSC', 'Exit': 'APO'}. Best is trial 8 with value: 3.2199.
[I 2026-02-27 18:01:58,872] Trial 13 pruned. Insufficient activity: Trades_Per_Day=0.0 < prune_threshold=0.04.
[I 2026-02-27 18:01:58,920] Trial 9 finished with value: 3.0919 and parameters: {'ATR': 'FilteredATR', 'Baseline': 'TrendLord', 'C1': 'ROCR', 'C2': '2nd Order Gaussian High Pass Filter MTF Zones', 'Volume': 'ADXR', 'Exit': 'Top Bottom NR'}. Best is trial 5 with value: 4.0352.
