[I 2026-02-27 21:11:01,461] Trial 7 finished with value: 0.8636 and parameters: {'model_key': 'rf', 'rf.n_estimators': 550, 'rf.max_depth': 5, 'th.mode': 'asymmetric', 'th.long_enter': 0.1, 'th.short_enter_abs': 0.30000000000000004, 'th.hysteresis': 0.1, 'risk.tp_mode': 'fixed', 'risk.tp_multiple': 1.5, 'risk.risk_pct': 0.0075, 'risk.atr_mult': 1.75, 'features.target_count': 4, 'slot.trend.count': 2, 'slot.mom.count': 1, 'slot.vol.count': 0, 'slot.wild.count': 1, 'pool.broad.slot.trend.0.name': '2nd Order Gaussian High Pass Filter MTF Zones', 'pool.broad.slot.trend.1.name': 'Vortex_Indicator', 'pool.broad.slot.mom.0.name': 'ErgodicTVI', 'pool.broad.slot.wild.0.name': 'ROCR', 'feat.trend.2nd Order Gaussian High Pass Filter MTF Zones.alpha': 0.3, 'feat.trend.Vortex_Indicator.length': 30, 'feat.momentum.ErgodicTVI.Period1': 20, 'feat.momentum.ErgodicTVI.Period2': 34, 'feat.momentum.ErgodicTVI.Period3': 5, 'feat.momentum.ErgodicTVI.EPeriod1': 5, 'feat.momentum.ErgodicTVI.EPeriod2': 3, 'feat.momentum.ErgodicTVI.EPeriod3': 5, 'feat.momentum.ROCR.timeperiod': 13}. Best is trial 7 with value: 0.8636.
[I 2026-02-27 21:11:01,603] Trial 4 pruned. Insufficient activity: Trades_Per_Day=0.0 < prune_threshold=0.02.
[I 2026-02-27 21:11:02,887] Trial 4 finished with value: 0.6222 and parameters: {'model_key': 'lr', 'lr.C': 0.9306896738297723, 'lr.max_iter': 500, 'th.mode': 'asymmetric', 'th.long_enter': 0.4, 'th.short_enter_abs': 0.05, 'th.hysteresis': 0.06, 'risk.tp_mode': 'fixed', 'risk.tp_multiple': 1.5, 'risk.risk_pct': 0.0175, 'risk.atr_mult': 2.25, 'features.target_count': 5, 'slot.trend.count': 2, 'slot.mom.count': 1, 'slot.vol.count': 0, 'slot.wild.count': 1, 'pool.broad.slot.trend.0.name': 'McGinleyDI', 'pool.broad.slot.trend.1.name': 'TrendAkkam', 'pool.broad.slot.mom.0.name': 'Zerolag_MACD.mq4', 'pool.broad.slot.wild.0.name': 'TrendAkkam', 'pool.broad.slot.wild.1.name': 'PPO', 'feat.baseline.McGinleyDI.period': 3, 'feat.baseline.McGinleyDI.mcg_constant': 4, 'feat.trend.TrendAkkam.akk_range': 200, 'feat.trend.TrendAkkam.ima_range': 5, 'feat.trend.TrendAkkam.akk_factor': 6.0, 'feat.trend.TrendAkkam.mode': 1, 'feat.trend.TrendAkkam.delta_price': 10.0, 'feat.trend.TrendAkkam.point': 1.0, 'feat.momentum.Zerolag_MACD.mq4.fast': 8, 'feat.momentum.Zerolag_MACD.mq4.slow': 30, 'feat.momentum.Zerolag_MACD.mq4.signal': 5, 'feat.momentum.PPO.fastperiod': 12, 'feat.momentum.PPO.slowperiod': 18, 'feat.momentum.PPO.matype': 1, 'feat.trend.AROON.timeperiod': 7}. Best is trial 3 with value: 5.7362.
[I 2026-02-27 21:11:03,518] Trial 4 finished with value: 0.3409 and parameters: {'model_key': 'linearsvm', 'svm.C': 1.2164819983621764, 'svm.max_iter': 2000, 'th.mode': 'symmetric', 'th.sym_base': 0.05, 'th.hysteresis': 0.03, 'risk.tp_mode': 'fixed', 'risk.tp_multiple': 1.0, 'risk.risk_pct': 0.0125, 'risk.atr_mult': 3.0, 'features.target_count': 6, 'slot.trend.count': 2, 'slot.mom.count': 1, 'slot.vol.count': 1, 'slot.wild.count': 1, 'pool.broad.slot.trend.0.name': 'Decycler Oscillator', 'pool.broad.slot.trend.1.name': 'ALMA', 'pool.broad.slot.mom.0.name': 'true-strength-index', 'pool.broad.slot.vol.0.name': 'STDDEV', 'pool.broad.slot.wild.0.name': 'Ehlers Early Onset Trend', 'pool.broad.slot.wild.1.name': 'DetrendedSyntheticPriceGoscillators', 'feat.trend.Decycler Oscillator.hp_period': 75, 'feat.trend.Decycler Oscillator.hp_period2': 60, 'feat.trend.Decycler Oscillator.price': 'tbiased', 'feat.baseline.ALMA.period': 5, 'feat.baseline.ALMA.sigma': 3, 'feat.baseline.ALMA.offset': 1.0, 'feat.momentum.true-strength-index.first_r': 13, 'feat.momentum.true-strength-index.second_s': 13, 'feat.volatility.STDDEV.timeperiod': 15, 'feat.volatility.STDDEV.nbdev': 5, 'feat.trend.Ehlers Early Onset Trend.period': 50, 'feat.trend.DetrendedSyntheticPriceGoscillators.dsp_period': 14, 'feat.trend.DetrendedSyntheticPriceGoscillators.price_mode': 'hatbiased2', 'feat.trend.DetrendedSyntheticPriceGoscillators.signal_period': 21}. Best is trial 4 with value: 0.3409.
[I 2026-02-27 21:11:03,841] Trial 9 finished with value: 11.1023 and parameters: {'model_key': 'linearsvm', 'svm.C': 0.30029240764567816, 'svm.max_iter': 1200, 'th.mode': 'symmetric', 'th.sym_base': 0.30000000000000004, 'th.hysteresis': 0.0, 'risk.tp_mode': 'none', 'risk.risk_pct': 0.0125, 'risk.atr_mult': 2.25, 'features.target_count': 6, 'slot.trend.count': 1, 'slot.mom.count': 2, 'slot.vol.count': 1, 'slot.wild.count': 0, 'pool.broad.slot.trend.0.name': 'Coral', 'pool.broad.slot.mom.0.name': 'ErgodicTVI', 'pool.broad.slot.mom.1.name': 'MACDZeroLag', 'pool.broad.slot.vol.0.name': 'VAR', 'pool.broad.slot.wild.0.name': 'STDDEV', 'pool.broad.slot.wild.1.name': 'KijunSen', 'feat.trend.Coral.length': 89, 'feat.trend.Coral.coef': 0.3, 'feat.momentum.ErgodicTVI.Period1': 20, 'feat.momentum.ErgodicTVI.Period2': 16, 'feat.momentum.ErgodicTVI.Period3': 1, 'feat.momentum.ErgodicTVI.EPeriod1': 13, 'feat.momentum.ErgodicTVI.EPeriod2': 13, 'feat.momentum.ErgodicTVI.EPeriod3': 13, 'feat.momentum.MACDZeroLag.short_period': 19, 'feat.momentum.MACDZeroLag.long_period': 35, 'feat.momentum.MACDZeroLag.signal_period': 7, 'feat.volatility.VAR.timeperiod': 10, 'feat.volatility.VAR.nbdev': 8, 'feat.volatility.STDDEV.nbdev': 3, 'feat.trend.KijunSen.period': 50}. Best is trial 9 with value: 11.1023.
[I 2026-02-27 21:11:04,675] Trial 68 finished with value: 3.5008 and parameters: {'model_key': 'linearsvm', 'svm.C': 0.3021029772979066, 'svm.max_iter': 800, 'th.mode': 'asymmetric', 'th.long_enter': 0.4, 'th.short_enter_abs': 0.0, 'th.hysteresis': 0.06, 'risk.tp_mode': 'none', 'risk.risk_pct': 0.0075, 'risk.atr_mult': 1.5, 'features.target_count': 5, 'slot.trend.count': 1, 'slot.mom.count': 2, 'slot.vol.count': 1, 'slot.wild.count': 0, 'pool.broad.slot.trend.0.name': 'CenterOfGravity', 'pool.broad.slot.mom.0.name': 'TDFI', 'pool.broad.slot.mom.1.name': 'Fisher', 'pool.broad.slot.vol.0.name': 'Stiffness Indicator', 'pool.broad.slot.wild.0.name': 'ASO', 'feat.trend.CenterOfGravity.period': 16, 'feat.momentum.TDFI.period': 7, 'feat.momentum.Fisher.range_periods': 40, 'feat.momentum.Fisher.price_smoothing': 0.4, 'feat.momentum.Fisher.index_smoothing': 0.8, 'feat.volatility.Stiffness Indicator.period1': 150, 'feat.volatility.Stiffness Indicator.method1': 'lwma', 'feat.volatility.Stiffness Indicator.period3': 30, 'feat.volatility.Stiffness Indicator.period2': 2, 'feat.volatility.Stiffness Indicator.method2': 'sma', 'feat.trend.ASO.period': 20}. Best is trial 56 with value: 65.7867.
[I 2026-02-27 21:11:04,988] Trial 8 pruned. Insufficient activity: Trades_Per_Day=0.0 < prune_threshold=0.04.
[I 2026-02-27 21:11:05,006] Trial 3 pruned. Insufficient activity: Trades_Per_Day=0.0 < prune_threshold=0.02.
[I 2026-02-27 21:11:05,363] Trial 5 finished with value: 0.4961 and parameters: {'model_key': 'rf', 'rf.n_estimators': 100, 'rf.max_depth': 3, 'th.mode': 'symmetric', 'th.sym_base': 0.0, 'th.hysteresis': 0.03, 'risk.tp_mode': 'none', 'risk.risk_pct': 0.0125, 'risk.atr_mult': 1.5, 'features.target_count': 6, 'slot.trend.count': 1, 'slot.mom.count': 1, 'slot.vol.count': 1, 'slot.wild.count': 0, 'pool.broad.slot.trend.0.name': 'SSL', 'pool.broad.slot.mom.0.name': 'ErgodicTVI', 'pool.broad.slot.vol.0.name': 'Volatility Ratio', 'pool.broad.slot.wild.0.name': 'GlitchIndexFixed', 'pool.broad.slot.wild.1.name': 'ChandelierExit', 'feat.trend.SSL.period': 40, 'feat.momentum.ErgodicTVI.Period1': 34, 'feat.momentum.ErgodicTVI.Period2': 20, 'feat.momentum.ErgodicTVI.Period3': 5, 'feat.momentum.ErgodicTVI.EPeriod1': 3, 'feat.momentum.ErgodicTVI.EPeriod2': 8, 'feat.momentum.ErgodicTVI.EPeriod3': 5, 'feat.volatility.Volatility Ratio.period': 10, 'feat.volatility.Volatility Ratio.price': 'Weighted', 'feat.momentum.GlitchIndexFixed.MaPeriod': 30, 'feat.momentum.GlitchIndexFixed.MaMethod': 'tema', 'feat.momentum.GlitchIndexFixed.Price': 'close', 'feat.momentum.GlitchIndexFixed.level1': 1.0, 'feat.momentum.GlitchIndexFixed.level2': 2.0, 'feat.trend.ChandelierExit.lookback': 11, 'feat.trend.ChandelierExit.atr_period': 7, 'feat.trend.ChandelierExit.atr_mult': 3.5, 'feat.trend.AROON.timeperiod': 30}. Best is trial 5 with value: 0.4961.
[I 2026-02-27 21:11:05,478] Trial 5 pruned. Insufficient activity: Trades_Per_Day=0.0 < prune_threshold=0.02.
[I 2026-02-27 21:11:06,430] Trial 69 finished with value: 9.5358 and parameters: {'model_key': 'linearsvm', 'svm.C': 0.21154644740966794, 'svm.max_iter': 1000, 'th.mode': 'asymmetric', 'th.long_enter': 0.35000000000000003, 'th.short_enter_abs': 0.1, 'th.hysteresis': 0.07, 'risk.tp_mode': 'none', 'risk.risk_pct': 0.01, 'risk.atr_mult': 1.25, 'features.target_count': 5, 'slot.trend.count': 1, 'slot.mom.count': 2, 'slot.vol.count': 1, 'slot.wild.count': 0, 'pool.broad.slot.trend.0.name': 'TrendContinuation2', 'pool.broad.slot.mom.0.name': 'ROCR', 'pool.broad.slot.mom.1.name': 'Laguerre', 'pool.broad.slot.vol.0.name': 'Volatility Ratio', 'pool.broad.slot.wild.0.name': 'AdaptiveSmootherTriggerlinesMtfAlertsNmc', 'feat.trend.TrendContinuation2.n': 50, 'feat.trend.TrendContinuation2.t3_period': 8, 'feat.trend.TrendContinuation2.b': 0.8, 'feat.momentum.ROCR.timeperiod': 8, 'feat.momentum.Laguerre.gamma': 0.6, 'feat.volatility.Volatility Ratio.period': 20, 'feat.volatility.Volatility Ratio.price': 'OHLC4', 'feat.trend.AdaptiveSmootherTriggerlinesMtfAlertsNmc.LsmaPeriod': 34, 'feat.trend.AdaptiveSmootherTriggerlinesMtfAlertsNmc.AdaptPeriod': 14}. Best is trial 56 with value: 65.7867.
[I 2026-02-27 21:11:06,622] Trial 4 finished with value: 3.6834 and parameters: {'model_key': 'lr', 'lr.C': 0.8308246489466212, 'lr.max_iter': 1000, 'th.mode': 'symmetric', 'th.sym_base': 0.1, 'th.hysteresis': 0.09, 'risk.tp_mode': 'none', 'risk.risk_pct': 0.005, 'risk.atr_mult': 3.0, 'features.target_count': 6, 'slot.trend.count': 2, 'slot.mom.count': 1, 'slot.vol.count': 1, 'slot.wild.count': 1, 'pool.broad.slot.trend.0.name': '2nd Order Gaussian High Pass Filter MTF Zones', 'pool.broad.slot.trend.1.name': 'SuperTrend', 'pool.broad.slot.mom.0.name': 'ROCP', 'pool.broad.slot.vol.0.name': 'BamsBung3', 'pool.broad.slot.wild.0.name': 'TTMS', 'pool.broad.slot.wild.1.name': 'EhlersRoofingFilterA', 'feat.trend.2nd Order Gaussian High Pass Filter MTF Zones.alpha': 0.2, 'feat.trend.SuperTrend.period': 15, 'feat.trend.SuperTrend.multiplier': 1, 'feat.momentum.ROCP.timeperiod': 6, 'feat.volatility.BamsBung3.length': 30, 'feat.volatility.BamsBung3.deviation': 3.0, 'feat.volatility.BamsBung3.money_risk': 0.1, 'feat.volatility.BamsBung3.signal_mode': 2, 'feat.volatility.BamsBung3.line_mode': 0, 'feat.volatility.TTMS.bb_length': 20, 'feat.volatility.TTMS.bb_deviation': 1.5, 'feat.volatility.TTMS.keltner_length': 10, 'feat.volatility.TTMS.keltner_smooth_length': 30, 'feat.volatility.TTMS.keltner_smooth_method': 0, 'feat.volatility.TTMS.keltner_deviation': 1.0, 'feat.trend.EhlersRoofingFilterA.hp_length': 100, 'feat.trend.EhlersRoofingFilterA.lp_length': 60}. Best is trial 4 with value: 3.6834.
[I 2026-02-27 21:11:07,576] Trial 4 pruned. Insufficient activity: Trades_Per_Day=0.0 < prune_threshold=0.02.
[I 2026-02-27 21:11:07,663] Trial 70 finished with value: 2.599 and parameters: {'model_key': 'linearsvm', 'svm.C': 0.8290900699139838, 'svm.max_iter': 600, 'th.mode': 'asymmetric', 'th.long_enter': 0.30000000000000004, 'th.short_enter_abs': 0.0, 'th.hysteresis': 0.08, 'risk.tp_mode': 'none', 'risk.risk_pct': 0.0075, 'risk.atr_mult': 1.0, 'features.target_count': 5, 'slot.trend.count': 1, 'slot.mom.count': 2, 'slot.vol.count': 1, 'slot.wild.count': 0, 'pool.broad.slot.trend.0.name': 'AROON', 'pool.broad.slot.mom.0.name': 'TSF', 'pool.broad.slot.mom.1.name': 'ROCR100', 'pool.broad.slot.vol.0.name': 'VolatilityRatio', 'pool.broad.slot.wild.0.name': 'SmoothedMomentum', 'feat.trend.AROON.timeperiod': 7, 'feat.momentum.TSF.timeperiod': 10, 'feat.momentum.ROCR100.timeperiod': 10, 'feat.volatility.VolatilityRatio.period': 30, 'feat.momentum.SmoothedMomentum.momentum_length': 20, 'feat.momentum.SmoothedMomentum.use_smoothing': True, 'feat.momentum.SmoothedMomentum.smoothing_method': 0, 'feat.momentum.SmoothedMomentum.smoothing_length': 100, 'feat.momentum.SmoothedMomentum.price': 4}. Best is trial 56 with value: 65.7867.
[I 2026-02-27 21:11:08,095] Trial 6 finished with value: 0.5416 and parameters: {'model_key': 'linearsvm', 'svm.C': 0.0875268554376034, 'svm.max_iter': 600, 'th.mode': 'asymmetric', 'th.long_enter': 0.0, 'th.short_enter_abs': 0.0, 'th.hysteresis': 0.04, 'risk.tp_mode': 'none', 'risk.risk_pct': 0.01, 'risk.atr_mult': 2.75, 'features.target_count': 5, 'slot.trend.count': 2, 'slot.mom.count': 2, 'slot.vol.count': 0, 'slot.wild.count': 1, 'pool.broad.slot.trend.0.name': 'GChannel', 'pool.broad.slot.trend.1.name': 'EhlersRoofingFilterA', 'pool.broad.slot.mom.0.name': 'GlitchIndexFixed', 'pool.broad.slot.mom.1.name': 'TTF', 'pool.broad.slot.wild.0.name': 'GlitchIndexFixed', 'feat.baseline.GChannel.length': 20, 'feat.baseline.GChannel.price': 'typical', 'feat.trend.EhlersRoofingFilterA.hp_length': 120, 'feat.trend.EhlersRoofingFilterA.lp_length': 30, 'feat.momentum.GlitchIndexFixed.MaPeriod': 20, 'feat.momentum.GlitchIndexFixed.MaMethod': 'nlma', 'feat.momentum.GlitchIndexFixed.Price': 'haaverage', 'feat.momentum.GlitchIndexFixed.level1': 0.5, 'feat.momentum.GlitchIndexFixed.level2': 2.0, 'feat.momentum.TTF.ttf_bars': 12, 'feat.momentum.TTF.top_line': 70.0, 'feat.momentum.TTF.bottom_line': -75.0, 'feat.momentum.TTF.t3_period': 1, 'feat.trend.AROON.timeperiod': 10}. Best is trial 3 with value: 5.7362.
[I 2026-02-27 21:11:08,156] Trial 10 pruned. Insufficient activity: Trades_Per_Day=0.03 < prune_threshold=0.04.
[I 2026-02-27 21:11:09,534] Trial 7 finished with value: 26.6898 and parameters: {'model_key': 'lr', 'lr.C': 0.21312312832296235, 'lr.max_iter': 1000, 'th.mode': 'symmetric', 'th.sym_base': 0.05, 'th.hysteresis': 0.05, 'risk.tp_mode': 'fixed', 'risk.tp_multiple': 2.5, 'risk.risk_pct': 0.005, 'risk.atr_mult': 2.0, 'features.target_count': 5, 'slot.trend.count': 2, 'slot.mom.count': 1, 'slot.vol.count': 1, 'slot.wild.count': 0, 'pool.broad.slot.trend.0.name': 'EMA', 'pool.broad.slot.trend.1.name': 'SSL', 'pool.broad.slot.mom.0.name': 'MACDFIX', 'pool.broad.slot.vol.0.name': 'CVI_Multi', 'pool.broad.slot.wild.0.name': 'cyber-cycle', 'feat.baseline.EMA.period': 10, 'feat.trend.SSL.period': 50, 'feat.momentum.MACDFIX.signalperiod': 6, 'feat.volatility.CVI_Multi.length': 7, 'feat.volatility.CVI_Multi.method': 3, 'feat.volatility.CVI_Multi.use_modified': True, 'feat.trend.cyber-cycle.price': 'wclose'}. Best is trial 7 with value: 26.6898.
[I 2026-02-27 21:11:10,154] Trial 5 pruned. Insufficient activity: Trades_Per_Day=0.0 < prune_threshold=0.02.
[I 2026-02-27 21:11:10,960] Trial 5 pruned. Insufficient activity: Trades_Per_Day=0.0 < prune_threshold=0.02.
[I 2026-02-27 21:11:11,835] Trial 6 pruned. Insufficient activity: Trades_Per_Day=0.0 < prune_threshold=0.02.
[I 2026-02-27 21:11:11,891] Trial 11 pruned. Insufficient activity: Trades_Per_Day=0.0 < prune_threshold=0.04.
[I 2026-02-27 21:11:12,324] Trial 6 finished with value: 11.3177 and parameters: {'model_key': 'rf', 'rf.n_estimators': 150, 'rf.max_depth': 3, 'th.mode': 'asymmetric', 'th.long_enter': 0.05, 'th.short_enter_abs': 0.25, 'th.hysteresis': 0.1, 'risk.tp_mode': 'none', 'risk.risk_pct': 0.0125, 'risk.atr_mult': 1.75, 'features.target_count': 4, 'slot.trend.count': 1, 'slot.mom.count': 1, 'slot.vol.count': 1, 'slot.wild.count': 1, 'pool.broad.slot.trend.0.name': 'KASE', 'pool.broad.slot.mom.0.name': 'METROFixed', 'pool.broad.slot.vol.0.name': 'TTMS', 'pool.broad.slot.wild.0.name': 'ADOSC', 'feat.trend.KASE.pstLength': 19, 'feat.trend.KASE.pstX': 11, 'feat.trend.KASE.pstSmooth': 9, 'feat.trend.KASE.smoothPeriod': 50, 'feat.momentum.METROFixed.period_rsi': 21, 'feat.momentum.METROFixed.step_size_fast': 7.0, 'feat.momentum.METROFixed.step_size_slow': 10.0, 'feat.volatility.TTMS.bb_length': 50, 'feat.volatility.TTMS.bb_deviation': 2.0, 'feat.volatility.TTMS.keltner_length': 14, 'feat.volatility.TTMS.keltner_smooth_length': 14, 'feat.volatility.TTMS.keltner_smooth_method': 3, 'feat.volatility.TTMS.keltner_deviation': 1.0, 'feat.volume.ADOSC.fastperiod': 4, 'feat.volume.ADOSC.slowperiod': 20}. Best is trial 6 with value: 11.3177.
[I 2026-02-27 21:11:12,789] Trial 7 finished with value: 33.022 and parameters: {'model_key': 'lr', 'lr.C': 0.25386699764291615, 'lr.max_iter': 700, 'th.mode': 'symmetric', 'th.sym_base': 0.1, 'th.hysteresis': 0.08, 'risk.tp_mode': 'fixed', 'risk.tp_multiple': 3.0, 'risk.risk_pct': 0.015, 'risk.atr_mult': 1.0, 'features.target_count': 6, 'slot.trend.count': 1, 'slot.mom.count': 1, 'slot.vol.count': 0, 'slot.wild.count': 1, 'pool.broad.slot.trend.0.name': 'Trimagen', 'pool.broad.slot.mom.0.name': 'Laguerre', 'pool.broad.slot.wild.0.name': 'Ehlers DELI (Detrended Leading Indicator)', 'pool.broad.slot.wild.1.name': 'trend-lord-nrp-indicator', 'feat.baseline.Trimagen.period': 30, 'feat.baseline.Trimagen.applied_price': 'median', 'feat.momentum.Laguerre.gamma': 0.5, 'feat.trend.Ehlers DELI (Detrended Leading Indicator).period': 14, 'feat.trend.trend-lord-nrp-indicator.length': 24, 'feat.trend.trend-lord-nrp-indicator.mode': 'smma', 'feat.trend.trend-lord-nrp-indicator.price': 'median', 'feat.trend.trend-lord-nrp-indicator.show_high_low': True, 'feat.trend.AROON.timeperiod': 10, 'feat.trend.AROONOSC.timeperiod': 12}. Best is trial 7 with value: 33.022.
[I 2026-02-27 21:11:13,134] Trial 32 finished with value: 0.6375 and parameters: {'model_key': 'lr', 'lr.C': 0.8308246489466212, 'lr.max_iter': 1000, 'th.mode': 'symmetric', 'th.sym_base': 0.1, 'th.hysteresis': 0.09, 'risk.tp_mode': 'none', 'risk.risk_pct': 0.005, 'risk.atr_mult': 3.0, 'features.target_count': 6, 'slot.trend.count': 2, 'slot.mom.count': 1, 'slot.vol.count': 1, 'slot.wild.count': 1, 'pool.broad.slot.trend.0.name': '2nd Order Gaussian High Pass Filter MTF Zones', 'pool.broad.slot.trend.1.name': 'SuperTrend', 'pool.broad.slot.mom.0.name': 'ROCP', 'pool.broad.slot.vol.0.name': 'BamsBung3', 'pool.broad.slot.wild.0.name': 'TTMS', 'pool.broad.slot.wild.1.name': 'EhlersRoofingFilterA', 'feat.trend.2nd Order Gaussian High Pass Filter MTF Zones.alpha': 0.2, 'feat.trend.SuperTrend.period': 15, 'feat.trend.SuperTrend.multiplier': 1, 'feat.momentum.ROCP.timeperiod': 6, 'feat.volatility.BamsBung3.length': 30, 'feat.volatility.BamsBung3.deviation': 3.0, 'feat.volatility.BamsBung3.money_risk': 0.1, 'feat.volatility.BamsBung3.signal_mode': 2, 'feat.volatility.BamsBung3.line_mode': 0, 'feat.volatility.TTMS.bb_length': 20, 'feat.volatility.TTMS.bb_deviation': 1.5, 'feat.volatility.TTMS.keltner_length': 10, 'feat.volatility.TTMS.keltner_smooth_length': 30, 'feat.volatility.TTMS.keltner_smooth_method': 0, 'feat.volatility.TTMS.keltner_deviation': 1.0, 'feat.trend.EhlersRoofingFilterA.hp_length': 100, 'feat.trend.EhlersRoofingFilterA.lp_length': 60}. Best is trial 7 with value: 17.0246.
[I 2026-02-27 21:11:13,906] Trial 8 pruned. Insufficient activity: Trades_Per_Day=0.01 < prune_threshold=0.02.
[I 2026-02-27 21:11:14,642] Trial 3 pruned. Insufficient activity: Trades_Per_Day=0.01 < prune_threshold=0.04.
[I 2026-02-27 21:11:15,654] Trial 71 finished with value: 37.6584 and parameters: {'model_key': 'linearsvm', 'svm.C': 0.0697117755708639, 'svm.max_iter': 1000, 'th.mode': 'asymmetric', 'th.long_enter': 0.4, 'th.short_enter_abs': 0.1, 'th.hysteresis': 0.08, 'risk.tp_mode': 'none', 'risk.risk_pct': 0.005, 'risk.atr_mult': 1.25, 'features.target_count': 5, 'slot.trend.count': 1, 'slot.mom.count': 2, 'slot.vol.count': 1, 'slot.wild.count': 0, 'pool.broad.slot.trend.0.name': 'KijunSen', 'pool.broad.slot.mom.0.name': 'Laguerre', 'pool.broad.slot.mom.1.name': 'TDFI', 'pool.broad.slot.vol.0.name': 'VolatilityRatio', 'pool.broad.slot.wild.0.name': 'Doda-Stochastic-Modified', 'feat.trend.KijunSen.period': 5, 'feat.momentum.Laguerre.gamma': 0.4, 'feat.momentum.TDFI.period': 16, 'feat.volatility.VolatilityRatio.period': 20, 'feat.trend.Doda-Stochastic-Modified.Slw': 13, 'feat.trend.Doda-Stochastic-Modified.Pds': 21, 'feat.trend.Doda-Stochastic-Modified.Slwsignal': 13}. Best is trial 56 with value: 65.7867.
[I 2026-02-27 21:11:15,718] Trial 7 pruned. Insufficient activity: Trades_Per_Day=0.01 < prune_threshold=0.02.
[I 2026-02-27 21:11:15,776] Trial 9 pruned. Insufficient activity: Trades_Per_Day=0.0 < prune_threshold=0.02.
[I 2026-02-27 21:11:15,897] Trial 12 finished with value: 0.3921 and parameters: {'model_key': 'linearsvm', 'svm.C': 0.0875268554376034, 'svm.max_iter': 600, 'th.mode': 'asymmetric', 'th.long_enter': 0.0, 'th.short_enter_abs': 0.0, 'th.hysteresis': 0.04, 'risk.tp_mode': 'none', 'risk.risk_pct': 0.01, 'risk.atr_mult': 2.75, 'features.target_count': 5, 'slot.trend.count': 2, 'slot.mom.count': 2, 'slot.vol.count': 0, 'slot.wild.count': 1, 'pool.broad.slot.trend.0.name': 'GChannel', 'pool.broad.slot.trend.1.name': 'EhlersRoofingFilterA', 'pool.broad.slot.mom.0.name': 'GlitchIndexFixed', 'pool.broad.slot.mom.1.name': 'TTF', 'pool.broad.slot.wild.0.name': 'GlitchIndexFixed', 'feat.baseline.GChannel.length': 20, 'feat.baseline.GChannel.price': 'typical', 'feat.trend.EhlersRoofingFilterA.hp_length': 120, 'feat.trend.EhlersRoofingFilterA.lp_length': 30, 'feat.momentum.GlitchIndexFixed.MaPeriod': 20, 'feat.momentum.GlitchIndexFixed.MaMethod': 'nlma', 'feat.momentum.GlitchIndexFixed.Price': 'haaverage', 'feat.momentum.GlitchIndexFixed.level1': 0.5, 'feat.momentum.GlitchIndexFixed.level2': 2.0, 'feat.momentum.TTF.ttf_bars': 12, 'feat.momentum.TTF.top_line': 70.0, 'feat.momentum.TTF.bottom_line': -75.0, 'feat.momentum.TTF.t3_period': 1, 'feat.trend.AROON.timeperiod': 10}. Best is trial 9 with value: 11.1023.
