[I 2026-02-27 21:11:28,920] Trial 9 finished with value: 1.2592 and parameters: {'model_key': 'rf', 'rf.n_estimators': 250, 'rf.max_depth': 7, 'th.mode': 'symmetric', 'th.sym_base': 0.05, 'th.hysteresis': 0.04, 'risk.tp_mode': 'none', 'risk.risk_pct': 0.0075, 'risk.atr_mult': 1.75, 'features.target_count': 5, 'slot.trend.count': 2, 'slot.mom.count': 1, 'slot.vol.count': 1, 'slot.wild.count': 0, 'pool.broad.slot.trend.0.name': '3rdgenma', 'pool.broad.slot.trend.1.name': 'hacolt_2.02_lines', 'pool.broad.slot.mom.0.name': 'BullsBearsImpulse', 'pool.broad.slot.vol.0.name': 'BamsBung3', 'pool.broad.slot.wild.0.name': 'TII', 'feat.trend.3rdgenma.ma_period': 260, 'feat.trend.3rdgenma.sampling_period': 30, 'feat.trend.3rdgenma.method': 0, 'feat.trend.hacolt_2.02_lines.Length': 34, 'feat.trend.hacolt_2.02_lines.CandleSize': 1.3, 'feat.trend.hacolt_2.02_lines.LtLength': 40, 'feat.momentum.BullsBearsImpulse.ma_period': 40, 'feat.volatility.BamsBung3.length': 20, 'feat.volatility.BamsBung3.deviation': 2.0, 'feat.volatility.BamsBung3.money_risk': 0.01, 'feat.volatility.BamsBung3.signal_mode': 2, 'feat.volatility.BamsBung3.line_mode': 1, 'feat.trend.TII.length': 20, 'feat.trend.TII.ma_length': 90, 'feat.trend.TII.ma_method': 2, 'feat.trend.TII.price': 4}. Best is trial 6 with value: 62.6249.
[I 2026-02-27 21:11:29,399] Trial 9 finished with value: 0.3392 and parameters: {'model_key': 'linearsvm', 'svm.C': 0.03575832383947966, 'svm.max_iter': 600, 'th.mode': 'symmetric', 'th.sym_base': 0.15000000000000002, 'th.hysteresis': 0.05, 'risk.tp_mode': 'none', 'risk.risk_pct': 0.0175, 'risk.atr_mult': 1.25, 'features.target_count': 5, 'slot.trend.count': 1, 'slot.mom.count': 1, 'slot.vol.count': 1, 'slot.wild.count': 1, 'pool.broad.slot.trend.0.name': 'SMA', 'pool.broad.slot.mom.0.name': 'MACDEXT', 'pool.broad.slot.vol.0.name': 'STDDEV', 'pool.broad.slot.wild.0.name': 'EMA', 'pool.broad.slot.wild.1.name': 'ROCR', 'feat.baseline.SMA.period': 16, 'feat.momentum.MACDEXT.fastperiod': 12, 'feat.momentum.MACDEXT.fastmatype': 8, 'feat.momentum.MACDEXT.slowperiod': 24, 'feat.momentum.MACDEXT.slowmatype': 5, 'feat.momentum.MACDEXT.signalperiod': 6, 'feat.momentum.MACDEXT.signalmatype': 0, 'feat.volatility.STDDEV.timeperiod': 15, 'feat.volatility.STDDEV.nbdev': 7, 'feat.baseline.EMA.period': 14, 'feat.momentum.ROCR.timeperiod': 5}. Best is trial 5 with value: 0.4961.
[I 2026-02-27 21:11:29,461] Trial 15 finished with value: 0.7698 and parameters: {'model_key': 'linearsvm', 'svm.C': 0.6519715570037313, 'svm.max_iter': 600, 'th.mode': 'symmetric', 'th.sym_base': 0.2, 'th.hysteresis': 0.05, 'risk.tp_mode': 'none', 'risk.risk_pct': 0.0075, 'risk.atr_mult': 2.0, 'features.target_count': 4, 'slot.trend.count': 1, 'slot.mom.count': 1, 'slot.vol.count': 1, 'slot.wild.count': 0, 'pool.broad.slot.trend.0.name': 'TrendDirectionForceIndexSmoothed4', 'pool.broad.slot.mom.0.name': 'TDFI', 'pool.broad.slot.vol.0.name': 'TTMS', 'pool.broad.slot.wild.0.name': 'ATRBasedEMAVariant1', 'feat.trend.TrendDirectionForceIndexSmoothed4.trend_period': 10, 'feat.trend.TrendDirectionForceIndexSmoothed4.trend_method': 'pwma', 'feat.trend.TrendDirectionForceIndexSmoothed4.price': 'median', 'feat.trend.TrendDirectionForceIndexSmoothed4.trigger_up': 0.05, 'feat.trend.TrendDirectionForceIndexSmoothed4.trigger_down': -0.1, 'feat.trend.TrendDirectionForceIndexSmoothed4.smooth_length': 3.0, 'feat.trend.TrendDirectionForceIndexSmoothed4.smooth_phase': 50.0, 'feat.trend.TrendDirectionForceIndexSmoothed4.color_change_on_zero_cross': True, 'feat.trend.TrendDirectionForceIndexSmoothed4.point': 0.01, 'feat.momentum.TDFI.period': 7, 'feat.volatility.TTMS.bb_length': 10, 'feat.volatility.TTMS.bb_deviation': 1.0, 'feat.volatility.TTMS.keltner_length': 14, 'feat.volatility.TTMS.keltner_smooth_length': 10, 'feat.volatility.TTMS.keltner_smooth_method': 1, 'feat.volatility.TTMS.keltner_deviation': 2.0, 'feat.baseline.ATRBasedEMAVariant1.ema_fastest': 21.0, 'feat.baseline.ATRBasedEMAVariant1.multiplier': 100.0}. Best is trial 7 with value: 26.6898.
[I 2026-02-27 21:11:29,650] Trial 10 finished with value: 0.156 and parameters: {'model_key': 'lr', 'lr.C': 3.195963725389302, 'lr.max_iter': 1000, 'th.mode': 'symmetric', 'th.sym_base': 0.1, 'th.hysteresis': 0.02, 'risk.tp_mode': 'none', 'risk.risk_pct': 0.02, 'risk.atr_mult': 2.0, 'features.target_count': 6, 'slot.trend.count': 1, 'slot.mom.count': 1, 'slot.vol.count': 1, 'slot.wild.count': 0, 'pool.broad.slot.trend.0.name': 'SherifHilo', 'pool.broad.slot.mom.0.name': 'MACDZeroLag', 'pool.broad.slot.vol.0.name': 'STDDEV', 'pool.broad.slot.wild.0.name': 'TwiggsMF', 'pool.broad.slot.wild.1.name': 'STOCHF_Fast', 'feat.trend.SherifHilo.period_high': 100, 'feat.trend.SherifHilo.period_lows': 50, 'feat.momentum.MACDZeroLag.short_period': 7, 'feat.momentum.MACDZeroLag.long_period': 53, 'feat.momentum.MACDZeroLag.signal_period': 10, 'feat.volatility.STDDEV.timeperiod': 22, 'feat.volatility.STDDEV.nbdev': 8, 'feat.volume.TwiggsMF.period': 20, 'feat.momentum.STOCHF_Fast.fastk_period': 5, 'feat.momentum.STOCHF_Fast.fastd_period': 4, 'feat.momentum.STOCHF_Fast.fastd_matype': 8, 'feat.trend.AROON.timeperiod': 10}. Best is trial 6 with value: 62.6249.
[I 2026-02-27 21:11:30,227] Trial 11 pruned. Insufficient activity: Trades_Per_Day=0.01 < prune_threshold=0.02.
[I 2026-02-27 21:11:30,321] Trial 16 pruned. Insufficient activity: Trades_Per_Day=0.0 < prune_threshold=0.02.
[I 2026-02-27 21:11:30,337] Trial 11 finished with value: 0.3275 and parameters: {'model_key': 'linearsvm', 'svm.C': 0.023065372167596097, 'svm.max_iter': 1000, 'th.mode': 'asymmetric', 'th.long_enter': 0.15000000000000002, 'th.short_enter_abs': 0.1, 'th.hysteresis': 0.07, 'risk.tp_mode': 'none', 'risk.risk_pct': 0.0125, 'risk.atr_mult': 2.75, 'features.target_count': 5, 'slot.trend.count': 1, 'slot.mom.count': 1, 'slot.vol.count': 0, 'slot.wild.count': 1, 'pool.broad.slot.trend.0.name': 'RecursiveMA', 'pool.broad.slot.mom.0.name': 'ROCR100', 'pool.broad.slot.wild.0.name': 'precision-trend-histogram', 'pool.broad.slot.wild.1.name': 'ChandelierExit', 'feat.baseline.RecursiveMA.period': 2, 'feat.baseline.RecursiveMA.recursions': 15, 'feat.momentum.ROCR100.timeperiod': 14, 'feat.trend.precision-trend-histogram.avg_period': 35, 'feat.trend.ChandelierExit.lookback': 13, 'feat.trend.ChandelierExit.atr_period': 14, 'feat.trend.ChandelierExit.atr_mult': 3.0, 'feat.trend.AROON.timeperiod': 15}. Best is trial 7 with value: 0.8636.
[I 2026-02-27 21:11:30,476] Trial 38 finished with value: 0.1723 and parameters: {'model_key': 'linearsvm', 'svm.C': 0.10632249268622025, 'svm.max_iter': 1200, 'th.mode': 'symmetric', 'th.sym_base': 0.25, 'th.hysteresis': 0.0, 'risk.tp_mode': 'none', 'risk.risk_pct': 0.0075, 'risk.atr_mult': 3.0, 'features.target_count': 5, 'slot.trend.count': 2, 'slot.mom.count': 1, 'slot.vol.count': 0, 'slot.wild.count': 1, 'pool.broad.slot.trend.0.name': 'T3MA', 'pool.broad.slot.trend.1.name': 'TrendDirectionForceIndexSmoothed4', 'pool.broad.slot.mom.0.name': 'SmoothedMomentum', 'pool.broad.slot.wild.0.name': 'TSF', 'pool.broad.slot.wild.1.name': 'MACDZeroLag', 'feat.baseline.T3MA.length': 30, 'feat.baseline.T3MA.b': 0.88, 'feat.trend.TrendDirectionForceIndexSmoothed4.trend_period': 50, 'feat.trend.TrendDirectionForceIndexSmoothed4.trend_method': 'pwma', 'feat.trend.TrendDirectionForceIndexSmoothed4.price': 'haclose', 'feat.trend.TrendDirectionForceIndexSmoothed4.trigger_up': 0.05, 'feat.trend.TrendDirectionForceIndexSmoothed4.trigger_down': -0.1, 'feat.trend.TrendDirectionForceIndexSmoothed4.smooth_length': 5.0, 'feat.trend.TrendDirectionForceIndexSmoothed4.smooth_phase': 0.0, 'feat.trend.TrendDirectionForceIndexSmoothed4.color_change_on_zero_cross': True, 'feat.trend.TrendDirectionForceIndexSmoothed4.point': 0.01, 'feat.momentum.SmoothedMomentum.momentum_length': 12, 'feat.momentum.SmoothedMomentum.use_smoothing': False, 'feat.momentum.SmoothedMomentum.smoothing_method': 0, 'feat.momentum.SmoothedMomentum.smoothing_length': 5, 'feat.momentum.SmoothedMomentum.price': 3, 'feat.momentum.TSF.timeperiod': 17, 'feat.momentum.MACDZeroLag.short_period': 16, 'feat.momentum.MACDZeroLag.long_period': 35, 'feat.momentum.MACDZeroLag.signal_period': 9}. Best is trial 35 with value: 31.8033.
[I 2026-02-27 21:11:30,633] Trial 10 finished with value: 43.146 and parameters: {'model_key': 'linearsvm', 'svm.C': 0.10101064066994299, 'svm.max_iter': 800, 'th.mode': 'symmetric', 'th.sym_base': 0.05, 'th.hysteresis': 0.06, 'risk.tp_mode': 'none', 'risk.risk_pct': 0.005, 'risk.atr_mult': 1.25, 'features.target_count': 4, 'slot.trend.count': 1, 'slot.mom.count': 2, 'slot.vol.count': 1, 'slot.wild.count': 1, 'pool.broad.slot.trend.0.name': 'EhlersRoofingFilterA', 'pool.broad.slot.mom.0.name': 'METROFixed', 'pool.broad.slot.mom.1.name': 'MACDFIX', 'pool.broad.slot.vol.0.name': 'VolatilityRatio', 'feat.trend.EhlersRoofingFilterA.hp_length': 80, 'feat.trend.EhlersRoofingFilterA.lp_length': 30, 'feat.momentum.METROFixed.period_rsi': 14, 'feat.momentum.METROFixed.step_size_fast': 5.0, 'feat.momentum.METROFixed.step_size_slow': 15.0, 'feat.momentum.MACDFIX.signalperiod': 11, 'feat.volatility.VolatilityRatio.period': 30}. Best is trial 10 with value: 43.146.
[I 2026-02-27 21:11:30,902] Trial 17 pruned. Insufficient activity: Trades_Per_Day=0.01 < prune_threshold=0.02.
[I 2026-02-27 21:11:31,761] Trial 75 finished with value: 27.4729 and parameters: {'model_key': 'linearsvm', 'svm.C': 0.19187809213904666, 'svm.max_iter': 800, 'th.mode': 'asymmetric', 'th.long_enter': 0.4, 'th.short_enter_abs': 0.0, 'th.hysteresis': 0.07, 'risk.tp_mode': 'none', 'risk.risk_pct': 0.0075, 'risk.atr_mult': 1.25, 'features.target_count': 5, 'slot.trend.count': 1, 'slot.mom.count': 2, 'slot.vol.count': 1, 'slot.wild.count': 0, 'pool.broad.slot.trend.0.name': 'RangeFilterModified', 'pool.broad.slot.mom.0.name': 'Zerolag_MACD.mq4', 'pool.broad.slot.mom.1.name': 'MACDFIX', 'pool.broad.slot.vol.0.name': 'VolatilityRatio', 'pool.broad.slot.wild.0.name': 'KijunSen', 'feat.baseline.RangeFilterModified.atr_period': 21, 'feat.baseline.RangeFilterModified.multiplier': 2.0, 'feat.momentum.Zerolag_MACD.mq4.fast': 12, 'feat.momentum.Zerolag_MACD.mq4.slow': 20, 'feat.momentum.Zerolag_MACD.mq4.signal': 12, 'feat.momentum.MACDFIX.signalperiod': 11, 'feat.volatility.VolatilityRatio.period': 30, 'feat.trend.KijunSen.period': 20}. Best is trial 56 with value: 65.7867.
[I 2026-02-27 21:11:31,975] Trial 11 finished with value: 0.3623 and parameters: {'model_key': 'lr', 'lr.C': 0.051265989958679994, 'lr.max_iter': 600, 'th.mode': 'symmetric', 'th.sym_base': 0.0, 'th.hysteresis': 0.09, 'risk.tp_mode': 'none', 'risk.risk_pct': 0.0125, 'risk.atr_mult': 2.5, 'features.target_count': 4, 'slot.trend.count': 2, 'slot.mom.count': 1, 'slot.vol.count': 0, 'slot.wild.count': 0, 'pool.broad.slot.trend.0.name': 'Trimagen', 'pool.broad.slot.trend.1.name': 'Momentum Candles Modified w ATR', 'pool.broad.slot.mom.0.name': 'TTF', 'pool.broad.slot.wild.0.name': 'Vortex_Indicator', 'feat.baseline.Trimagen.period': 50, 'feat.baseline.Trimagen.applied_price': 'typical', 'feat.trend.Momentum Candles Modified w ATR.atr_period': 21, 'feat.trend.Momentum Candles Modified w ATR.atr_multiplier': 4.0, 'feat.momentum.TTF.ttf_bars': 20, 'feat.momentum.TTF.top_line': 75.0, 'feat.momentum.TTF.bottom_line': -75.0, 'feat.momentum.TTF.t3_period': 3, 'feat.trend.Vortex_Indicator.length': 7}. Best is trial 10 with value: 43.146.
[I 2026-02-27 21:11:32,121] Trial 12 pruned. Insufficient activity: Trades_Per_Day=0.0 < prune_threshold=0.02.
[I 2026-02-27 21:11:32,227] Trial 11 finished with value: 0.5799 and parameters: {'model_key': 'linearsvm', 'svm.C': 3.151744232656022, 'svm.max_iter': 1000, 'th.mode': 'symmetric', 'th.sym_base': 0.1, 'th.hysteresis': 0.07, 'risk.tp_mode': 'fixed', 'risk.tp_multiple': 1.5, 'risk.risk_pct': 0.01, 'risk.atr_mult': 1.75, 'features.target_count': 5, 'slot.trend.count': 2, 'slot.mom.count': 2, 'slot.vol.count': 1, 'slot.wild.count': 0, 'pool.broad.slot.trend.0.name': 'TrendLord', 'pool.broad.slot.trend.1.name': 'HalfTrend', 'pool.broad.slot.mom.0.name': 'ROCP', 'pool.broad.slot.mom.1.name': 'ErgodicTVI', 'pool.broad.slot.vol.0.name': 'STDDEV', 'feat.baseline.TrendLord.period': 19, 'feat.baseline.TrendLord.ma_method': 'sma', 'feat.baseline.TrendLord.signal_bar': 2, 'feat.trend.HalfTrend.amplitude': 8, 'feat.momentum.ROCP.timeperiod': 5, 'feat.momentum.ErgodicTVI.Period1': 16, 'feat.momentum.ErgodicTVI.Period2': 16, 'feat.momentum.ErgodicTVI.Period3': 5, 'feat.momentum.ErgodicTVI.EPeriod1': 13, 'feat.momentum.ErgodicTVI.EPeriod2': 5, 'feat.momentum.ErgodicTVI.EPeriod3': 13, 'feat.volatility.STDDEV.timeperiod': 3, 'feat.volatility.STDDEV.nbdev': 5}. Best is trial 7 with value: 33.022.
[I 2026-02-27 21:11:32,990] Trial 12 pruned. Insufficient activity: Trades_Per_Day=0.0 < prune_threshold=0.02.
[I 2026-02-27 21:11:33,137] Trial 15 finished with value: 0.6456 and parameters: {'model_key': 'lr', 'lr.C': 0.495710021199695, 'lr.max_iter': 1000, 'th.mode': 'asymmetric', 'th.long_enter': 0.05, 'th.short_enter_abs': 0.05, 'th.hysteresis': 0.05, 'risk.tp_mode': 'none', 'risk.risk_pct': 0.0125, 'risk.atr_mult': 1.75, 'features.target_count': 6, 'slot.trend.count': 2, 'slot.mom.count': 2, 'slot.vol.count': 1, 'slot.wild.count': 0, 'pool.broad.slot.trend.0.name': 'TopTrend', 'pool.broad.slot.trend.1.name': 'TII', 'pool.broad.slot.mom.0.name': 'MACDEXT', 'pool.broad.slot.mom.1.name': 'Zerolag_MACD.mq4', 'pool.broad.slot.vol.0.name': 'BamsBung3', 'pool.broad.slot.wild.0.name': 'TrendAkkam', 'feat.trend.TopTrend.period': 25, 'feat.trend.TII.length': 20, 'feat.trend.TII.ma_length': 120, 'feat.trend.TII.ma_method': 1, 'feat.trend.TII.price': 2, 'feat.momentum.MACDEXT.fastperiod': 12, 'feat.momentum.MACDEXT.fastmatype': 2, 'feat.momentum.MACDEXT.slowperiod': 34, 'feat.momentum.MACDEXT.slowmatype': 5, 'feat.momentum.MACDEXT.signalperiod': 10, 'feat.momentum.MACDEXT.signalmatype': 6, 'feat.momentum.Zerolag_MACD.mq4.fast': 12, 'feat.momentum.Zerolag_MACD.mq4.slow': 30, 'feat.momentum.Zerolag_MACD.mq4.signal': 5, 'feat.volatility.BamsBung3.length': 10, 'feat.volatility.BamsBung3.deviation': 1.5, 'feat.volatility.BamsBung3.money_risk': 0.01, 'feat.volatility.BamsBung3.signal_mode': 0, 'feat.volatility.BamsBung3.line_mode': 0, 'feat.trend.TrendAkkam.akk_range': 14, 'feat.trend.TrendAkkam.ima_range': 10, 'feat.trend.TrendAkkam.akk_factor': 4.0, 'feat.trend.TrendAkkam.mode': 1, 'feat.trend.TrendAkkam.delta_price': 30.0, 'feat.trend.TrendAkkam.point': 0.1}. Best is trial 13 with value: 23.7346.
[I 2026-02-27 21:11:33,534] Trial 12 finished with value: 0.5875 and parameters: {'model_key': 'linearsvm', 'svm.C': 5.655958681567891, 'svm.max_iter': 600, 'th.mode': 'asymmetric', 'th.long_enter': 0.0, 'th.short_enter_abs': 0.2, 'th.hysteresis': 0.0, 'risk.tp_mode': 'none', 'risk.risk_pct': 0.015, 'risk.atr_mult': 2.0, 'features.target_count': 5, 'slot.trend.count': 2, 'slot.mom.count': 2, 'slot.vol.count': 1, 'slot.wild.count': 0, 'pool.broad.slot.trend.0.name': 'cyber-cycle', 'pool.broad.slot.trend.1.name': 'McGinley Dynamic 2.3', 'pool.broad.slot.mom.0.name': 'Price Momentum Oscillator', 'pool.broad.slot.mom.1.name': 'MACDFIX', 'pool.broad.slot.vol.0.name': 'STDDEV', 'feat.trend.cyber-cycle.price': 'hl2', 'feat.baseline.McGinley Dynamic 2.3.period': 14, 'feat.baseline.McGinley Dynamic 2.3.price': 'median', 'feat.baseline.McGinley Dynamic 2.3.constant': 8.0, 'feat.baseline.McGinley Dynamic 2.3.method': 'sma', 'feat.momentum.Price Momentum Oscillator.one': 35, 'feat.momentum.Price Momentum Oscillator.two': 14, 'feat.momentum.Price Momentum Oscillator.period': 10, 'feat.momentum.MACDFIX.signalperiod': 9, 'feat.volatility.STDDEV.timeperiod': 15, 'feat.volatility.STDDEV.nbdev': 5}. Best is trial 7 with value: 33.022.
[I 2026-02-27 21:11:34,786] Trial 12 finished with value: 13.549 and parameters: {'model_key': 'lr', 'lr.C': 0.05314384236670361, 'lr.max_iter': 1000, 'th.mode': 'symmetric', 'th.sym_base': 0.05, 'th.hysteresis': 0.02, 'risk.tp_mode': 'fixed', 'risk.tp_multiple': 1.5, 'risk.risk_pct': 0.005, 'risk.atr_mult': 3.0, 'features.target_count': 4, 'slot.trend.count': 1, 'slot.mom.count': 1, 'slot.vol.count': 0, 'slot.wild.count': 0, 'pool.broad.slot.trend.0.name': 'GeominMA', 'pool.broad.slot.mom.0.name': 'METROFixed', 'pool.broad.slot.wild.0.name': 'GlitchIndexFixed', 'pool.broad.slot.wild.1.name': 'RecursiveMA', 'feat.trend.GeominMA.length': 10, 'feat.trend.GeominMA.price': 2, 'feat.momentum.METROFixed.period_rsi': 14, 'feat.momentum.METROFixed.step_size_fast': 10.0, 'feat.momentum.METROFixed.step_size_slow': 10.0, 'feat.momentum.GlitchIndexFixed.MaPeriod': 30, 'feat.momentum.GlitchIndexFixed.MaMethod': 'lwma', 'feat.momentum.GlitchIndexFixed.Price': 'typical', 'feat.momentum.GlitchIndexFixed.level1': 1.0, 'feat.momentum.GlitchIndexFixed.level2': 2.5, 'feat.baseline.RecursiveMA.period': 4, 'feat.baseline.RecursiveMA.recursions': 10}. Best is trial 12 with value: 13.549.
[I 2026-02-27 21:11:34,850] Trial 76 finished with value: 55.7431 and parameters: {'model_key': 'linearsvm', 'svm.C': 0.27339448582603193, 'svm.max_iter': 800, 'th.mode': 'asymmetric', 'th.long_enter': 0.4, 'th.short_enter_abs': 0.0, 'th.hysteresis': 0.07, 'risk.tp_mode': 'none', 'risk.risk_pct': 0.0075, 'risk.atr_mult': 1.25, 'features.target_count': 5, 'slot.trend.count': 1, 'slot.mom.count': 2, 'slot.vol.count': 1, 'slot.wild.count': 0, 'pool.broad.slot.trend.0.name': 'Ehlers Early Onset Trend', 'pool.broad.slot.mom.0.name': 'METROFixed', 'pool.broad.slot.mom.1.name': 'MACDFIX', 'pool.broad.slot.vol.0.name': 'VolatilityRatio', 'pool.broad.slot.wild.0.name': 'QQEWithAlerts', 'feat.trend.Ehlers Early Onset Trend.period': 30, 'feat.momentum.METROFixed.period_rsi': 14, 'feat.momentum.METROFixed.step_size_fast': 5.0, 'feat.momentum.METROFixed.step_size_slow': 15.0, 'feat.momentum.MACDFIX.signalperiod': 11, 'feat.volatility.VolatilityRatio.period': 30, 'feat.trend.QQEWithAlerts.rsi_period': 14, 'feat.trend.QQEWithAlerts.sf': 3}. Best is trial 56 with value: 65.7867.
[I 2026-02-27 21:11:34,877] Trial 18 finished with value: 55.6239 and parameters: {'model_key': 'rf', 'rf.n_estimators': 400, 'rf.max_depth': 7, 'th.mode': 'symmetric', 'th.sym_base': 0.0, 'th.hysteresis': 0.05, 'risk.tp_mode': 'none', 'risk.risk_pct': 0.0175, 'risk.atr_mult': 3.0, 'features.target_count': 6, 'slot.trend.count': 2, 'slot.mom.count': 2, 'slot.vol.count': 1, 'slot.wild.count': 1, 'pool.broad.slot.trend.0.name': 'VIDYA', 'pool.broad.slot.trend.1.name': 'TrendDirectionForceIndexSmoothed4', 'pool.broad.slot.mom.0.name': 'METROFixed', 'pool.broad.slot.mom.1.name': 'RSI', 'pool.broad.slot.vol.0.name': 'VAR', 'pool.broad.slot.wild.0.name': 'Coral', 'feat.baseline.VIDYA.period': 13, 'feat.baseline.VIDYA.histper': 10, 'feat.trend.TrendDirectionForceIndexSmoothed4.trend_period': 50, 'feat.trend.TrendDirectionForceIndexSmoothed4.trend_method': 'vwma', 'feat.trend.TrendDirectionForceIndexSmoothed4.price': 'hamedian', 'feat.trend.TrendDirectionForceIndexSmoothed4.trigger_up': 0.02, 'feat.trend.TrendDirectionForceIndexSmoothed4.trigger_down': -0.1, 'feat.trend.TrendDirectionForceIndexSmoothed4.smooth_length': 13.0, 'feat.trend.TrendDirectionForceIndexSmoothed4.smooth_phase': 0.0, 'feat.trend.TrendDirectionForceIndexSmoothed4.color_change_on_zero_cross': False, 'feat.trend.TrendDirectionForceIndexSmoothed4.point': 0.1, 'feat.momentum.METROFixed.period_rsi': 7, 'feat.momentum.METROFixed.step_size_fast': 3.0, 'feat.momentum.METROFixed.step_size_slow': 10.0, 'feat.momentum.RSI.timeperiod': 13, 'feat.volatility.VAR.timeperiod': 20, 'feat.volatility.VAR.nbdev': 7, 'feat.trend.Coral.length': 34, 'feat.trend.Coral.coef': 0.3}. Best is trial 18 with value: 55.6239.
[I 2026-02-27 21:11:34,993] Trial 13 finished with value: 0.7774 and parameters: {'model_key': 'rf', 'rf.n_estimators': 200, 'rf.max_depth': 7, 'th.mode': 'asymmetric', 'th.long_enter': 0.30000000000000004, 'th.short_enter_abs': 0.0, 'th.hysteresis': 0.1, 'risk.tp_mode': 'none', 'risk.risk_pct': 0.015, 'risk.atr_mult': 3.0, 'features.target_count': 6, 'slot.trend.count': 2, 'slot.mom.count': 2, 'slot.vol.count': 1, 'slot.wild.count': 0, 'pool.broad.slot.trend.0.name': 'GruchaIndex', 'pool.broad.slot.trend.1.name': 'forecast', 'pool.broad.slot.mom.0.name': 'TSF', 'pool.broad.slot.mom.1.name': 'STOCHRSI', 'pool.broad.slot.vol.0.name': 'Silence', 'pool.broad.slot.wild.0.name': 'Coral', 'feat.trend.GruchaIndex.period': 10, 'feat.trend.GruchaIndex.ma_period': 45, 'feat.trend.forecast.length': 30, 'feat.trend.forecast.price': 2, 'feat.momentum.TSF.timeperiod': 15, 'feat.momentum.STOCHRSI.timeperiod': 10, 'feat.momentum.STOCHRSI.fastk_period': 9, 'feat.momentum.STOCHRSI.fastd_period': 4, 'feat.momentum.STOCHRSI.fastd_matype': 1, 'feat.volatility.Silence.my_period': 16, 'feat.volatility.Silence.buff_size': 128, 'feat.trend.Coral.length': 21, 'feat.trend.Coral.coef': 0.3}. Best is trial 6 with value: 62.6249.
