[I 2026-02-27 21:11:41,937] Trial 79 finished with value: 29.0423 and parameters: {'model_key': 'linearsvm', 'svm.C': 0.6570084404552745, 'svm.max_iter': 1200, 'th.mode': 'asymmetric', 'th.long_enter': 0.35000000000000003, 'th.short_enter_abs': 0.05, 'th.hysteresis': 0.05, 'risk.tp_mode': 'none', 'risk.risk_pct': 0.01, 'risk.atr_mult': 1.0, 'features.target_count': 5, 'slot.trend.count': 1, 'slot.mom.count': 2, 'slot.vol.count': 1, 'slot.wild.count': 0, 'pool.broad.slot.trend.0.name': 'AdaptiveSmootherTriggerlinesMtfAlertsNmc', 'pool.broad.slot.mom.0.name': 'ULTOSC', 'pool.broad.slot.mom.1.name': 'METROFixed', 'pool.broad.slot.vol.0.name': 'VAR', 'pool.broad.slot.wild.0.name': 'ROC', 'feat.trend.AdaptiveSmootherTriggerlinesMtfAlertsNmc.LsmaPeriod': 50, 'feat.trend.AdaptiveSmootherTriggerlinesMtfAlertsNmc.AdaptPeriod': 30, 'feat.momentum.ULTOSC.timeperiod1': 7, 'feat.momentum.ULTOSC.timeperiod2': 20, 'feat.momentum.ULTOSC.timeperiod3': 36, 'feat.momentum.METROFixed.period_rsi': 21, 'feat.momentum.METROFixed.step_size_fast': 10.0, 'feat.momentum.METROFixed.step_size_slow': 20.0, 'feat.volatility.VAR.timeperiod': 15, 'feat.volatility.VAR.nbdev': 1, 'feat.momentum.ROC.timeperiod': 8}. Best is trial 56 with value: 65.7867.
[I 2026-02-27 21:11:42,366] Trial 7 pruned. Insufficient activity: Trades_Per_Day=0.01 < prune_threshold=0.04.
[I 2026-02-27 21:11:42,861] Trial 15 pruned. Insufficient activity: Trades_Per_Day=0.01 < prune_threshold=0.04.
[I 2026-02-27 21:11:42,925] Trial 16 pruned. Insufficient activity: Trades_Per_Day=0.0 < prune_threshold=0.02.
[I 2026-02-27 21:11:43,401] Trial 20 pruned. Insufficient activity: Trades_Per_Day=0.0 < prune_threshold=0.04.
[I 2026-02-27 21:11:43,634] Trial 16 pruned. Insufficient activity: Trades_Per_Day=0.02 < prune_threshold=0.04.
[I 2026-02-27 21:11:44,185] Trial 80 finished with value: 64.7804 and parameters: {'model_key': 'linearsvm', 'svm.C': 0.30513608245698753, 'svm.max_iter': 1000, 'th.mode': 'asymmetric', 'th.long_enter': 0.30000000000000004, 'th.short_enter_abs': 0.0, 'th.hysteresis': 0.06, 'risk.tp_mode': 'none', 'risk.risk_pct': 0.01, 'risk.atr_mult': 1.0, 'features.target_count': 5, 'slot.trend.count': 1, 'slot.mom.count': 2, 'slot.vol.count': 1, 'slot.wild.count': 0, 'pool.broad.slot.trend.0.name': 'KalmanFilter', 'pool.broad.slot.mom.0.name': 'METROFixed', 'pool.broad.slot.mom.1.name': 'METROFixed', 'pool.broad.slot.vol.0.name': 'William Vix-Fix', 'pool.broad.slot.wild.0.name': 'ADOSC', 'feat.trend.KalmanFilter.k': 2, 'feat.trend.KalmanFilter.sharpness': 50, 'feat.momentum.METROFixed.period_rsi': 28, 'feat.momentum.METROFixed.step_size_fast': 3.0, 'feat.momentum.METROFixed.step_size_slow': 30.0, 'feat.momentum.TTF.ttf_bars': 12, 'feat.momentum.TTF.top_line': 70.0, 'feat.momentum.TTF.bottom_line': -70.0, 'feat.momentum.TTF.t3_period': 2, 'feat.volatility.William Vix-Fix.period': 30, 'feat.volume.ADOSC.fastperiod': 7, 'feat.volume.ADOSC.slowperiod': 16}. Best is trial 56 with value: 65.7867.
[I 2026-02-27 21:11:44,349] Trial 18 pruned. Insufficient activity: Trades_Per_Day=0.0 < prune_threshold=0.02.
[02/27/2026 21:11:44] [ERROR] Study failed - Error: A process in the process pool was terminated abruptly while the future was running or pending. | Traceback: Traceback (most recent call last):
  File "C:\Users\sm598\Desktop\Applications\Development\Algo Trading\main.py", line 576, in run_all_studies
    meta = future.result()
  File "C:\Users\sm598\AppData\Local\Programs\Python\Python310\lib\concurrent\futures\_base.py", line 451, in result
    return self.__get_result()
  File "C:\Users\sm598\AppData\Local\Programs\Python\Python310\lib\concurrent\futures\_base.py", line 403, in __get_result
    raise self._exception
concurrent.futures.process.BrokenProcessPool: A process in the process pool was terminated abruptly while the future was running or pending.

