[I 2026-02-27 21:11:16,842] Trial 8 finished with value: 16.6019 and parameters: {'model_key': 'rf', 'rf.n_estimators': 600, 'rf.max_depth': 10, 'th.mode': 'symmetric', 'th.sym_base': 0.05, 'th.hysteresis': 0.01, 'risk.tp_mode': 'fixed', 'risk.tp_multiple': 3.0, 'risk.risk_pct': 0.0125, 'risk.atr_mult': 2.75, 'features.target_count': 5, 'slot.trend.count': 1, 'slot.mom.count': 2, 'slot.vol.count': 0, 'slot.wild.count': 0, 'pool.broad.slot.trend.0.name': 'KijunSen', 'pool.broad.slot.mom.0.name': 'RSI', 'pool.broad.slot.mom.1.name': 'Laguerre', 'pool.broad.slot.wild.0.name': 'EhlersTwoPoleSuperSmootherFilter', 'pool.broad.slot.wild.1.name': 'HLCTrend', 'feat.trend.KijunSen.period': 15, 'feat.momentum.RSI.timeperiod': 13, 'feat.momentum.Laguerre.gamma': 0.5, 'feat.baseline.EhlersTwoPoleSuperSmootherFilter.cutoff_period': 40, 'feat.trend.HLCTrend.close_period': 5, 'feat.trend.HLCTrend.low_period': 21, 'feat.trend.HLCTrend.high_period': 55}. Best is trial 7 with value: 26.6898.
[I 2026-02-27 21:11:17,367] Trial 6 pruned. Insufficient activity: Trades_Per_Day=0.01 < prune_threshold=0.02.
[I 2026-02-27 21:11:17,396] Trial 5 finished with value: 0.5368 and parameters: {'model_key': 'linearsvm', 'svm.C': 0.12099406818927774, 'svm.max_iter': 1200, 'th.mode': 'symmetric', 'th.sym_base': 0.15000000000000002, 'th.hysteresis': 0.03, 'risk.tp_mode': 'none', 'risk.risk_pct': 0.01, 'risk.atr_mult': 1.5, 'features.target_count': 6, 'slot.trend.count': 1, 'slot.mom.count': 2, 'slot.vol.count': 0, 'slot.wild.count': 0, 'pool.broad.slot.trend.0.name': 'SuperTrend', 'pool.broad.slot.mom.0.name': 'MACDFIX', 'pool.broad.slot.mom.1.name': 'ULTOSC', 'pool.broad.slot.wild.0.name': 'cyber-cycle', 'pool.broad.slot.wild.1.name': 'IS Calculation', 'feat.trend.SuperTrend.period': 45, 'feat.trend.SuperTrend.multiplier': 4, 'feat.momentum.MACDFIX.signalperiod': 9, 'feat.momentum.ULTOSC.timeperiod1': 4, 'feat.momentum.ULTOSC.timeperiod2': 14, 'feat.momentum.ULTOSC.timeperiod3': 38, 'feat.trend.cyber-cycle.price': 'close', 'feat.momentum.IS Calculation.period': 30, 'feat.momentum.IS Calculation.nbchandelier': 5, 'feat.momentum.IS Calculation.lag': 0, 'feat.trend.AROON.timeperiod': 30}. Best is trial 2 with value: 0.5895.
[I 2026-02-27 21:11:18,044] Trial 72 finished with value: 53.8158 and parameters: {'model_key': 'linearsvm', 'svm.C': 0.3819287871595736, 'svm.max_iter': 800, 'th.mode': 'asymmetric', 'th.long_enter': 0.4, 'th.short_enter_abs': 0.05, 'th.hysteresis': 0.06, 'risk.tp_mode': 'none', 'risk.risk_pct': 0.0075, 'risk.atr_mult': 1.25, 'features.target_count': 5, 'slot.trend.count': 1, 'slot.mom.count': 2, 'slot.vol.count': 1, 'slot.wild.count': 0, 'pool.broad.slot.trend.0.name': 'VIDYA', 'pool.broad.slot.mom.0.name': 'METROFixed', 'pool.broad.slot.mom.1.name': 'RSI', 'pool.broad.slot.vol.0.name': 'Silence', 'pool.broad.slot.wild.0.name': 'METROFixed', 'feat.baseline.VIDYA.period': 11, 'feat.baseline.VIDYA.histper': 15, 'feat.momentum.METROFixed.period_rsi': 14, 'feat.momentum.METROFixed.step_size_fast': 5.0, 'feat.momentum.METROFixed.step_size_slow': 15.0, 'feat.momentum.RSI.timeperiod': 14, 'feat.volatility.Silence.my_period': 24, 'feat.volatility.Silence.buff_size': 64, 'feat.trend.AROON.timeperiod': 15}. Best is trial 56 with value: 65.7867.
C:\Users\sm598\Desktop\Applications\Development\Algo Trading\scripts\indicators\calculation_functions.py:1314: RuntimeWarning: overflow encountered in scalar multiply
  velocity = velocity + distance * k / 100
C:\Users\sm598\Desktop\Applications\Development\Algo Trading\scripts\indicators\calculation_functions.py:1313: RuntimeWarning: invalid value encountered in scalar add
  error = value + distance * np.sqrt(sharpness * k / 100)
C:\Users\sm598\Desktop\Applications\Development\Algo Trading\scripts\indicators\calculation_functions.py:1314: RuntimeWarning: invalid value encountered in scalar add
  velocity = velocity + distance * k / 100
[I 2026-02-27 21:11:18,163] Trial 13 finished with value: 23.7346 and parameters: {'model_key': 'lr', 'lr.C': 0.21312312832296235, 'lr.max_iter': 1000, 'th.mode': 'symmetric', 'th.sym_base': 0.05, 'th.hysteresis': 0.05, 'risk.tp_mode': 'fixed', 'risk.tp_multiple': 2.5, 'risk.risk_pct': 0.005, 'risk.atr_mult': 2.0, 'features.target_count': 5, 'slot.trend.count': 2, 'slot.mom.count': 1, 'slot.vol.count': 1, 'slot.wild.count': 0, 'pool.broad.slot.trend.0.name': 'EMA', 'pool.broad.slot.trend.1.name': 'SSL', 'pool.broad.slot.mom.0.name': 'MACDFIX', 'pool.broad.slot.vol.0.name': 'CVI_Multi', 'pool.broad.slot.wild.0.name': 'cyber-cycle', 'feat.baseline.EMA.period': 10, 'feat.trend.SSL.period': 50, 'feat.momentum.MACDFIX.signalperiod': 6, 'feat.volatility.CVI_Multi.length': 7, 'feat.volatility.CVI_Multi.method': 3, 'feat.volatility.CVI_Multi.use_modified': True, 'feat.trend.cyber-cycle.price': 'wclose'}. Best is trial 13 with value: 23.7346.
[I 2026-02-27 21:11:18,167] Trial 4 pruned. Insufficient activity: Trades_Per_Day=0.0 < prune_threshold=0.04.
[I 2026-02-27 21:11:18,395] Trial 10 pruned. Insufficient activity: Trades_Per_Day=0.01 < prune_threshold=0.02.
[I 2026-02-27 21:11:18,708] Trial 8 finished with value: 16.2934 and parameters: {'model_key': 'lr', 'lr.C': 0.05314384236670361, 'lr.max_iter': 1000, 'th.mode': 'symmetric', 'th.sym_base': 0.05, 'th.hysteresis': 0.02, 'risk.tp_mode': 'fixed', 'risk.tp_multiple': 1.5, 'risk.risk_pct': 0.005, 'risk.atr_mult': 3.0, 'features.target_count': 4, 'slot.trend.count': 1, 'slot.mom.count': 1, 'slot.vol.count': 0, 'slot.wild.count': 0, 'pool.broad.slot.trend.0.name': 'GeominMA', 'pool.broad.slot.mom.0.name': 'METROFixed', 'pool.broad.slot.wild.0.name': 'GlitchIndexFixed', 'pool.broad.slot.wild.1.name': 'RecursiveMA', 'feat.trend.GeominMA.length': 10, 'feat.trend.GeominMA.price': 2, 'feat.momentum.METROFixed.period_rsi': 14, 'feat.momentum.METROFixed.step_size_fast': 10.0, 'feat.momentum.METROFixed.step_size_slow': 10.0, 'feat.momentum.GlitchIndexFixed.MaPeriod': 30, 'feat.momentum.GlitchIndexFixed.MaMethod': 'lwma', 'feat.momentum.GlitchIndexFixed.Price': 'typical', 'feat.momentum.GlitchIndexFixed.level1': 1.0, 'feat.momentum.GlitchIndexFixed.level2': 2.5, 'feat.baseline.RecursiveMA.period': 4, 'feat.baseline.RecursiveMA.recursions': 10}. Best is trial 8 with value: 16.2934.
[I 2026-02-27 21:11:20,332] Trial 33 pruned. Insufficient activity: Trades_Per_Day=0.0 < prune_threshold=0.04.
[I 2026-02-27 21:11:20,492] Trial 9 finished with value: 0.9893 and parameters: {'model_key': 'lr', 'lr.C': 0.495710021199695, 'lr.max_iter': 1000, 'th.mode': 'asymmetric', 'th.long_enter': 0.05, 'th.short_enter_abs': 0.05, 'th.hysteresis': 0.05, 'risk.tp_mode': 'none', 'risk.risk_pct': 0.0125, 'risk.atr_mult': 1.75, 'features.target_count': 6, 'slot.trend.count': 2, 'slot.mom.count': 2, 'slot.vol.count': 1, 'slot.wild.count': 0, 'pool.broad.slot.trend.0.name': 'TopTrend', 'pool.broad.slot.trend.1.name': 'TII', 'pool.broad.slot.mom.0.name': 'MACDEXT', 'pool.broad.slot.mom.1.name': 'Zerolag_MACD.mq4', 'pool.broad.slot.vol.0.name': 'BamsBung3', 'pool.broad.slot.wild.0.name': 'TrendAkkam', 'feat.trend.TopTrend.period': 25, 'feat.trend.TII.length': 20, 'feat.trend.TII.ma_length': 120, 'feat.trend.TII.ma_method': 1, 'feat.trend.TII.price': 2, 'feat.momentum.MACDEXT.fastperiod': 12, 'feat.momentum.MACDEXT.fastmatype': 2, 'feat.momentum.MACDEXT.slowperiod': 34, 'feat.momentum.MACDEXT.slowmatype': 5, 'feat.momentum.MACDEXT.signalperiod': 10, 'feat.momentum.MACDEXT.signalmatype': 6, 'feat.momentum.Zerolag_MACD.mq4.fast': 12, 'feat.momentum.Zerolag_MACD.mq4.slow': 30, 'feat.momentum.Zerolag_MACD.mq4.signal': 5, 'feat.volatility.BamsBung3.length': 10, 'feat.volatility.BamsBung3.deviation': 1.5, 'feat.volatility.BamsBung3.money_risk': 0.01, 'feat.volatility.BamsBung3.signal_mode': 0, 'feat.volatility.BamsBung3.line_mode': 0, 'feat.trend.TrendAkkam.akk_range': 14, 'feat.trend.TrendAkkam.ima_range': 10, 'feat.trend.TrendAkkam.akk_factor': 4.0, 'feat.trend.TrendAkkam.mode': 1, 'feat.trend.TrendAkkam.delta_price': 30.0, 'feat.trend.TrendAkkam.point': 0.1}. Best is trial 7 with value: 26.6898.
[I 2026-02-27 21:11:20,498] Trial 6 finished with value: 62.6249 and parameters: {'model_key': 'linearsvm', 'svm.C': 1.571270862967951, 'svm.max_iter': 1200, 'th.mode': 'symmetric', 'th.sym_base': 0.4, 'th.hysteresis': 0.04, 'risk.tp_mode': 'none', 'risk.risk_pct': 0.02, 'risk.atr_mult': 1.75, 'features.target_count': 5, 'slot.trend.count': 2, 'slot.mom.count': 1, 'slot.vol.count': 1, 'slot.wild.count': 0, 'pool.broad.slot.trend.0.name': 'HMA', 'pool.broad.slot.trend.1.name': 'GruchaIndex', 'pool.broad.slot.mom.0.name': 'ErgodicTVI', 'pool.broad.slot.vol.0.name': 'CVI_Multi', 'pool.broad.slot.wild.0.name': 'forecast', 'feat.baseline.HMA.period': 9, 'feat.trend.GruchaIndex.period': 20, 'feat.trend.GruchaIndex.ma_period': 45, 'feat.momentum.ErgodicTVI.Period1': 16, 'feat.momentum.ErgodicTVI.Period2': 20, 'feat.momentum.ErgodicTVI.Period3': 1, 'feat.momentum.ErgodicTVI.EPeriod1': 5, 'feat.momentum.ErgodicTVI.EPeriod2': 5, 'feat.momentum.ErgodicTVI.EPeriod3': 5, 'feat.volatility.CVI_Multi.length': 21, 'feat.volatility.CVI_Multi.method': 3, 'feat.volatility.CVI_Multi.use_modified': True, 'feat.trend.forecast.length': 30, 'feat.trend.forecast.price': 6}. Best is trial 6 with value: 62.6249.
[I 2026-02-27 21:11:20,814] Trial 7 pruned. Insufficient activity: Trades_Per_Day=0.0 < prune_threshold=0.02.
[I 2026-02-27 21:11:21,231] Trial 34 pruned. Insufficient activity: Trades_Per_Day=0.0 < prune_threshold=0.04.
[I 2026-02-27 21:11:21,792] Trial 10 pruned. Insufficient activity: Trades_Per_Day=0.0 < prune_threshold=0.02.
[I 2026-02-27 21:11:22,105] Trial 9 pruned. Insufficient activity: Trades_Per_Day=0.0 < prune_threshold=0.04.
[I 2026-02-27 21:11:22,215] Trial 7 pruned. Insufficient activity: Trades_Per_Day=0.01 < prune_threshold=0.02.
[I 2026-02-27 21:11:22,361] Trial 9 finished with value: 0.8097 and parameters: {'model_key': 'rf', 'rf.n_estimators': 550, 'rf.max_depth': 4, 'th.mode': 'asymmetric', 'th.long_enter': 0.15000000000000002, 'th.short_enter_abs': 0.0, 'th.hysteresis': 0.05, 'risk.tp_mode': 'fixed', 'risk.tp_multiple': 1.0, 'risk.risk_pct': 0.005, 'risk.atr_mult': 2.75, 'features.target_count': 4, 'slot.trend.count': 2, 'slot.mom.count': 1, 'slot.vol.count': 1, 'slot.wild.count': 1, 'pool.broad.slot.trend.0.name': 'TrendContinuation2', 'pool.broad.slot.trend.1.name': 'GChannel', 'pool.broad.slot.mom.0.name': 'TDFI', 'pool.broad.slot.vol.0.name': 'BamsBung3', 'feat.trend.TrendContinuation2.n': 20, 'feat.trend.TrendContinuation2.t3_period': 8, 'feat.trend.TrendContinuation2.b': 0.5, 'feat.baseline.GChannel.length': 200, 'feat.baseline.GChannel.price': 'low', 'feat.momentum.TDFI.period': 28, 'feat.volatility.BamsBung3.length': 30, 'feat.volatility.BamsBung3.deviation': 1.5, 'feat.volatility.BamsBung3.money_risk': 0.02, 'feat.volatility.BamsBung3.signal_mode': 2, 'feat.volatility.BamsBung3.line_mode': 1}. Best is trial 8 with value: 16.2934.
[I 2026-02-27 21:11:22,364] Trial 73 finished with value: 39.295 and parameters: {'model_key': 'linearsvm', 'svm.C': 0.1885137172936795, 'svm.max_iter': 1200, 'th.mode': 'asymmetric', 'th.long_enter': 0.35000000000000003, 'th.short_enter_abs': 0.0, 'th.hysteresis': 0.07, 'risk.tp_mode': 'none', 'risk.risk_pct': 0.005, 'risk.atr_mult': 1.0, 'features.target_count': 5, 'slot.trend.count': 1, 'slot.mom.count': 2, 'slot.vol.count': 1, 'slot.wild.count': 0, 'pool.broad.slot.trend.0.name': 'KASE', 'pool.broad.slot.mom.0.name': 'METROFixed', 'pool.broad.slot.mom.1.name': 'MACDEXT', 'pool.broad.slot.vol.0.name': 'TRANGE', 'pool.broad.slot.wild.0.name': 'ULTOSC', 'feat.trend.KASE.pstLength': 9, 'feat.trend.KASE.pstX': 3, 'feat.trend.KASE.pstSmooth': 10, 'feat.trend.KASE.smoothPeriod': 5, 'feat.momentum.METROFixed.period_rsi': 10, 'feat.momentum.METROFixed.step_size_fast': 5.0, 'feat.momentum.METROFixed.step_size_slow': 10.0, 'feat.momentum.MACDEXT.fastperiod': 8, 'feat.momentum.MACDEXT.fastmatype': 7, 'feat.momentum.MACDEXT.slowperiod': 18, 'feat.momentum.MACDEXT.slowmatype': 1, 'feat.momentum.MACDEXT.signalperiod': 9, 'feat.momentum.MACDEXT.signalmatype': 4, 'feat.momentum.ULTOSC.timeperiod1': 6, 'feat.momentum.ULTOSC.timeperiod2': 24, 'feat.momentum.ULTOSC.timeperiod3': 34}. Best is trial 56 with value: 65.7867.
[I 2026-02-27 21:11:22,631] Trial 35 finished with value: 31.8033 and parameters: {'model_key': 'lr', 'lr.C': 0.25386699764291615, 'lr.max_iter': 700, 'th.mode': 'symmetric', 'th.sym_base': 0.1, 'th.hysteresis': 0.08, 'risk.tp_mode': 'fixed', 'risk.tp_multiple': 3.0, 'risk.risk_pct': 0.015, 'risk.atr_mult': 1.0, 'features.target_count': 6, 'slot.trend.count': 1, 'slot.mom.count': 1, 'slot.vol.count': 0, 'slot.wild.count': 1, 'pool.broad.slot.trend.0.name': 'Trimagen', 'pool.broad.slot.mom.0.name': 'Laguerre', 'pool.broad.slot.wild.0.name': 'Ehlers DELI (Detrended Leading Indicator)', 'pool.broad.slot.wild.1.name': 'trend-lord-nrp-indicator', 'feat.baseline.Trimagen.period': 30, 'feat.baseline.Trimagen.applied_price': 'median', 'feat.momentum.Laguerre.gamma': 0.5, 'feat.trend.Ehlers DELI (Detrended Leading Indicator).period': 14, 'feat.trend.trend-lord-nrp-indicator.length': 24, 'feat.trend.trend-lord-nrp-indicator.mode': 'smma', 'feat.trend.trend-lord-nrp-indicator.price': 'median', 'feat.trend.trend-lord-nrp-indicator.show_high_low': True, 'feat.trend.AROON.timeperiod': 10, 'feat.trend.AROONOSC.timeperiod': 12}. Best is trial 35 with value: 31.8033.
[I 2026-02-27 21:11:22,670] Trial 11 pruned. Insufficient activity: Trades_Per_Day=0.0 < prune_threshold=0.02.
[I 2026-02-27 21:11:23,565] Trial 10 pruned. Insufficient activity: Trades_Per_Day=0.0 < prune_threshold=0.02.
[I 2026-02-27 21:11:23,631] Trial 74 finished with value: 4.0547 and parameters: {'model_key': 'linearsvm', 'svm.C': 0.11825368211700332, 'svm.max_iter': 600, 'th.mode': 'asymmetric', 'th.long_enter': 0.4, 'th.short_enter_abs': 0.05, 'th.hysteresis': 0.09, 'risk.tp_mode': 'none', 'risk.risk_pct': 0.0075, 'risk.atr_mult': 1.5, 'features.target_count': 5, 'slot.trend.count': 1, 'slot.mom.count': 2, 'slot.vol.count': 1, 'slot.wild.count': 0, 'pool.broad.slot.trend.0.name': 'dorsey-inertia', 'pool.broad.slot.mom.0.name': 'APO', 'pool.broad.slot.mom.1.name': 'MAMA', 'pool.broad.slot.vol.0.name': 'CVI_Multi', 'pool.broad.slot.wild.0.name': 'TP', 'feat.trend.dorsey-inertia.rvi_period': 5, 'feat.trend.dorsey-inertia.avg_period': 21, 'feat.trend.dorsey-inertia.smoothing_period': 50, 'feat.momentum.APO.fastperiod': 10, 'feat.momentum.APO.slowperiod': 28, 'feat.momentum.APO.matype': 0, 'feat.momentum.MAMA.fastlimit': 0.3, 'feat.momentum.MAMA.slowlimit': 0.4, 'feat.volatility.CVI_Multi.length': 14, 'feat.volatility.CVI_Multi.method': 0, 'feat.volatility.CVI_Multi.use_modified': True, 'feat.trend.TP.length': 7, 'feat.trend.TP.show_updn': False}. Best is trial 56 with value: 65.7867.
[I 2026-02-27 21:11:24,465] Trial 12 finished with value: 0.8115 and parameters: {'model_key': 'rf', 'rf.n_estimators': 100, 'rf.max_depth': 3, 'th.mode': 'symmetric', 'th.sym_base': 0.0, 'th.hysteresis': 0.08, 'risk.tp_mode': 'none', 'risk.risk_pct': 0.01, 'risk.atr_mult': 2.5, 'features.target_count': 4, 'slot.trend.count': 2, 'slot.mom.count': 2, 'slot.vol.count': 1, 'slot.wild.count': 0, 'pool.broad.slot.trend.0.name': 'AROON', 'pool.broad.slot.trend.1.name': 'Decycler Oscillator', 'pool.broad.slot.mom.0.name': 'ULTOSC', 'pool.broad.slot.mom.1.name': 'STOCHF_Fast', 'pool.broad.slot.vol.0.name': 'BollingerBands', 'feat.volatility.BollingerBands.timeperiod': 18, 'feat.volatility.BollingerBands.nbdevup': 10, 'feat.volatility.BollingerBands.nbdevdn': 1, 'feat.volatility.BollingerBands.matype': 7, 'feat.momentum.ULTOSC.timeperiod1': 10, 'feat.momentum.ULTOSC.timeperiod2': 18, 'feat.momentum.ULTOSC.timeperiod3': 30, 'feat.momentum.STOCHF_Fast.fastk_period': 3, 'feat.momentum.STOCHF_Fast.fastd_period': 6, 'feat.momentum.STOCHF_Fast.fastd_matype': 6, 'feat.trend.AROON.timeperiod': 15}. Best is trial 7 with value: 26.6898.
[I 2026-02-27 21:11:24,488] Trial 36 finished with value: 2.1894 and parameters: {'model_key': 'linearsvm', 'svm.C': 0.017380239464671474, 'svm.max_iter': 1000, 'th.mode': 'symmetric', 'th.sym_base': 0.2, 'th.hysteresis': 0.07, 'risk.tp_mode': 'none', 'risk.risk_pct': 0.015, 'risk.atr_mult': 3.0, 'features.target_count': 6, 'slot.trend.count': 1, 'slot.mom.count': 2, 'slot.vol.count': 1, 'slot.wild.count': 1, 'pool.broad.slot.trend.0.name': 'Vortex_Indicator', 'pool.broad.slot.mom.0.name': 'ROCR', 'pool.broad.slot.mom.1.name': 'TTF', 'pool.broad.slot.vol.0.name': 'VAR', 'pool.broad.slot.wild.0.name': 'AD', 'pool.broad.slot.wild.1.name': 'BamsBung3', 'feat.trend.Vortex_Indicator.length': 14, 'feat.momentum.ROCR.timeperiod': 12, 'feat.momentum.TTF.ttf_bars': 8, 'feat.momentum.TTF.top_line': 75.0, 'feat.momentum.TTF.bottom_line': -80.0, 'feat.momentum.TTF.t3_period': 3, 'feat.volatility.VAR.nbdev': 7, 'feat.volatility.BamsBung3.length': 30, 'feat.volatility.BamsBung3.deviation': 1.5, 'feat.volatility.BamsBung3.money_risk': 0.1, 'feat.volatility.BamsBung3.signal_mode': 0, 'feat.volatility.BamsBung3.line_mode': 0}. Best is trial 35 with value: 31.8033.
[I 2026-02-27 21:11:24,763] Trial 8 finished with value: 0.5461 and parameters: {'model_key': 'linearsvm', 'svm.C': 0.12690654519979444, 'svm.max_iter': 1400, 'th.mode': 'asymmetric', 'th.long_enter': 0.0, 'th.short_enter_abs': 0.35000000000000003, 'th.hysteresis': 0.01, 'risk.tp_mode': 'fixed', 'risk.tp_multiple': 1.5, 'risk.risk_pct': 0.01, 'risk.atr_mult': 2.75, 'features.target_count': 4, 'slot.trend.count': 2, 'slot.mom.count': 1, 'slot.vol.count': 1, 'slot.wild.count': 1, 'pool.broad.slot.trend.0.name': 'TopTrend', 'pool.broad.slot.trend.1.name': 'TP', 'pool.broad.slot.mom.0.name': 'SmoothedMomentum', 'pool.broad.slot.vol.0.name': 'William Vix-Fix', 'feat.trend.TopTrend.period': 30, 'feat.trend.TP.length': 30, 'feat.trend.TP.show_updn': False, 'feat.momentum.SmoothedMomentum.momentum_length': 5, 'feat.momentum.SmoothedMomentum.use_smoothing': True, 'feat.momentum.SmoothedMomentum.smoothing_method': 1, 'feat.momentum.SmoothedMomentum.smoothing_length': 50, 'feat.momentum.SmoothedMomentum.price': 3, 'feat.volatility.William Vix-Fix.period': 14}. Best is trial 6 with value: 62.6249.
[I 2026-02-27 21:11:24,920] Trial 11 pruned. Insufficient activity: Trades_Per_Day=0.0 < prune_threshold=0.02.
[I 2026-02-27 21:11:25,181] Trial 13 pruned. Insufficient activity: Trades_Per_Day=0.0 < prune_threshold=0.02.
[I 2026-02-27 21:11:25,325] Trial 10 pruned. Insufficient activity: Trades_Per_Day=0.01 < prune_threshold=0.04.
[I 2026-02-27 21:11:25,657] Trial 12 pruned. Insufficient activity: Trades_Per_Day=0.0 < prune_threshold=0.02.
[I 2026-02-27 21:11:26,559] Trial 13 finished with value: 2.1464 and parameters: {'model_key': 'linearsvm', 'svm.C': 0.17365241238688509, 'svm.max_iter': 1600, 'th.mode': 'symmetric', 'th.sym_base': 0.2, 'th.hysteresis': 0.1, 'risk.tp_mode': 'fixed', 'risk.tp_multiple': 1.5, 'risk.risk_pct': 0.0125, 'risk.atr_mult': 3.0, 'features.target_count': 4, 'slot.trend.count': 1, 'slot.mom.count': 1, 'slot.vol.count': 1, 'slot.wild.count': 0, 'pool.broad.slot.trend.0.name': 'Momentum Candles w ATR', 'pool.broad.slot.mom.0.name': 'STOCHRSI', 'pool.broad.slot.vol.0.name': 'William Vix-Fix', 'pool.broad.slot.wild.0.name': 'BraidFilter', 'feat.trend.Momentum Candles w ATR.atr_period': 70, 'feat.trend.Momentum Candles w ATR.atr_multiplier': 2.0, 'feat.momentum.STOCHRSI.timeperiod': 12, 'feat.momentum.STOCHRSI.fastk_period': 9, 'feat.momentum.STOCHRSI.fastd_period': 6, 'feat.momentum.STOCHRSI.fastd_matype': 3, 'feat.volatility.William Vix-Fix.period': 7, 'feat.baseline.BraidFilter.period1': 4, 'feat.baseline.BraidFilter.period2': 7, 'feat.baseline.BraidFilter.period3': 22, 'feat.baseline.BraidFilter.pips_min_sep_percent': 0.5}. Best is trial 8 with value: 16.2934.
[I 2026-02-27 21:11:27,482] Trial 37 pruned. Insufficient activity: Trades_Per_Day=0.0 < prune_threshold=0.04.
[I 2026-02-27 21:11:28,105] Trial 14 pruned. Insufficient activity: Trades_Per_Day=0.0 < prune_threshold=0.02.
[I 2026-02-27 21:11:28,815] Trial 8 pruned. Insufficient activity: Trades_Per_Day=0.0 < prune_threshold=0.02.
[I 2026-02-27 21:11:28,854] Trial 14 finished with value: 15.1428 and parameters: {'model_key': 'rf', 'rf.n_estimators': 600, 'rf.max_depth': 10, 'th.mode': 'symmetric', 'th.sym_base': 0.05, 'th.hysteresis': 0.01, 'risk.tp_mode': 'fixed', 'risk.tp_multiple': 3.0, 'risk.risk_pct': 0.0125, 'risk.atr_mult': 2.75, 'features.target_count': 5, 'slot.trend.count': 1, 'slot.mom.count': 2, 'slot.vol.count': 0, 'slot.wild.count': 0, 'pool.broad.slot.trend.0.name': 'KijunSen', 'pool.broad.slot.mom.0.name': 'RSI', 'pool.broad.slot.mom.1.name': 'Laguerre', 'pool.broad.slot.wild.0.name': 'EhlersTwoPoleSuperSmootherFilter', 'pool.broad.slot.wild.1.name': 'HLCTrend', 'feat.trend.KijunSen.period': 15, 'feat.momentum.RSI.timeperiod': 13, 'feat.momentum.Laguerre.gamma': 0.5, 'feat.baseline.EhlersTwoPoleSuperSmootherFilter.cutoff_period': 40, 'feat.trend.HLCTrend.close_period': 5, 'feat.trend.HLCTrend.low_period': 21, 'feat.trend.HLCTrend.high_period': 55}. Best is trial 13 with value: 23.7346.
