[UI WORKER] Starting main.py backtesting cycle
[UI WORKER] config=C:\Users\sm598\Desktop\Applications\Development\Algo Trading\backtesting\ui_jobs\20260227_211042_87dba0\config.json
{
  "strategies": [
    "Mabrouk2021"
  ],
  "pairs": [
    "EUR/USD",
    "USD/JPY",
    "GBP/USD",
    "USD/CHF",
    "AUD/USD",
    "USD/CAD",
    "NZD/USD",
    "USD/SGD",
    "EUR/GBP",
    "EUR/JPY",
    "EUR/CHF",
    "EUR/AUD",
    "EUR/CAD",
    "EUR/NZD",
    "GBP/JPY",
    "GBP/CHF",
    "GBP/AUD",
    "GBP/CAD",
    "GBP/NZD",
    "AUD/JPY",
    "AUD/CHF",
    "AUD/CAD",
    "AUD/NZD",
    "CAD/JPY",
    "CAD/CHF",
    "NZD/JPY",
    "NZD/CHF",
    "CHF/JPY",
    "EUR/SGD",
    "USD/SGD",
    "GBP/SGD",
    "AUD/SGD",
    "SGD/JPY",
    "NZD/SGD",
    "CAD/SGD",
    "CHF/SGD"
  ],
  "phase12_timeframes": [
    "2_hour",
    "4_hour",
    "1_day"
  ],
  "phase3_timeframes": [],
  "seeds": [
    42,
    1337,
    314,
    777,
    444
  ],
  "trials_by_timeframe": {
    "1_day": 500,
    "4_hour": 300,
    "2_hour": 300,
    "1_hour": 200,
    "30_minute": 200,
    "15_minute": 200,
    "5_minute": 200
  },
  "n_processes": 10,
  "phase2_top_percent": 10.0,
  "phase3_top_n": 30,
  "enable_phase1": true,
  "enable_phase2": true,
  "enable_phase3": true,
  "created_at": "2026-02-27T21:10:42"
}
[UI WORKER] Optuna logging set to WARNING for UI mode
[UI WORKER] strategies=['Mabrouk2021']
[UI WORKER] n_processes=10
[UI WORKER] pairs=36
[UI WORKER] phases=['phase1', 'phase2', 'phase3']
[UI WORKER] Running phase1...
[UI WORKER] phase1 jobs=540
[02/27/2026 21:10:48] [START STUDY] EUR/USD @ 2_hour
[02/27/2026 21:10:48] [START STUDY] EUR/USD @ 2_hour
[I 2026-02-27 21:10:49,235] Using an existing study with name 'phase1_EURUSD_2_hour_Mabrouk2021_2024-11-06to2025-05-07_space-default_seed-42' instead of creating a new one.
[02/27/2026 21:10:49] [START STUDY] EUR/USD @ 2_hour
[02/27/2026 21:10:49] [START STUDY] EUR/USD @ 2_hour
[02/27/2026 21:10:49] [START STUDY] EUR/USD @ 2_hour
[02/27/2026 21:10:49] [START STUDY] EUR/USD @ 4_hour
[02/27/2026 21:10:49] [START STUDY] EUR/USD @ 4_hour
[02/27/2026 21:10:49] [START STUDY] EUR/USD @ 4_hour
[02/27/2026 21:10:49] [START STUDY] EUR/USD @ 4_hour
[02/27/2026 21:10:49] [START STUDY] EUR/USD @ 4_hour
[02/27/2026 21:10:49] [phase1_EURUSD_2_hour_Mabrouk2021_2024-11-06to2025-05-07_space-default_seed-42]: finished=65 to_run=235
[I 2026-02-27 21:10:49,535] Using an existing study with name 'phase1_EURUSD_2_hour_Mabrouk2021_2024-11-06to2025-05-07_space-default_seed-1337' instead of creating a new one.
[02/27/2026 21:10:49] [phase1_EURUSD_2_hour_Mabrouk2021_2024-11-06to2025-05-07_space-default_seed-1337]: finished=28 to_run=272
[I 2026-02-27 21:10:49,863] Using an existing study with name 'phase1_EURUSD_2_hour_Mabrouk2021_2024-11-06to2025-05-07_space-default_seed-314' instead of creating a new one.
[I 2026-02-27 21:10:49,873] Using an existing study with name 'phase1_EURUSD_2_hour_Mabrouk2021_2024-11-06to2025-05-07_space-default_seed-777' instead of creating a new one.
[02/27/2026 21:10:49] [phase1_EURUSD_2_hour_Mabrouk2021_2024-11-06to2025-05-07_space-default_seed-314]: finished=6 to_run=294
[02/27/2026 21:10:49] [phase1_EURUSD_2_hour_Mabrouk2021_2024-11-06to2025-05-07_space-default_seed-777]: finished=3 to_run=297
[I 2026-02-27 21:10:50,097] A new study created in RDB with name: phase1_EURUSD_2_hour_Mabrouk2021_2024-11-06to2025-05-07_space-default_seed-444
[02/27/2026 21:10:50] [phase1_EURUSD_2_hour_Mabrouk2021_2024-11-06to2025-05-07_space-default_seed-444]: finished=0 to_run=300
[I 2026-02-27 21:10:50,150] A new study created in RDB with name: phase1_EURUSD_4_hour_Mabrouk2021_2024-05-07to2025-05-07_space-default_seed-42
[02/27/2026 21:10:50] [phase1_EURUSD_4_hour_Mabrouk2021_2024-05-07to2025-05-07_space-default_seed-42]: finished=0 to_run=300
[I 2026-02-27 21:10:50,316] A new study created in RDB with name: phase1_EURUSD_4_hour_Mabrouk2021_2024-05-07to2025-05-07_space-default_seed-1337
[I 2026-02-27 21:10:50,321] A new study created in RDB with name: phase1_EURUSD_4_hour_Mabrouk2021_2024-05-07to2025-05-07_space-default_seed-314
[02/27/2026 21:10:50] [phase1_EURUSD_4_hour_Mabrouk2021_2024-05-07to2025-05-07_space-default_seed-1337]: finished=0 to_run=300
[I 2026-02-27 21:10:50,335] A new study created in RDB with name: phase1_EURUSD_4_hour_Mabrouk2021_2024-05-07to2025-05-07_space-default_seed-777
[02/27/2026 21:10:50] [phase1_EURUSD_4_hour_Mabrouk2021_2024-05-07to2025-05-07_space-default_seed-314]: finished=0 to_run=300
[I 2026-02-27 21:10:50,335] A new study created in RDB with name: phase1_EURUSD_4_hour_Mabrouk2021_2024-05-07to2025-05-07_space-default_seed-444
[02/27/2026 21:10:50] [phase1_EURUSD_4_hour_Mabrouk2021_2024-05-07to2025-05-07_space-default_seed-777]: finished=0 to_run=300
[02/27/2026 21:10:50] [phase1_EURUSD_4_hour_Mabrouk2021_2024-05-07to2025-05-07_space-default_seed-444]: finished=0 to_run=300
[I 2026-02-27 21:10:51,262] Trial 28 pruned. Insufficient activity: Trades_Per_Day=0.0 < prune_threshold=0.04.
[I 2026-02-27 21:10:51,271] Trial 0 pruned. Insufficient activity: Trades_Per_Day=0.01 < prune_threshold=0.02.
[I 2026-02-27 21:10:51,310] Trial 0 finished with value: 0.3304 and parameters: {'model_key': 'lr', 'lr.C': 1.003847761673133, 'lr.max_iter': 200, 'th.mode': 'asymmetric', 'th.long_enter': 0.1, 'th.short_enter_abs': 0.05, 'th.hysteresis': 0.02, 'risk.tp_mode': 'none', 'risk.risk_pct': 0.01, 'risk.atr_mult': 2.5, 'features.target_count': 5, 'slot.trend.count': 1, 'slot.mom.count': 1, 'slot.vol.count': 0, 'slot.wild.count': 1, 'pool.broad.slot.trend.0.name': 'LSMA', 'pool.broad.slot.mom.0.name': 'ROCP', 'pool.broad.slot.wild.0.name': 'Ehlers DELI (Detrended Leading Indicator)', 'pool.broad.slot.wild.1.name': 'SmoothedMomentum', 'feat.baseline.LSMA.period': 13, 'feat.baseline.LSMA.shift': 0, 'feat.momentum.ROCP.timeperiod': 7, 'feat.trend.Ehlers DELI (Detrended Leading Indicator).period': 7, 'feat.momentum.SmoothedMomentum.momentum_length': 20, 'feat.momentum.SmoothedMomentum.use_smoothing': True, 'feat.momentum.SmoothedMomentum.smoothing_method': 0, 'feat.momentum.SmoothedMomentum.smoothing_length': 20, 'feat.momentum.SmoothedMomentum.price': 0, 'feat.trend.AROON.timeperiod': 12}. Best is trial 0 with value: 0.3304.
[I 2026-02-27 21:10:51,478] Trial 4 pruned. Insufficient activity: Trades_Per_Day=0.0 < prune_threshold=0.04.
[I 2026-02-27 21:10:51,527] Trial 0 finished with value: 1.5609 and parameters: {'model_key': 'lr', 'lr.C': 1.003847761673133, 'lr.max_iter': 200, 'th.mode': 'asymmetric', 'th.long_enter': 0.1, 'th.short_enter_abs': 0.05, 'th.hysteresis': 0.02, 'risk.tp_mode': 'none', 'risk.risk_pct': 0.01, 'risk.atr_mult': 2.5, 'features.target_count': 5, 'slot.trend.count': 1, 'slot.mom.count': 1, 'slot.vol.count': 0, 'slot.wild.count': 1, 'pool.broad.slot.trend.0.name': 'LSMA', 'pool.broad.slot.mom.0.name': 'ROCP', 'pool.broad.slot.wild.0.name': 'Ehlers DELI (Detrended Leading Indicator)', 'pool.broad.slot.wild.1.name': 'SmoothedMomentum', 'feat.baseline.LSMA.period': 13, 'feat.baseline.LSMA.shift': 0, 'feat.momentum.ROCP.timeperiod': 7, 'feat.trend.Ehlers DELI (Detrended Leading Indicator).period': 7, 'feat.momentum.SmoothedMomentum.momentum_length': 20, 'feat.momentum.SmoothedMomentum.use_smoothing': True, 'feat.momentum.SmoothedMomentum.smoothing_method': 0, 'feat.momentum.SmoothedMomentum.smoothing_length': 20, 'feat.momentum.SmoothedMomentum.price': 0, 'feat.trend.AROON.timeperiod': 12}. Best is trial 0 with value: 1.5609.
[I 2026-02-27 21:10:51,635] Trial 0 pruned. Insufficient activity: Trades_Per_Day=0.01 < prune_threshold=0.02.
[I 2026-02-27 21:10:51,751] Trial 6 pruned. Insufficient activity: Trades_Per_Day=0.01 < prune_threshold=0.04.
[I 2026-02-27 21:10:52,086] Trial 1 pruned. Insufficient activity: Trades_Per_Day=0.0 < prune_threshold=0.02.
[I 2026-02-27 21:10:52,397] Trial 29 finished with value: 0.8089 and parameters: {'model_key': 'linearsvm', 'svm.C': 0.2571545585751347, 'svm.max_iter': 600, 'th.mode': 'symmetric', 'th.sym_base': 0.25, 'th.hysteresis': 0.0, 'risk.tp_mode': 'none', 'risk.risk_pct': 0.0125, 'risk.atr_mult': 1.75, 'features.target_count': 6, 'slot.trend.count': 1, 'slot.mom.count': 2, 'slot.vol.count': 1, 'slot.wild.count': 1, 'pool.broad.slot.trend.0.name': 'Ehlers_DELI_(Detrended_Leading_Indicator)', 'pool.broad.slot.mom.0.name': 'MACDFIX', 'pool.broad.slot.mom.1.name': 'CMO', 'pool.broad.slot.vol.0.name': 'VAR', 'pool.broad.slot.wild.0.name': 'ADX', 'pool.broad.slot.wild.1.name': 'Top Bottom NR', 'feat.trend.Ehlers_DELI_(Detrended_Leading_Indicator).period': 30, 'feat.momentum.MACDFIX.signalperiod': 10, 'feat.momentum.CMO.timeperiod': 5, 'feat.volatility.VAR.nbdev': 4, 'feat.volume.ADX.timeperiod': 30, 'feat.trend.Top Bottom NR.per': 21}. Best is trial 7 with value: 17.0246.
[I 2026-02-27 21:10:52,524] Trial 5 pruned. Insufficient activity: Trades_Per_Day=0.0 < prune_threshold=0.04.
[I 2026-02-27 21:10:52,540] Trial 1 pruned. Insufficient activity: Trades_Per_Day=0.0 < prune_threshold=0.02.
[I 2026-02-27 21:10:52,930] Trial 0 pruned. Insufficient activity: Trades_Per_Day=0.0 < prune_threshold=0.02.
[I 2026-02-27 21:10:52,975] Trial 7 pruned. Insufficient activity: Trades_Per_Day=0.0 < prune_threshold=0.04.
[I 2026-02-27 21:10:54,189] Trial 1 pruned. Insufficient activity: Trades_Per_Day=0.0 < prune_threshold=0.02.
[I 2026-02-27 21:10:54,466] Trial 1 pruned. Insufficient activity: Trades_Per_Day=0.0 < prune_threshold=0.02.
[I 2026-02-27 21:10:54,586] Trial 0 pruned. Insufficient activity: Trades_Per_Day=0.01 < prune_threshold=0.02.
[I 2026-02-27 21:10:54,913] Trial 30 finished with value: 0.8261 and parameters: {'model_key': 'linearsvm', 'svm.C': 0.01852582218906065, 'svm.max_iter': 200, 'th.mode': 'symmetric', 'th.sym_base': 0.1, 'th.hysteresis': 0.04, 'risk.tp_mode': 'none', 'risk.risk_pct': 0.02, 'risk.atr_mult': 3.0, 'features.target_count': 6, 'slot.trend.count': 1, 'slot.mom.count': 1, 'slot.vol.count': 1, 'slot.wild.count': 1, 'pool.broad.slot.trend.0.name': 'TheTurtleTradingChannel', 'pool.broad.slot.mom.0.name': 'Zerolag_MACD.mq4', 'pool.broad.slot.vol.0.name': 'CVI_Multi', 'pool.broad.slot.wild.0.name': 'ChandelierExit', 'pool.broad.slot.wild.1.name': 'WAE', 'feat.trend.TheTurtleTradingChannel.trade_period': 20, 'feat.trend.TheTurtleTradingChannel.stop_period': 15, 'feat.trend.TheTurtleTradingChannel.strict': True, 'feat.momentum.Zerolag_MACD.mq4.fast': 5, 'feat.momentum.Zerolag_MACD.mq4.slow': 20, 'feat.momentum.Zerolag_MACD.mq4.signal': 5, 'feat.volatility.CVI_Multi.length': 21, 'feat.volatility.CVI_Multi.method': 1, 'feat.volatility.CVI_Multi.use_modified': True, 'feat.trend.ChandelierExit.lookback': 5, 'feat.trend.ChandelierExit.atr_period': 21, 'feat.trend.ChandelierExit.atr_mult': 2.0, 'feat.volatility.WAE.minutes': 30, 'feat.volatility.WAE.sensitivity': 150, 'feat.volatility.WAE.dead_zone_pip': 10, 'feat.trend.AROON.timeperiod': 30}. Best is trial 7 with value: 17.0246.
[I 2026-02-27 21:10:55,359] Trial 1 pruned. Insufficient activity: Trades_Per_Day=0.0 < prune_threshold=0.04.
[I 2026-02-27 21:10:55,481] Trial 2 finished with value: 0.262 and parameters: {'model_key': 'rf', 'rf.n_estimators': 500, 'rf.max_depth': 8, 'th.mode': 'asymmetric', 'th.long_enter': 0.05, 'th.short_enter_abs': 0.25, 'th.hysteresis': 0.07, 'risk.tp_mode': 'fixed', 'risk.tp_multiple': 2.0, 'risk.risk_pct': 0.015, 'risk.atr_mult': 2.25, 'features.target_count': 5, 'slot.trend.count': 2, 'slot.mom.count': 1, 'slot.vol.count': 0, 'slot.wild.count': 0, 'pool.broad.slot.trend.0.name': 'dorsey-inertia', 'pool.broad.slot.trend.1.name': 'TP', 'pool.broad.slot.mom.0.name': 'TDFI', 'pool.broad.slot.wild.0.name': 'TTF', 'pool.broad.slot.wild.1.name': 'TII', 'feat.trend.dorsey-inertia.rvi_period': 10, 'feat.trend.dorsey-inertia.avg_period': 8, 'feat.trend.dorsey-inertia.smoothing_period': 50, 'feat.trend.TP.length': 21, 'feat.trend.TP.show_updn': False, 'feat.momentum.TDFI.period': 1, 'feat.momentum.TTF.ttf_bars': 20, 'feat.momentum.TTF.top_line': 70.0, 'feat.momentum.TTF.bottom_line': -70.0, 'feat.momentum.TTF.t3_period': 5, 'feat.trend.TII.length': 30, 'feat.trend.TII.ma_length': 90, 'feat.trend.TII.ma_method': 1, 'feat.trend.TII.price': 1}. Best is trial 2 with value: 0.262.
[I 2026-02-27 21:10:56,054] Trial 2 finished with value: 0.526 and parameters: {'model_key': 'linearsvm', 'svm.C': 0.01852582218906065, 'svm.max_iter': 200, 'th.mode': 'symmetric', 'th.sym_base': 0.1, 'th.hysteresis': 0.04, 'risk.tp_mode': 'none', 'risk.risk_pct': 0.02, 'risk.atr_mult': 3.0, 'features.target_count': 6, 'slot.trend.count': 1, 'slot.mom.count': 1, 'slot.vol.count': 1, 'slot.wild.count': 1, 'pool.broad.slot.trend.0.name': 'TheTurtleTradingChannel', 'pool.broad.slot.mom.0.name': 'Zerolag_MACD.mq4', 'pool.broad.slot.vol.0.name': 'CVI_Multi', 'pool.broad.slot.wild.0.name': 'ChandelierExit', 'pool.broad.slot.wild.1.name': 'WAE', 'feat.trend.TheTurtleTradingChannel.trade_period': 20, 'feat.trend.TheTurtleTradingChannel.stop_period': 15, 'feat.trend.TheTurtleTradingChannel.strict': True, 'feat.momentum.Zerolag_MACD.mq4.fast': 5, 'feat.momentum.Zerolag_MACD.mq4.slow': 20, 'feat.momentum.Zerolag_MACD.mq4.signal': 5, 'feat.volatility.CVI_Multi.length': 21, 'feat.volatility.CVI_Multi.method': 1, 'feat.volatility.CVI_Multi.use_modified': True, 'feat.trend.ChandelierExit.lookback': 5, 'feat.trend.ChandelierExit.atr_period': 21, 'feat.trend.ChandelierExit.atr_mult': 2.0, 'feat.volatility.WAE.minutes': 30, 'feat.volatility.WAE.sensitivity': 150, 'feat.volatility.WAE.dead_zone_pip': 10, 'feat.trend.AROON.timeperiod': 30}. Best is trial 2 with value: 0.526.
[I 2026-02-27 21:10:56,141] Trial 2 finished with value: 0.5895 and parameters: {'model_key': 'linearsvm', 'svm.C': 0.10744485223507469, 'svm.max_iter': 1000, 'th.mode': 'symmetric', 'th.sym_base': 0.2, 'th.hysteresis': 0.03, 'risk.tp_mode': 'none', 'risk.risk_pct': 0.02, 'risk.atr_mult': 3.0, 'features.target_count': 4, 'slot.trend.count': 1, 'slot.mom.count': 2, 'slot.vol.count': 1, 'slot.wild.count': 0, 'pool.broad.slot.trend.0.name': 'Vortex_Indicator', 'pool.broad.slot.mom.0.name': 'GlitchIndexFixed', 'pool.broad.slot.mom.1.name': 'Price Momentum Oscillator', 'pool.broad.slot.vol.0.name': 'BamsBung3', 'feat.trend.Vortex_Indicator.length': 7, 'feat.momentum.GlitchIndexFixed.MaPeriod': 50, 'feat.momentum.GlitchIndexFixed.MaMethod': 'dsema', 'feat.momentum.GlitchIndexFixed.Price': 'median', 'feat.momentum.GlitchIndexFixed.level1': 1.0, 'feat.momentum.GlitchIndexFixed.level2': 2.0, 'feat.momentum.Price Momentum Oscillator.one': 35, 'feat.momentum.Price Momentum Oscillator.two': 14, 'feat.momentum.Price Momentum Oscillator.period': 14, 'feat.volatility.BamsBung3.length': 20, 'feat.volatility.BamsBung3.deviation': 2.5, 'feat.volatility.BamsBung3.money_risk': 0.01, 'feat.volatility.BamsBung3.signal_mode': 1, 'feat.volatility.BamsBung3.line_mode': 0}. Best is trial 2 with value: 0.5895.
[I 2026-02-27 21:10:56,330] Trial 8 finished with value: 3.5509 and parameters: {'model_key': 'rf', 'rf.n_estimators': 500, 'rf.max_depth': 8, 'th.mode': 'asymmetric', 'th.long_enter': 0.05, 'th.short_enter_abs': 0.25, 'th.hysteresis': 0.07, 'risk.tp_mode': 'fixed', 'risk.tp_multiple': 2.0, 'risk.risk_pct': 0.015, 'risk.atr_mult': 2.25, 'features.target_count': 5, 'slot.trend.count': 2, 'slot.mom.count': 1, 'slot.vol.count': 0, 'slot.wild.count': 0, 'pool.broad.slot.trend.0.name': 'dorsey-inertia', 'pool.broad.slot.trend.1.name': 'TP', 'pool.broad.slot.mom.0.name': 'TDFI', 'pool.broad.slot.wild.0.name': 'TTF', 'pool.broad.slot.wild.1.name': 'TII', 'feat.trend.dorsey-inertia.rvi_period': 10, 'feat.trend.dorsey-inertia.avg_period': 8, 'feat.trend.dorsey-inertia.smoothing_period': 50, 'feat.trend.TP.length': 21, 'feat.trend.TP.show_updn': False, 'feat.momentum.TDFI.period': 1, 'feat.momentum.TTF.ttf_bars': 20, 'feat.momentum.TTF.top_line': 70.0, 'feat.momentum.TTF.bottom_line': -70.0, 'feat.momentum.TTF.t3_period': 5, 'feat.trend.TII.length': 30, 'feat.trend.TII.ma_length': 90, 'feat.trend.TII.ma_method': 1, 'feat.trend.TII.price': 1}. Best is trial 8 with value: 3.5509.
[I 2026-02-27 21:10:56,374] Trial 31 pruned. Insufficient activity: Trades_Per_Day=0.01 < prune_threshold=0.04.
[I 2026-02-27 21:10:56,889] Trial 2 pruned. Insufficient activity: Trades_Per_Day=0.0 < prune_threshold=0.02.
[I 2026-02-27 21:10:57,017] Trial 3 finished with value: 0.3954 and parameters: {'model_key': 'linearsvm', 'svm.C': 0.11954880427710647, 'svm.max_iter': 400, 'th.mode': 'symmetric', 'th.sym_base': 0.15000000000000002, 'th.hysteresis': 0.05, 'risk.tp_mode': 'fixed', 'risk.tp_multiple': 1.5, 'risk.risk_pct': 0.0175, 'risk.atr_mult': 3.0, 'features.target_count': 6, 'slot.trend.count': 2, 'slot.mom.count': 1, 'slot.vol.count': 0, 'slot.wild.count': 0, 'pool.broad.slot.trend.0.name': 'ATRBasedEMAVariant1', 'pool.broad.slot.trend.1.name': 'EhlersRoofingFilterA', 'pool.broad.slot.mom.0.name': 'BullsBearsImpulse', 'pool.broad.slot.wild.0.name': 'ADXR', 'pool.broad.slot.wild.1.name': 'dorsey-inertia', 'feat.baseline.ATRBasedEMAVariant1.ema_fastest': 28.0, 'feat.baseline.ATRBasedEMAVariant1.multiplier': 400.0, 'feat.trend.EhlersRoofingFilterA.hp_length': 80, 'feat.trend.EhlersRoofingFilterA.lp_length': 60, 'feat.momentum.BullsBearsImpulse.ma_period': 40, 'feat.volume.ADXR.timeperiod': 50, 'feat.trend.dorsey-inertia.rvi_period': 30, 'feat.trend.dorsey-inertia.avg_period': 21, 'feat.trend.dorsey-inertia.smoothing_period': 20, 'feat.trend.AROON.timeperiod': 5}. Best is trial 2 with value: 0.526.
[I 2026-02-27 21:10:57,932] Trial 2 finished with value: 0.668 and parameters: {'model_key': 'linearsvm', 'svm.C': 0.10744485223507469, 'svm.max_iter': 1000, 'th.mode': 'symmetric', 'th.sym_base': 0.2, 'th.hysteresis': 0.03, 'risk.tp_mode': 'none', 'risk.risk_pct': 0.02, 'risk.atr_mult': 3.0, 'features.target_count': 4, 'slot.trend.count': 1, 'slot.mom.count': 2, 'slot.vol.count': 1, 'slot.wild.count': 0, 'pool.broad.slot.trend.0.name': 'Vortex_Indicator', 'pool.broad.slot.mom.0.name': 'GlitchIndexFixed', 'pool.broad.slot.mom.1.name': 'Price Momentum Oscillator', 'pool.broad.slot.vol.0.name': 'BamsBung3', 'feat.trend.Vortex_Indicator.length': 7, 'feat.momentum.GlitchIndexFixed.MaPeriod': 50, 'feat.momentum.GlitchIndexFixed.MaMethod': 'dsema', 'feat.momentum.GlitchIndexFixed.Price': 'median', 'feat.momentum.GlitchIndexFixed.level1': 1.0, 'feat.momentum.GlitchIndexFixed.level2': 2.0, 'feat.momentum.Price Momentum Oscillator.one': 35, 'feat.momentum.Price Momentum Oscillator.two': 14, 'feat.momentum.Price Momentum Oscillator.period': 14, 'feat.volatility.BamsBung3.length': 20, 'feat.volatility.BamsBung3.deviation': 2.5, 'feat.volatility.BamsBung3.money_risk': 0.01, 'feat.volatility.BamsBung3.signal_mode': 1, 'feat.volatility.BamsBung3.line_mode': 0}. Best is trial 0 with value: 1.5609.
[I 2026-02-27 21:10:58,157] Trial 1 pruned. Insufficient activity: Trades_Per_Day=0.0 < prune_threshold=0.02.
[I 2026-02-27 21:10:59,095] Trial 3 finished with value: 0.7423 and parameters: {'model_key': 'rf', 'rf.n_estimators': 550, 'rf.max_depth': 5, 'th.mode': 'asymmetric', 'th.long_enter': 0.1, 'th.short_enter_abs': 0.30000000000000004, 'th.hysteresis': 0.1, 'risk.tp_mode': 'fixed', 'risk.tp_multiple': 1.5, 'risk.risk_pct': 0.0075, 'risk.atr_mult': 1.75, 'features.target_count': 4, 'slot.trend.count': 2, 'slot.mom.count': 1, 'slot.vol.count': 0, 'slot.wild.count': 1, 'pool.broad.slot.trend.0.name': '2nd Order Gaussian High Pass Filter MTF Zones', 'pool.broad.slot.trend.1.name': 'Vortex_Indicator', 'pool.broad.slot.mom.0.name': 'ErgodicTVI', 'pool.broad.slot.wild.0.name': 'ROCR', 'feat.trend.2nd Order Gaussian High Pass Filter MTF Zones.alpha': 0.3, 'feat.trend.Vortex_Indicator.length': 30, 'feat.momentum.ErgodicTVI.Period1': 20, 'feat.momentum.ErgodicTVI.Period2': 34, 'feat.momentum.ErgodicTVI.Period3': 5, 'feat.momentum.ErgodicTVI.EPeriod1': 5, 'feat.momentum.ErgodicTVI.EPeriod2': 3, 'feat.momentum.ErgodicTVI.EPeriod3': 5, 'feat.momentum.ROCR.timeperiod': 13}. Best is trial 3 with value: 0.7423.
[I 2026-02-27 21:10:59,236] Trial 6 pruned. Insufficient activity: Trades_Per_Day=0.0 < prune_threshold=0.04.
[I 2026-02-27 21:11:00,302] Trial 2 pruned. Insufficient activity: Trades_Per_Day=0.0 < prune_threshold=0.02.
[I 2026-02-27 21:11:00,374] Trial 3 finished with value: 5.7362 and parameters: {'model_key': 'linearsvm', 'svm.C': 0.30029240764567816, 'svm.max_iter': 1200, 'th.mode': 'symmetric', 'th.sym_base': 0.30000000000000004, 'th.hysteresis': 0.0, 'risk.tp_mode': 'none', 'risk.risk_pct': 0.0125, 'risk.atr_mult': 2.25, 'features.target_count': 6, 'slot.trend.count': 1, 'slot.mom.count': 2, 'slot.vol.count': 1, 'slot.wild.count': 0, 'pool.broad.slot.trend.0.name': 'Coral', 'pool.broad.slot.mom.0.name': 'ErgodicTVI', 'pool.broad.slot.mom.1.name': 'MACDZeroLag', 'pool.broad.slot.vol.0.name': 'VAR', 'pool.broad.slot.wild.0.name': 'STDDEV', 'pool.broad.slot.wild.1.name': 'KijunSen', 'feat.trend.Coral.length': 89, 'feat.trend.Coral.coef': 0.3, 'feat.momentum.ErgodicTVI.Period1': 20, 'feat.momentum.ErgodicTVI.Period2': 16, 'feat.momentum.ErgodicTVI.Period3': 1, 'feat.momentum.ErgodicTVI.EPeriod1': 13, 'feat.momentum.ErgodicTVI.EPeriod2': 13, 'feat.momentum.ErgodicTVI.EPeriod3': 13, 'feat.momentum.MACDZeroLag.short_period': 19, 'feat.momentum.MACDZeroLag.long_period': 35, 'feat.momentum.MACDZeroLag.signal_period': 7, 'feat.volatility.VAR.timeperiod': 10, 'feat.volatility.VAR.nbdev': 8, 'feat.volatility.STDDEV.timeperiod': 7, 'feat.volatility.STDDEV.nbdev': 3, 'feat.trend.KijunSen.period': 50}. Best is trial 3 with value: 5.7362.
[I 2026-02-27 21:11:00,988] Trial 3 pruned. Insufficient activity: Trades_Per_Day=0.0 < prune_threshold=0.02.
