[I 2026-02-27 21:11:35,131] Trial 5 finished with value: 0.6798 and parameters: {'model_key': 'linearsvm', 'svm.C': 0.12099406818927774, 'svm.max_iter': 1200, 'th.mode': 'symmetric', 'th.sym_base': 0.15000000000000002, 'th.hysteresis': 0.03, 'risk.tp_mode': 'none', 'risk.risk_pct': 0.01, 'risk.atr_mult': 1.5, 'features.target_count': 6, 'slot.trend.count': 1, 'slot.mom.count': 2, 'slot.vol.count': 0, 'slot.wild.count': 0, 'pool.broad.slot.trend.0.name': 'SuperTrend', 'pool.broad.slot.mom.0.name': 'MACDFIX', 'pool.broad.slot.mom.1.name': 'ULTOSC', 'pool.broad.slot.wild.0.name': 'cyber-cycle', 'pool.broad.slot.wild.1.name': 'IS Calculation', 'feat.trend.SuperTrend.period': 45, 'feat.trend.SuperTrend.multiplier': 4, 'feat.momentum.MACDFIX.signalperiod': 9, 'feat.momentum.ULTOSC.timeperiod1': 4, 'feat.momentum.ULTOSC.timeperiod2': 14, 'feat.momentum.ULTOSC.timeperiod3': 38, 'feat.trend.cyber-cycle.price': 'close', 'feat.momentum.IS Calculation.period': 30, 'feat.momentum.IS Calculation.nbchandelier': 5, 'feat.momentum.IS Calculation.lag': 0, 'feat.trend.AROON.timeperiod': 30}. Best is trial 0 with value: 1.5609.
[I 2026-02-27 21:11:35,276] Trial 16 pruned. Insufficient activity: Trades_Per_Day=0.01 < prune_threshold=0.04.
[I 2026-02-27 21:11:35,540] Trial 13 finished with value: 0.9015 and parameters: {'model_key': 'rf', 'rf.n_estimators': 400, 'rf.max_depth': 10, 'th.mode': 'asymmetric', 'th.long_enter': 0.0, 'th.short_enter_abs': 0.15000000000000002, 'th.hysteresis': 0.06, 'risk.tp_mode': 'fixed', 'risk.tp_multiple': 1.5, 'risk.risk_pct': 0.015, 'risk.atr_mult': 1.75, 'features.target_count': 5, 'slot.trend.count': 1, 'slot.mom.count': 1, 'slot.vol.count': 1, 'slot.wild.count': 0, 'pool.broad.slot.trend.0.name': 'AROONOSC', 'pool.broad.slot.mom.0.name': 'SchaffTrendCycle', 'pool.broad.slot.vol.0.name': 'VolatilityRatio', 'pool.broad.slot.wild.0.name': 'Ehlers DELI (Detrended Leading Indicator)', 'pool.broad.slot.wild.1.name': 'STOCH_Slow', 'feat.trend.AROONOSC.timeperiod': 10, 'feat.momentum.SchaffTrendCycle.period': 45, 'feat.momentum.SchaffTrendCycle.fast_ma_period': 25, 'feat.momentum.SchaffTrendCycle.slow_ma_period': 50, 'feat.momentum.SchaffTrendCycle.signal_period': 1, 'feat.volatility.VolatilityRatio.period': 10, 'feat.trend.Ehlers DELI (Detrended Leading Indicator).period': 21, 'feat.momentum.STOCH_Slow.fastk_period': 3, 'feat.momentum.STOCH_Slow.slowk_period': 4, 'feat.momentum.STOCH_Slow.slowk_matype': 8, 'feat.momentum.STOCH_Slow.slowd_period': 11, 'feat.momentum.STOCH_Slow.slowd_matype': 3}. Best is trial 10 with value: 43.146.
[I 2026-02-27 21:11:35,656] Trial 14 finished with value: 0.1465 and parameters: {'model_key': 'lr', 'lr.C': 0.010192923097031193, 'lr.max_iter': 800, 'th.mode': 'symmetric', 'th.sym_base': 0.05, 'th.hysteresis': 0.01, 'risk.tp_mode': 'none', 'risk.risk_pct': 0.02, 'risk.atr_mult': 2.25, 'features.target_count': 4, 'slot.trend.count': 2, 'slot.mom.count': 2, 'slot.vol.count': 1, 'slot.wild.count': 1, 'pool.broad.slot.trend.0.name': 'SherifHilo', 'pool.broad.slot.trend.1.name': 'wpr + ma (alerts)', 'pool.broad.slot.mom.0.name': 'BullsBearsImpulse', 'pool.broad.slot.mom.1.name': 'ULTOSC', 'pool.broad.slot.vol.0.name': 'VolatilityRatio', 'feat.volatility.VolatilityRatio.period': 40, 'feat.momentum.BullsBearsImpulse.ma_period': 15, 'feat.momentum.ULTOSC.timeperiod1': 4, 'feat.momentum.ULTOSC.timeperiod2': 20, 'feat.momentum.ULTOSC.timeperiod3': 30, 'feat.trend.SherifHilo.period_high': 150, 'feat.trend.SherifHilo.period_lows': 50}. Best is trial 6 with value: 62.6249.
[I 2026-02-27 21:11:36,385] Trial 17 pruned. Insufficient activity: Trades_Per_Day=0.0 < prune_threshold=0.04.
[I 2026-02-27 21:11:36,758] Trial 14 finished with value: 0.7035 and parameters: {'model_key': 'linearsvm', 'svm.C': 3.0241514820836657, 'svm.max_iter': 1200, 'th.mode': 'symmetric', 'th.sym_base': 0.05, 'th.hysteresis': 0.06, 'risk.tp_mode': 'none', 'risk.risk_pct': 0.02, 'risk.atr_mult': 2.0, 'features.target_count': 4, 'slot.trend.count': 1, 'slot.mom.count': 2, 'slot.vol.count': 0, 'slot.wild.count': 1, 'pool.broad.slot.trend.0.name': 'XmaColouredUpdatedForNnfx', 'pool.broad.slot.mom.0.name': 'ErgodicTVI', 'pool.broad.slot.mom.1.name': 'MACDZeroLag', 'pool.broad.slot.wild.0.name': 'TSF', 'feat.trend.XmaColouredUpdatedForNnfx.period': 20, 'feat.trend.XmaColouredUpdatedForNnfx.porog': 8, 'feat.trend.XmaColouredUpdatedForNnfx.metod': 'smma', 'feat.trend.XmaColouredUpdatedForNnfx.metod2': 'lwma', 'feat.trend.XmaColouredUpdatedForNnfx.price': 'close', 'feat.momentum.ErgodicTVI.Period1': 34, 'feat.momentum.ErgodicTVI.Period2': 34, 'feat.momentum.ErgodicTVI.Period3': 3, 'feat.momentum.ErgodicTVI.EPeriod1': 3, 'feat.momentum.ErgodicTVI.EPeriod2': 5, 'feat.momentum.ErgodicTVI.EPeriod3': 3, 'feat.momentum.MACDZeroLag.short_period': 4, 'feat.momentum.MACDZeroLag.long_period': 29, 'feat.momentum.MACDZeroLag.signal_period': 7, 'feat.momentum.TSF.timeperiod': 12}. Best is trial 10 with value: 43.146.
[I 2026-02-27 21:11:36,791] Trial 77 finished with value: 65.6663 and parameters: {'model_key': 'linearsvm', 'svm.C': 0.2958704889322542, 'svm.max_iter': 1000, 'th.mode': 'asymmetric', 'th.long_enter': 0.35000000000000003, 'th.short_enter_abs': 0.0, 'th.hysteresis': 0.06, 'risk.tp_mode': 'none', 'risk.risk_pct': 0.0075, 'risk.atr_mult': 1.0, 'features.target_count': 5, 'slot.trend.count': 1, 'slot.mom.count': 2, 'slot.vol.count': 1, 'slot.wild.count': 0, 'pool.broad.slot.trend.0.name': 'precision-trend-histogram', 'pool.broad.slot.mom.0.name': 'METROFixed', 'pool.broad.slot.mom.1.name': 'METROFixed', 'pool.broad.slot.vol.0.name': 'VolatilityRatio', 'pool.broad.slot.wild.0.name': 'ADOSC', 'feat.trend.precision-trend-histogram.avg_period': 30, 'feat.momentum.METROFixed.period_rsi': 14, 'feat.momentum.METROFixed.step_size_fast': 5.0, 'feat.momentum.METROFixed.step_size_slow': 15.0, 'feat.momentum.TTF.ttf_bars': 12, 'feat.momentum.TTF.top_line': 70.0, 'feat.momentum.TTF.bottom_line': -70.0, 'feat.momentum.TTF.t3_period': 2, 'feat.volatility.VolatilityRatio.period': 25, 'feat.volume.ADOSC.fastperiod': 7, 'feat.volume.ADOSC.slowperiod': 16}. Best is trial 56 with value: 65.7867.
[I 2026-02-27 21:11:36,973] Trial 19 pruned. Insufficient activity: Trades_Per_Day=0.0 < prune_threshold=0.02.
[I 2026-02-27 21:11:37,352] Trial 15 finished with value: 2.5356 and parameters: {'model_key': 'linearsvm', 'svm.C': 0.05342814251856137, 'svm.max_iter': 1800, 'th.mode': 'asymmetric', 'th.long_enter': 0.4, 'th.short_enter_abs': 0.1, 'th.hysteresis': 0.04, 'risk.tp_mode': 'fixed', 'risk.tp_multiple': 2.5, 'risk.risk_pct': 0.0125, 'risk.atr_mult': 1.25, 'features.target_count': 4, 'slot.trend.count': 1, 'slot.mom.count': 2, 'slot.vol.count': 0, 'slot.wild.count': 0, 'pool.broad.slot.trend.0.name': 'TrendDirectionForceIndexSmoothed4', 'pool.broad.slot.mom.0.name': 'ROCR', 'pool.broad.slot.mom.1.name': 'PPO', 'pool.broad.slot.wild.0.name': 'WAE', 'feat.trend.TrendDirectionForceIndexSmoothed4.trend_period': 30, 'feat.trend.TrendDirectionForceIndexSmoothed4.trend_method': 'lead', 'feat.trend.TrendDirectionForceIndexSmoothed4.price': 'tbiased', 'feat.trend.TrendDirectionForceIndexSmoothed4.trigger_up': 0.02, 'feat.trend.TrendDirectionForceIndexSmoothed4.trigger_down': -0.05, 'feat.trend.TrendDirectionForceIndexSmoothed4.smooth_length': 8.0, 'feat.trend.TrendDirectionForceIndexSmoothed4.smooth_phase': 50.0, 'feat.trend.TrendDirectionForceIndexSmoothed4.color_change_on_zero_cross': False, 'feat.trend.TrendDirectionForceIndexSmoothed4.point': 0.01, 'feat.momentum.ROCR.timeperiod': 9, 'feat.momentum.PPO.fastperiod': 13, 'feat.momentum.PPO.slowperiod': 24, 'feat.momentum.PPO.matype': 4, 'feat.volatility.WAE.minutes': 15, 'feat.volatility.WAE.sensitivity': 50, 'feat.volatility.WAE.dead_zone_pip': 15}. Best is trial 6 with value: 62.6249.
[I 2026-02-27 21:11:37,712] Trial 15 finished with value: 0.6626 and parameters: {'model_key': 'linearsvm', 'svm.C': 0.09155936205661419, 'svm.max_iter': 400, 'th.mode': 'asymmetric', 'th.long_enter': 0.15000000000000002, 'th.short_enter_abs': 0.15000000000000002, 'th.hysteresis': 0.08, 'risk.tp_mode': 'none', 'risk.risk_pct': 0.01, 'risk.atr_mult': 2.5, 'features.target_count': 4, 'slot.trend.count': 1, 'slot.mom.count': 1, 'slot.vol.count': 1, 'slot.wild.count': 0, 'pool.broad.slot.trend.0.name': 'TetherLine', 'pool.broad.slot.mom.0.name': 'ROCR100', 'pool.broad.slot.vol.0.name': 'BamsBung3', 'pool.broad.slot.wild.0.name': 'Volatility Ratio', 'feat.baseline.TetherLine.length': 55, 'feat.momentum.ROCR100.timeperiod': 13, 'feat.volatility.BamsBung3.length': 14, 'feat.volatility.BamsBung3.deviation': 2.0, 'feat.volatility.BamsBung3.money_risk': 0.02, 'feat.volatility.BamsBung3.signal_mode': 0, 'feat.volatility.BamsBung3.line_mode': 0, 'feat.volatility.Volatility Ratio.period': 14, 'feat.volatility.Volatility Ratio.price': 'Close'}. Best is trial 10 with value: 43.146.
[I 2026-02-27 21:11:37,865] Trial 18 finished with value: 1.0706 and parameters: {'model_key': 'rf', 'rf.n_estimators': 100, 'rf.max_depth': 3, 'th.mode': 'symmetric', 'th.sym_base': 0.0, 'th.hysteresis': 0.08, 'risk.tp_mode': 'none', 'risk.risk_pct': 0.01, 'risk.atr_mult': 2.5, 'features.target_count': 4, 'slot.trend.count': 2, 'slot.mom.count': 2, 'slot.vol.count': 1, 'slot.wild.count': 0, 'pool.broad.slot.trend.0.name': 'AROON', 'pool.broad.slot.trend.1.name': 'Decycler Oscillator', 'pool.broad.slot.mom.0.name': 'ULTOSC', 'pool.broad.slot.mom.1.name': 'STOCHF_Fast', 'pool.broad.slot.vol.0.name': 'BollingerBands', 'feat.volatility.BollingerBands.timeperiod': 18, 'feat.volatility.BollingerBands.nbdevup': 10, 'feat.volatility.BollingerBands.nbdevdn': 1, 'feat.volatility.BollingerBands.matype': 7, 'feat.momentum.ULTOSC.timeperiod1': 10, 'feat.momentum.ULTOSC.timeperiod2': 18, 'feat.momentum.ULTOSC.timeperiod3': 30, 'feat.momentum.STOCHF_Fast.fastk_period': 3, 'feat.momentum.STOCHF_Fast.fastd_period': 6, 'feat.momentum.STOCHF_Fast.fastd_matype': 6, 'feat.trend.AROON.timeperiod': 15}. Best is trial 13 with value: 23.7346.
[I 2026-02-27 21:11:38,141] Trial 13 finished with value: 1.0442 and parameters: {'model_key': 'rf', 'rf.n_estimators': 550, 'rf.max_depth': 4, 'th.mode': 'asymmetric', 'th.long_enter': 0.15000000000000002, 'th.short_enter_abs': 0.0, 'th.hysteresis': 0.05, 'risk.tp_mode': 'fixed', 'risk.tp_multiple': 1.0, 'risk.risk_pct': 0.005, 'risk.atr_mult': 2.75, 'features.target_count': 4, 'slot.trend.count': 2, 'slot.mom.count': 1, 'slot.vol.count': 1, 'slot.wild.count': 1, 'pool.broad.slot.trend.0.name': 'TrendContinuation2', 'pool.broad.slot.trend.1.name': 'GChannel', 'pool.broad.slot.mom.0.name': 'TDFI', 'pool.broad.slot.vol.0.name': 'BamsBung3', 'feat.trend.TrendContinuation2.n': 20, 'feat.trend.TrendContinuation2.t3_period': 8, 'feat.trend.TrendContinuation2.b': 0.5, 'feat.baseline.GChannel.length': 200, 'feat.baseline.GChannel.price': 'low', 'feat.momentum.TDFI.period': 28, 'feat.volatility.BamsBung3.length': 30, 'feat.volatility.BamsBung3.deviation': 1.5, 'feat.volatility.BamsBung3.money_risk': 0.02, 'feat.volatility.BamsBung3.signal_mode': 2, 'feat.volatility.BamsBung3.line_mode': 1}. Best is trial 12 with value: 13.549.
[I 2026-02-27 21:11:38,164] Trial 20 finished with value: 0.699 and parameters: {'model_key': 'linearsvm', 'svm.C': 0.08758360247363167, 'svm.max_iter': 2000, 'th.mode': 'symmetric', 'th.sym_base': 0.05, 'th.hysteresis': 0.0, 'risk.tp_mode': 'none', 'risk.risk_pct': 0.0175, 'risk.atr_mult': 2.75, 'features.target_count': 5, 'slot.trend.count': 1, 'slot.mom.count': 2, 'slot.vol.count': 0, 'slot.wild.count': 0, 'pool.broad.slot.trend.0.name': 'ChandelierExit', 'pool.broad.slot.mom.0.name': 'TDFI', 'pool.broad.slot.mom.1.name': 'Price Momentum Oscillator', 'pool.broad.slot.wild.0.name': 'Gd', 'pool.broad.slot.wild.1.name': 'TII', 'feat.trend.ChandelierExit.lookback': 15, 'feat.trend.ChandelierExit.atr_period': 9, 'feat.trend.ChandelierExit.atr_mult': 3.5, 'feat.momentum.TDFI.period': 22, 'feat.momentum.Price Momentum Oscillator.one': 40, 'feat.momentum.Price Momentum Oscillator.two': 30, 'feat.momentum.Price Momentum Oscillator.period': 20, 'feat.baseline.Gd.length': 10, 'feat.baseline.Gd.vf': 0.7, 'feat.baseline.Gd.price': 1, 'feat.trend.TII.length': 30, 'feat.trend.TII.ma_length': 30, 'feat.trend.TII.ma_method': 1, 'feat.trend.TII.price': 3}. Best is trial 18 with value: 55.6239.
[I 2026-02-27 21:11:38,941] Trial 19 pruned. Insufficient activity: Trades_Per_Day=0.0 < prune_threshold=0.04.
[I 2026-02-27 21:11:39,011] Trial 78 finished with value: 64.4361 and parameters: {'model_key': 'linearsvm', 'svm.C': 0.30826917716746216, 'svm.max_iter': 1000, 'th.mode': 'asymmetric', 'th.long_enter': 0.35000000000000003, 'th.short_enter_abs': 0.0, 'th.hysteresis': 0.06, 'risk.tp_mode': 'none', 'risk.risk_pct': 0.01, 'risk.atr_mult': 1.0, 'features.target_count': 5, 'slot.trend.count': 1, 'slot.mom.count': 2, 'slot.vol.count': 1, 'slot.wild.count': 0, 'pool.broad.slot.trend.0.name': 'AdaptiveSmootherTriggerlinesMtfAlertsNmc', 'pool.broad.slot.mom.0.name': 'METROFixed', 'pool.broad.slot.mom.1.name': 'METROFixed', 'pool.broad.slot.vol.0.name': 'VolatilityRatio', 'pool.broad.slot.wild.0.name': 'ADOSC', 'feat.trend.AdaptiveSmootherTriggerlinesMtfAlertsNmc.LsmaPeriod': 50, 'feat.trend.AdaptiveSmootherTriggerlinesMtfAlertsNmc.AdaptPeriod': 30, 'feat.momentum.METROFixed.period_rsi': 14, 'feat.momentum.METROFixed.step_size_fast': 10.0, 'feat.momentum.METROFixed.step_size_slow': 20.0, 'feat.momentum.TTF.ttf_bars': 12, 'feat.momentum.TTF.top_line': 70.0, 'feat.momentum.TTF.bottom_line': -70.0, 'feat.momentum.TTF.t3_period': 2, 'feat.volatility.VolatilityRatio.period': 25, 'feat.volume.ADOSC.fastperiod': 7, 'feat.volume.ADOSC.slowperiod': 16}. Best is trial 56 with value: 65.7867.
[I 2026-02-27 21:11:39,014] Trial 6 finished with value: 61.5527 and parameters: {'model_key': 'linearsvm', 'svm.C': 1.571270862967951, 'svm.max_iter': 1200, 'th.mode': 'symmetric', 'th.sym_base': 0.4, 'th.hysteresis': 0.04, 'risk.tp_mode': 'none', 'risk.risk_pct': 0.02, 'risk.atr_mult': 1.75, 'features.target_count': 5, 'slot.trend.count': 2, 'slot.mom.count': 1, 'slot.vol.count': 1, 'slot.wild.count': 0, 'pool.broad.slot.trend.0.name': 'HMA', 'pool.broad.slot.trend.1.name': 'GruchaIndex', 'pool.broad.slot.mom.0.name': 'ErgodicTVI', 'pool.broad.slot.vol.0.name': 'CVI_Multi', 'pool.broad.slot.wild.0.name': 'forecast', 'feat.baseline.HMA.period': 9, 'feat.trend.GruchaIndex.period': 20, 'feat.trend.GruchaIndex.ma_period': 45, 'feat.momentum.ErgodicTVI.Period1': 16, 'feat.momentum.ErgodicTVI.Period2': 20, 'feat.momentum.ErgodicTVI.Period3': 1, 'feat.momentum.ErgodicTVI.EPeriod1': 5, 'feat.momentum.ErgodicTVI.EPeriod2': 5, 'feat.momentum.ErgodicTVI.EPeriod3': 5, 'feat.volatility.CVI_Multi.length': 21, 'feat.volatility.CVI_Multi.method': 3, 'feat.volatility.CVI_Multi.use_modified': True, 'feat.trend.forecast.length': 30, 'feat.trend.forecast.price': 6}. Best is trial 6 with value: 61.5527.
[I 2026-02-27 21:11:39,259] Trial 16 finished with value: 1.3823 and parameters: {'model_key': 'rf', 'rf.n_estimators': 250, 'rf.max_depth': 9, 'th.mode': 'symmetric', 'th.sym_base': 0.25, 'th.hysteresis': 0.0, 'risk.tp_mode': 'fixed', 'risk.tp_multiple': 2.0, 'risk.risk_pct': 0.0175, 'risk.atr_mult': 2.75, 'features.target_count': 6, 'slot.trend.count': 1, 'slot.mom.count': 1, 'slot.vol.count': 1, 'slot.wild.count': 1, 'pool.broad.slot.trend.0.name': 'TP', 'pool.broad.slot.mom.0.name': 'MACD', 'pool.broad.slot.vol.0.name': 'William Vix-Fix', 'pool.broad.slot.wild.0.name': 'Trimagen', 'pool.broad.slot.wild.1.name': 'ROCP', 'feat.trend.TP.length': 21, 'feat.trend.TP.show_updn': True, 'feat.momentum.MACD.fastperiod': 7, 'feat.momentum.MACD.slowperiod': 26, 'feat.momentum.MACD.signalperiod': 5, 'feat.volatility.William Vix-Fix.period': 7, 'feat.baseline.Trimagen.period': 50, 'feat.baseline.Trimagen.applied_price': 'close', 'feat.momentum.ROCP.timeperiod': 10, 'feat.trend.AROON.timeperiod': 17}. Best is trial 10 with value: 43.146.
[I 2026-02-27 21:11:39,571] Trial 21 finished with value: 3.4221 and parameters: {'model_key': 'linearsvm', 'svm.C': 0.6425651082668591, 'svm.max_iter': 1800, 'th.mode': 'asymmetric', 'th.long_enter': 0.25, 'th.short_enter_abs': 0.05, 'th.hysteresis': 0.09, 'risk.tp_mode': 'none', 'risk.risk_pct': 0.0175, 'risk.atr_mult': 2.25, 'features.target_count': 6, 'slot.trend.count': 2, 'slot.mom.count': 1, 'slot.vol.count': 0, 'slot.wild.count': 0, 'pool.broad.slot.trend.0.name': 'Ehlers Early Onset Trend', 'pool.broad.slot.trend.1.name': 'GeominMA', 'pool.broad.slot.mom.0.name': 'CMO', 'pool.broad.slot.wild.0.name': 'STOCH_Slow', 'pool.broad.slot.wild.1.name': 'ULTOSC', 'feat.trend.Ehlers Early Onset Trend.period': 30, 'feat.trend.GeominMA.length': 14, 'feat.trend.GeominMA.price': 4, 'feat.momentum.CMO.timeperiod': 30, 'feat.momentum.STOCH_Slow.fastk_period': 5, 'feat.momentum.STOCH_Slow.slowk_period': 4, 'feat.momentum.STOCH_Slow.slowk_matype': 1, 'feat.momentum.STOCH_Slow.slowd_period': 6, 'feat.momentum.STOCH_Slow.slowd_matype': 5, 'feat.momentum.ULTOSC.timeperiod1': 6, 'feat.momentum.ULTOSC.timeperiod2': 16, 'feat.momentum.ULTOSC.timeperiod3': 26, 'feat.trend.AROON.timeperiod': 30}. Best is trial 18 with value: 55.6239.
[I 2026-02-27 21:11:39,855] Trial 14 pruned. Insufficient activity: Trades_Per_Day=0.0 < prune_threshold=0.04.
[I 2026-02-27 21:11:40,284] Trial 17 finished with value: 0.6998 and parameters: {'model_key': 'linearsvm', 'svm.C': 0.04815059197442654, 'svm.max_iter': 600, 'th.mode': 'asymmetric', 'th.long_enter': 0.0, 'th.short_enter_abs': 0.05, 'th.hysteresis': 0.07, 'risk.tp_mode': 'fixed', 'risk.tp_multiple': 2.0, 'risk.risk_pct': 0.0075, 'risk.atr_mult': 2.25, 'features.target_count': 4, 'slot.trend.count': 2, 'slot.mom.count': 1, 'slot.vol.count': 0, 'slot.wild.count': 1, 'pool.broad.slot.trend.0.name': 'AROONOSC', 'pool.broad.slot.trend.1.name': 'SineWMA', 'pool.broad.slot.mom.0.name': 'true-strength-index', 'pool.broad.slot.wild.0.name': 'EhlersTwoPoleSuperSmootherFilter', 'feat.trend.AROONOSC.timeperiod': 17, 'feat.baseline.SineWMA.length': 50, 'feat.baseline.SineWMA.price': 5, 'feat.momentum.true-strength-index.first_r': 5, 'feat.momentum.true-strength-index.second_s': 21, 'feat.baseline.EhlersTwoPoleSuperSmootherFilter.cutoff_period': 15}. Best is trial 10 with value: 43.146.
[I 2026-02-27 21:11:40,437] Trial 22 finished with value: 0.4395 and parameters: {'model_key': 'linearsvm', 'svm.C': 5.297637368160315, 'svm.max_iter': 400, 'th.mode': 'symmetric', 'th.sym_base': 0.2, 'th.hysteresis': 0.06, 'risk.tp_mode': 'fixed', 'risk.tp_multiple': 1.5, 'risk.risk_pct': 0.0175, 'risk.atr_mult': 2.25, 'features.target_count': 6, 'slot.trend.count': 1, 'slot.mom.count': 1, 'slot.vol.count': 0, 'slot.wild.count': 0, 'pool.broad.slot.trend.0.name': 'BraidFilter', 'pool.broad.slot.mom.0.name': 'SmoothedMomentum', 'pool.broad.slot.wild.0.name': 'AcceleratorLSMA', 'pool.broad.slot.wild.1.name': 'VAR', 'feat.baseline.BraidFilter.period1': 5, 'feat.baseline.BraidFilter.period2': 9, 'feat.baseline.BraidFilter.period3': 24, 'feat.baseline.BraidFilter.pips_min_sep_percent': 0.1, 'feat.momentum.SmoothedMomentum.momentum_length': 14, 'feat.momentum.SmoothedMomentum.use_smoothing': False, 'feat.momentum.SmoothedMomentum.smoothing_method': 2, 'feat.momentum.SmoothedMomentum.smoothing_length': 100, 'feat.momentum.SmoothedMomentum.price': 2, 'feat.baseline.AcceleratorLSMA.long_period': 15, 'feat.baseline.AcceleratorLSMA.short_period': 7, 'feat.volatility.VAR.timeperiod': 10, 'feat.volatility.VAR.nbdev': 9, 'feat.trend.AROON.timeperiod': 5, 'feat.trend.AROONOSC.timeperiod': 17}. Best is trial 18 with value: 55.6239.
[I 2026-02-27 21:11:41,728] Trial 23 finished with value: 0.6652 and parameters: {'model_key': 'linearsvm', 'svm.C': 1.4462229255340853, 'svm.max_iter': 1800, 'th.mode': 'asymmetric', 'th.long_enter': 0.4, 'th.short_enter_abs': 0.4, 'th.hysteresis': 0.05, 'risk.tp_mode': 'none', 'risk.risk_pct': 0.01, 'risk.atr_mult': 1.0, 'features.target_count': 5, 'slot.trend.count': 1, 'slot.mom.count': 1, 'slot.vol.count': 1, 'slot.wild.count': 0, 'pool.broad.slot.trend.0.name': 'BraidFilter', 'pool.broad.slot.mom.0.name': 'PPO', 'pool.broad.slot.vol.0.name': 'Stiffness Indicator', 'pool.broad.slot.wild.0.name': 'ULTOSC', 'pool.broad.slot.wild.1.name': '2nd Order Gaussian High Pass Filter MTF Zones', 'feat.baseline.BraidFilter.period1': 6, 'feat.baseline.BraidFilter.period2': 8, 'feat.baseline.BraidFilter.period3': 26, 'feat.baseline.BraidFilter.pips_min_sep_percent': 0.3, 'feat.momentum.PPO.fastperiod': 5, 'feat.momentum.PPO.slowperiod': 20, 'feat.momentum.PPO.matype': 8, 'feat.volatility.Stiffness Indicator.period1': 200, 'feat.volatility.Stiffness Indicator.method1': 'sma', 'feat.volatility.Stiffness Indicator.period3': 60, 'feat.volatility.Stiffness Indicator.period2': 2, 'feat.volatility.Stiffness Indicator.method2': 'ema', 'feat.momentum.ULTOSC.timeperiod1': 9, 'feat.momentum.ULTOSC.timeperiod2': 24, 'feat.momentum.ULTOSC.timeperiod3': 26, 'feat.trend.2nd Order Gaussian High Pass Filter MTF Zones.alpha': 0.2}. Best is trial 18 with value: 55.6239.
